Symbol,Name,Last Sale,Net Change,% Change,Market Cap,Country,IPO Year,Volume,Sector,Industry
CTAAR,ClearThink 1 Acquisition Corp. Rights,$0.1851,0.0051,2.833%,0.00,United States,2026,84712,,
CTAAU,ClearThink 1 Acquisition Corp. Units,$10.02,-0.01,-0.10%,0.00,United States,2026,2620,Finance,Blank Checks
CTAS,Cintas Corporation Common Stock,$174.71,0.76,0.437%,69899220560.00,United States,1983,2808518,Industrials,Garments and Clothing
CTBB,Qwest Corporation 6.5% Notes due 2056,$18.35,0.25,1.381%,18.00,United States,2016,276784,Telecommunications,Telecommunications Equipment
CTBI,Community Trust Bancorp Inc. Common Stock,$64.93,-0.12,-0.184%,1178529561.00,United States,,84398,Finance,Major Banks
CTDD,Qwest Corporation 6.75% Notes due 2057,$18.59,0.18,0.978%,19.00,United States,2017,240910,Telecommunications,Telecommunications Equipment
CTEV,Claritev Corporation Class A Common Stock,$24.33,1.27,5.507%,412805164.00,United States,2020,60126,Real Estate,Real Estate
CTGO,Contango Silver & Gold Inc. Common Stock,$22.95,1.04,4.747%,386049317.00,United States,2021,625716,Basic Materials,Precious Metals
CTKB,Cytek Biosciences Inc. Common Stock,$4.56,0.12,2.703%,588890197.00,United States,2021,1089323,Industrials,Biotechnology: Laboratory Analytical Instruments
CTLP,Cantaloupe Inc. Common Stock,$10.92,0.05,0.46%,805024518.00,United States,,1578171,Miscellaneous,Office Equipment/Supplies/Services
CTM,Castellum Inc. Common Stock,$0.6645,0.0238,3.715%,62870172.00,,2022,476617,Consumer Discretionary,Professional Services
CTMX,CytomX Therapeutics Inc. Common Stock,$4.22,0.17,4.198%,718188051.00,United States,2015,4340986,Health Care,Biotechnology: Pharmaceutical Preparations
CTNM,Contineum Therapeutics Inc. Class A Common Stock,$12.82,0.78,6.478%,478647982.00,United States,2024,280246,Health Care,Biotechnology: Pharmaceutical Preparations
CTNT,Cheetah Net Supply Chain Service Inc Class A Common Stock,$3.25,-0.12,-3.561%,6367868.00,United States,2023,2788437,Consumer Discretionary,Motor Vehicles
CTO,CTO Realty Growth Inc. Common Stock,$20.25,-0.18,-0.881%,684117738.00,United States,1992,394987,Real Estate,Real Estate Investment Trusts
CTO^A,CTO Realty Growth Inc. 6.375% Series A Cumulative Redeemable Preferred Stock,$20.92,0.10,0.48%,,United States,,1282,,
CTOR,Citius Oncology Inc. Common Stock,$0.8799,0.0199,2.314%,77673352.00,United States,2022,33958,Health Care,Biotechnology: Pharmaceutical Preparations
CTOS,Custom Truck One Source Inc. Common Stock,$9.85,0.72,7.886%,2240213287.00,Cayman Islands,2017,2390983,Consumer Discretionary,Diversified Commercial Services
CTRA,Coterra Energy Inc. Common Stock,$35.91,0.23,0.645%,27265483196.00,United States,,5859864,Energy,Oil & Gas Production
CTRE,CareTrust REIT Inc. Common Stock,$39.45,0.50,1.284%,8806708921.00,United States,2022,1682600,Real Estate,Real Estate Investment Trusts
CTRI,Centuri Holdings Inc. Common Stock,$37.60,2.42,6.879%,3791753764.00,United States,2024,1476509,Utilities,Oil & Gas Production
CTRM,Castor Maritime Inc. Common Shares,$2.06,-0.04,-1.905%,19904449.00,Cyprus,,25848,Consumer Discretionary,Marine Transportation
CTRN,Citi Trends Inc. Common Stock,$48.71,0.92,1.925%,613143360.00,United States,2005,83026,Consumer Discretionary,Clothing/Shoe/Accessory Stores
CTS,CTS Corporation Common Stock,$57.10,2.67,4.905%,1632655161.00,United States,,410597,Technology,Electrical Products
CTSH,Cognizant Technology Solutions Corporation Class A Common Stock,$52.90,-1.80,-3.291%,25067694910.00,United States,1998,8342885,Technology,EDP Services
CTSO,Cytosorbents Corporation Common Stock,$0.61,-0.0257,-4.043%,38247000.00,United States,,18018,Health Care,Medical/Dental Instruments
CTVA,Corteva Inc. Common Stock ,$81.01,1.64,2.066%,54386590227.00,United States,2019,3562786,Consumer Staples,Farming/Seeds/Milling
CTW,CTW Cayman Class A Ordinary Shares,$2.67,-0.01,-0.373%,166608000.00,Japan,2025,31052,Technology,EDP Services
CTXR,Citius Pharmaceuticals Inc. Common Stock,$0.696,0.1009,16.955%,15230945.00,United States,,1478917,Health Care,Biotechnology: Pharmaceutical Preparations
CUB,Lionheart Holdings Class A Ordinary Shares,$10.78,-0.01,-0.093%,342465249.00,United States,2024,322,Industrials,Industrial Machinery/Components
CUBB,Customers Bancorp Inc 5.375% Subordinated Notes Due 2034,$22.72,0.00,0.00%,718485693.00,United States,2019,28,Finance,Major Banks
CUBE,CubeSmart Common Shares,$40.48,0.77,1.939%,9227934427.00,United States,,2518834,Real Estate,Real Estate Investment Trusts
CUBI,Customers Bancorp Inc Common Stock,$76.27,0.45,0.594%,2568845599.00,United States,,312191,Finance,Major Banks
CUBWU,Lionheart Holdings Unit,$10.75,0.00,0.00%,0.00,United States,2024,113,Finance,Blank Checks
CUE,Cue Biopharma Inc. Common Stock,$14.74,1.74,13.385%,47984006.00,United States,2018,1897318,Health Care,Biotechnology: Pharmaceutical Preparations
CUK,Carnival Plc ADS ADS,$26.45,0.88,3.442%,37771019206.00,United States,,3248622,Consumer Discretionary,Marine Transportation
CULP,Culp Inc. Common Stock,$3.29,0.03,0.92%,41660559.00,United States,,24015,Consumer Discretionary,Textiles
CUPR,Cuprina Holdings (Cayman) Limited Class A Ordinary Shares,$0.252,-0.0163,-6.075%,5405400.00,Singapore,2025,393274,Health Care,Biotechnology: Pharmaceutical Preparations
CURB,Curbline Properties Corp. Common Stock,$27.60,-0.03,-0.109%,2912885894.00,United States,2024,640477,Finance,Real Estate
CURI,CuriosityStream Inc. Class A Common Stock,$3.15,0.06,1.942%,186755940.00,United States,2020,444840,Consumer Discretionary,Movies/Entertainment
CURR,Currenc Group Inc. Ordinary Shares,$3.56,0.21,6.269%,272736741.00,Singapore,,172934,Real Estate,Real Estate
CURV,Torrid Holdings Inc. Common Stock,$1.72,0.04,2.381%,171137377.00,United States,2021,117303,Consumer Discretionary,Clothing/Shoe/Accessory Stores
CURX,Curanex Pharmaceuticals Inc Common Stock,$0.417,0.003,0.725%,11828127.00,United States,2025,37756,Health Care,Biotechnology: Pharmaceutical Preparations
CUZ,Cousins Properties Incorporated Common Stock,$25.61,0.55,2.195%,4213877928.00,United States,,5345628,Real Estate,Real Estate Investment Trusts
CV,CapsoVision Inc. Common Stock,$7.08,0.68,10.625%,352936074.00,United States,2025,245159,Health Care,Biotechnology: Electromedical & Electrotherapeutic Apparatus
CVBF,CVB Financial Corporation Common Stock,$20.37,0.13,0.642%,2765938006.00,United States,,4083672,Finance,Major Banks
CVCO,Cavco Industries Inc. Common Stock When Issued,$507.00,8.72,1.75%,3934909641.00,United States,,236866,Consumer Discretionary,Homebuilding
CVE,Cenovus Energy Inc Common Stock,$29.24,0.49,1.704%,54960488482.00,Canada,,6715958,Energy,Oil & Gas Production
CVEO,Civeo Corporation (Canada) Common Shares,$31.90,0.68,2.178%,349091174.00,,2014,67831,Consumer Discretionary,Hotels/Resorts
CVGI,Commercial Vehicle Group Inc. Common Stock,$4.18,0.21,5.29%,153130960.00,United States,2004,240505,Consumer Discretionary,Auto Parts:O.E.M.
CVGW,Calavo Growers Inc. Common Stock,$28.16,0.09,0.321%,503334065.00,United States,,242394,Consumer Discretionary,Specialty Foods
CVI,CVR Energy Inc. Common Stock,$33.14,-0.99,-2.901%,3331584051.00,United States,2007,1773090,Energy,Integrated oil Companies
CVKD,Cadrenal Therapeutics Inc. Common Stock,$6.67,1.08,19.32%,20531907.00,United States,2023,114304,Health Care,Biotechnology: Pharmaceutical Preparations
CVLG,Covenant Logistics Group Inc. Class A Common Stock,$34.86,0.02,0.057%,874713290.00,United States,,194499,Industrials,Trucking Freight/Courier Services
CVLT,Commvault Systems Inc. Common Stock,$98.88,-2.30,-2.273%,4348187387.00,United States,2006,846570,Technology,Computer Software: Prepackaged Software
CVM,Cel-Sci Corporation Common Stock,$3.07,0.16,5.498%,26072825.00,United States,1997,46985,Health Care,Biotechnology: Biological Products (No Diagnostic Substances)
CVNA,Carvana Co. Class A Common Stock,$395.80,-0.79,-0.199%,86825517178.00,United States,2017,5788587,Consumer Discretionary,Retail-Auto Dealers and Gas Stations
CVR,Chicago Rivet & Machine Co. Common Stock,$11.40,0.10,0.885%,11013905.00,United States,1930,914,Industrials,Industrial Machinery/Components
CVRX,CVRx Inc. Common Stock,$7.51,0.64,9.316%,198496172.00,United States,2021,257443,Health Care,Medical/Dental Instruments
CVS,CVS Health Corporation Common Stock,$83.29,-0.61,-0.727%,106744830726.00,United States,,8332099,Consumer Staples,Retail-Drug Stores and Proprietary Stores
CVSA,Covista Inc. Common Shares,$115.22,0.60,0.523%,3976072020.00,United States,,225069,Real Estate,Other Consumer Services
CVU,CPI Aerostructures Inc. Common Stock,$3.60,-0.02,-0.552%,47554808.00,United States,2022,15412,Industrials,Military/Government/Technical
CVV,CVD Equipment Corporation Common Stock,$6.78,0.24,3.67%,47035152.00,United States,,133513,Technology,Industrial Machinery/Components
CVX,Chevron Corporation Common Stock,$193.31,1.09,0.567%,385128721604.00,United States,,11748664,Energy,Integrated oil Companies
CW,Curtiss-Wright Corporation Common Stock,$720.20,23.97,3.443%,26580544554.00,United States,,190357,Technology,Industrial Machinery/Components
CWAN,Clearwater Analytics Holdings Inc. Class A Common Stock,$24.20,0.07,0.29%,7150282355.00,United States,2021,3004512,Technology,Computer Software: Prepackaged Software
CWBC,Community West Bancshares Common Stock,$23.72,0.12,0.508%,642963215.00,United States,,155769,Finance,Major Banks
CWCO,Consolidated Water Co. Ltd. Ordinary Shares,$32.05,-0.37,-1.141%,512806090.00,Cayman Islands,,109349,Utilities,Water Supply
CWD,CaliberCos Inc. Class A Common Stock,$1.04,0.00,0.00%,7335184.00,United States,2023,40789,Finance,Real Estate
CWEN,Clearway Energy Inc. Class C Common Stock,$40.36,2.17,5.682%,8282635530.00,United States,2015,2180052,Utilities,Electric Utilities: Central
CWH,Camping World Holdings Inc. Class A Common Stock,$8.19,1.26,18.182%,843461466.00,United States,2016,7116983,Consumer Discretionary,Retail-Auto Dealers and Gas Stations
CWK,Cushman & Wakefield Ltd. Common Shares,$14.04,0.09,0.645%,3289394436.00,United States,2018,1993397,Finance,Real Estate
CWST,Casella Waste Systems Inc. Class A Common Stock,$79.25,1.14,1.459%,5041079582.00,United States,1997,852837,Utilities,Environmental Services
CWT,California Water Service Group Common Stock,$42.24,-3.14,-6.919%,2527821289.00,United States,,1156007,Utilities,Water Supply
CX,Cemex S.A.B. de C.V. Sponsored ADR,$12.30,0.13,1.068%,18645768215.00,Mexico,,4141219,Industrials,Building Materials
CXAI,CXApp Inc. Class A Common Stock,$0.164,0.0111,7.26%,11318531.00,United States,2021,4157045,Technology,EDP Services
CXAIW,CXApp Inc. Warrant,$0.0398,0.00,0.00%,2746814.00,United States,2021,1231,Technology,EDP Services
CXDO,Crexendo Inc. Common Stock,$6.54,-0.02,-0.305%,203738024.00,United States,,139742,Telecommunications,Telecommunications Equipment
CXE,MFS High Income Municipal Trust Common Stock,$3.70,0.02,0.543%,116645360.00,United States,1989,89542,Finance,Investment Managers
CXH,MFS Investment Grade Municipal Trust Common Stock,$8.35,0.01,0.12%,76070546.00,United States,1989,272418,Finance,Investment Managers
CXIIU,Churchill Capital Corp XII Units,$10.11,0.01,0.099%,0.00,United States,2026,177436,Finance,Blank Checks
CXM,Sprinklr Inc. Class A Common Stock,$4.92,-0.07,-1.403%,1224412577.00,United States,2021,4023373,Technology,Computer Software: Prepackaged Software
CXT,Crane NXT Co. Common Stock,$44.68,1.06,2.43%,2570766028.00,United States,,654342,Industrials,Metal Fabrications
CXW,CoreCivic Inc. Common Stock,$20.46,-0.08,-0.389%,2023223560.00,United States,,613582,Real Estate,Real Estate Investment Trusts
CYAB,Cyabra Inc. Common Stock,$0.9801,-0.013,-1.309%,13539224.00,Israel,,92597,Technology,Computer Software: Prepackaged Software
CYCN,Cyclerion Therapeutics Inc. Common Stock,$3.31,-0.01,-0.301%,14333339.00,United States,,83258,Health Care,Biotechnology: Pharmaceutical Preparations
CYCU,Cycurion Inc. Common Stock,$1.05,0.1346,14.704%,5785487.00,United States,2025,1670487,Technology,EDP Services
CYCUW,Cycurion Inc. Warrant,$0.0218,0.0009,4.306%,120118.00,United States,2025,52417,Technology,EDP Services
CYD,China Yuchai International Limited Common Stock,$41.21,1.13,2.819%,1546130050.00,Singapore,1994,90136,Industrials,Industrial Machinery/Components
CYH,Community Health Systems Inc. Common Stock,$2.84,-0.03,-1.045%,400203462.00,United States,2000,2096981,Health Care,Hospital/Nursing Management
CYN,Cyngn Inc. Common Stock,$1.70,0.04,2.41%,23134078.00,United States,2021,280359,Technology,EDP Services
CYPH,Cypherpunk Technologies Inc. Common Stock,$0.8891,0.039,4.588%,86846157.00,United States,,3733788,Health Care,Biotechnology: Pharmaceutical Preparations
CYRX,CryoPort Inc. Common Stock,$10.26,0.46,4.694%,515030516.00,United States,,341662,Health Care,Biotechnology: Pharmaceutical Preparations
CYTK,Cytokinetics Incorporated Common Stock,$63.97,4.39,7.368%,7947493473.00,United States,2004,2723507,Health Care,Biotechnology: Pharmaceutical Preparations
CZFS,Citizens Financial Services Inc. Common Stock,$63.16,-1.79,-2.756%,303623952.00,United States,,5705,Finance,Major Banks
CZNC,Citizens & Northern Corp Common Stock,$22.08,-0.92,-4.00%,395458165.00,United States,,51705,Finance,Major Banks
CZR,Caesars Entertainment Inc. Common Stock,$27.80,0.42,1.534%,5662218654.00,United States,,4986795,Consumer Discretionary,Hotels/Resorts
CZWI,Citizens Community Bancorp Inc. Common Stock,$20.75,-0.08,-0.384%,199793699.00,United States,2006,14981,Finance,Savings Institutions
D,Dominion Energy Inc. Common Stock,$64.50,2.00,3.20%,56693224247.00,United States,,8054353,Utilities,Electric Utilities: Central
DAAQ,Digital Asset Acquisition Corp. Class A Ordinary shares,$10.28,0.00,0.00%,0.00,United States,2025,84709,Finance,Blank Checks
DAAQW,Digital Asset Acquisition Corp. Warrant,$0.3984,0.0334,9.151%,0.00,United States,2025,700,Finance,Blank Checks
DAC,Danaos Corporation Common Stock,$120.41,0.59,0.492%,2191880425.00,Greece,2006,100121,Consumer Discretionary,Marine Transportation
DAIC,CID HoldCo Inc. Common Stock,$0.1973,0.0057,2.975%,5779572.00,United States,,183902,Technology,EDP Services
DAICW,CID HoldCo Inc. Warrants,$0.0161,-0.0045,-21.845%,471622.00,United States,,5754,Technology,EDP Services
DAIO,Data I/O Corporation Common Stock,$2.71,0.13,5.039%,25458884.00,United States,1981,24297,Industrials,Electrical Products
DAKT,Daktronics Inc. Common Stock,$19.66,0.62,3.256%,949540843.00,United States,1994,229896,Consumer Discretionary,Miscellaneous manufacturing industries
DAL,Delta Air Lines Inc. Common Stock,$67.99,1.72,2.595%,44669045177.00,United States,,6294452,Consumer Discretionary,Air Freight/Delivery Services
DAN,Dana Incorporated Common Stock ,$36.45,0.63,1.759%,3993334644.00,United States,,1360800,Consumer Discretionary,Auto Parts:O.E.M.
DAO,Youdao Inc. American Depositary Shares each representing one Class A Ordinary Share,$11.74,0.24,2.087%,1416250568.00,China,2019,71638,Real Estate,Other Consumer Services
DAR,Darling Ingredients Inc. Common Stock,$64.23,1.43,2.277%,10195177801.00,United States,1997,4441796,Consumer Staples,Packaged Foods
DARE,Dare Bioscience Inc. Common Stock,$2.28,0.18,8.571%,33195665.00,United States,2014,238098,Health Care,Biotechnology: Pharmaceutical Preparations
DASH,DoorDash Inc. Class A Common Stock,$168.65,-0.68,-0.402%,73703341711.00,United States,,3312854,Technology,EDP Services
DAVA,Endava plc American Depositary Shares (each representing one Class A Ordinary Share),$4.02,-0.23,-5.412%,218396964.00,United Kingdom,2018,561322,Technology,EDP Services
DAVE,Dave Inc. Class A Common Stock,$271.99,14.72,5.722%,3485107962.00,United States,,528505,Finance,Finance: Consumer Services
DAVEW,Dave Inc. Warrants,$1.03,0.3419,49.688%,13197769.00,United States,,53293,Finance,Finance: Consumer Services
DB,Deutsche Bank AG Common Stock,$31.05,0.38,1.239%,59084214847.00,Germany,,5008702,Finance,Major Banks
DBCA,D. Boral Acquisition I Corp. Class A Ordinary Shares,$9.88,-0.01,-0.101%,0.00,United States,2026,12647,Finance,Blank Checks
DBD,Diebold Nixdorf Incorporated Common stock,$76.81,-6.15,-7.413%,2673690735.00,United States,2023,813101,Miscellaneous,Office Equipment/Supplies/Services
DBGI,Digital Brands Group Inc. Common Stock,$1.34,-0.08,-5.634%,21881357.00,United States,2025,586108,Consumer Discretionary,Clothing/Shoe/Accessory Stores
DBI,Designer Brands Inc. Class A Common Stock,$7.50,0.18,2.459%,380296650.00,United States,,356651,Consumer Discretionary,Clothing/Shoe/Accessory Stores
DBL,DoubleLine Opportunistic Credit Fund Common Shares of Beneficial Interest,$14.44,0.11,0.768%,0.00,United States,2012,65217,,
DBRG,DigitalBridge Group Inc.,$15.56,0.00,0.00%,2837714264.00,United States,2014,2602017,Real Estate,Real Estate Investment Trusts
DBRG^H,DigitalBridge Group Inc. 7.125% Series H ,$17.38,0.6399,3.823%,,United States,,27294,,
DBRG^I,DigitalBridge Group Inc. 7.15% Series I ,$17.23,0.4206,2.502%,,United States,,35659,,
DBRG^J,DigitalBridge Group Inc. 7.125% Series J ,$17.43,0.34,1.989%,,United States,,329698,,
DBVT,DBV Technologies S.A. American Depositary Shares,$21.00,0.70,3.448%,1243378269.00,France,2014,243805,Health Care,Biotechnology: Biological Products (No Diagnostic Substances)
DBX,Dropbox Inc. Class A Common Stock,$24.29,-0.02,-0.082%,5796530307.00,United States,2018,3026278,Technology,Computer Software: Prepackaged Software
DC,Dakota Gold Corp. Common Stock,$5.38,0.08,1.509%,718322412.00,United States,2022,897250,Basic Materials,Metal Mining
DCBG,Dime Community Bancshares Inc. 9.000% Fixed-to-Floating Rate Subordinated Notes due 2034,$26.5599,0.1399,0.53%,1039783884.00,United States,,2436,Finance,Major Banks
DCBO,Docebo Inc. Common Shares,$19.14,0.69,3.74%,550551937.00,Canada,,182994,Technology,Computer Software: Prepackaged Software
DCGO,DocGo Inc. Common Stock,$0.7057,-0.0014,-0.198%,69707926.00,United States,2020,646730,Health Care,Medical/Nursing Services
DCH,Dauch Corporation Common Stock,$5.71,0.11,1.964%,1351824691.00,United States,,2251306,Consumer Discretionary,Auto Parts:O.E.M.
DCI,Donaldson Company Inc. Common Stock,$88.17,1.17,1.345%,10211341805.00,United States,,768194,Industrials,Pollution Control Equipment
DCO,Ducommun Incorporated Common Stock,$141.93,3.53,2.551%,2127097388.00,United States,,126241,Industrials,Military/Government/Technical
DCOM,Dime Community Bancshares Inc. Common Stock,$35.89,0.35,0.985%,1575098508.00,United States,,249895,Finance,Major Banks
DCOM^,Dime Community Bancshares Inc. Fixed-Rate Non-Cumulative Perpetual Preferred Stock Series A,$19.54,0.23,1.191%,,United States,,2098,,
DCOY,Decoy Therapeutics Inc. Common Stock,$6.05,0.51,9.206%,3218406.00,United States,2015,6555,Health Care,Biotechnology: Pharmaceutical Preparations
DCTH,Delcath Systems Inc. Common Stock,$10.38,0.17,1.665%,357638322.00,United States,,293640,Health Care,Medical/Dental Instruments
DCX,Digital Currency X Technology Inc. Class A Ordinary Shares,$2.10,0.02,0.962%,49606299.00,Cayman Islands,,13310,Industrials,Auto Manufacturing
DD,DuPont de Nemours Inc. Common Stock,$45.66,1.04,2.331%,18713946060.00,United States,2017,4045989,Industrials,Major Chemicals
DDC,DDC Enterprise Limited Class A Ordinary Shares,$1.50,-0.04,-2.597%,69038211.00,,2023,128395,Consumer Staples,Packaged Foods
DDD,3D Systems Corporation Common Stock,$2.46,0.30,13.889%,359305088.00,United States,,3239743,Technology,Computer Software: Prepackaged Software
DDI,DoubleDown Interactive Co. Ltd. American Depository Shares,$10.89,-0.01,-0.092%,539636962.00,South Korea,2021,141796,Technology,EDP Services
DDL,Dingdong (Cayman) Limited American Depositary Shares (each two representing three Ordinary Shares),$2.59,0.09,3.60%,611829704.00,Cayman Islands,2021,409563,Consumer Discretionary,Catalog/Specialty Distribution
DDOG,Datadog Inc. Class A Common Stock,$132.19,-1.79,-1.336%,47052002458.00,United States,2019,7160486,Technology,Computer Software: Prepackaged Software
DDS,Dillard's Inc. Common Stock,$569.22,7.14,1.27%,8889549155.00,United States,,84477,Consumer Discretionary,Department/Specialty Retail Stores
DDT,Dillard's Capital Trust I,$26.11,0.04,0.153%,407761724.00,United States,,6431,Consumer Discretionary,Department/Specialty Retail Stores
DE,Deere & Company Common Stock,$589.87,29.85,5.33%,159328182433.00,United States,,1562258,Industrials,Industrial Machinery/Components
DEA,Easterly Government Properties Inc. Common Stock,$23.41,0.24,1.036%,1087379845.00,United States,2015,292528,Real Estate,Real Estate Investment Trusts
DEC,Diversified Energy Company Common Stock,$16.65,0.29,1.773%,1277992245.00,United States,2025,638942,,
DECK,Deckers Outdoor Corporation Common Stock,$102.20,0.86,0.849%,14507287036.00,United States,1993,1792207,Consumer Discretionary,Shoe Manufacturing
DEFT,Defi Technologies Inc. Common Stock,$0.7601,0.0064,0.849%,294749479.00,Canada,,1768640,Finance,Finance: Consumer Services
DEI,Douglas Emmett Inc. Common Stock,$10.81,0.05,0.465%,1810515736.00,United States,2006,1860779,Real Estate,Real Estate Investment Trusts
DELL,Dell Technologies Inc. Class C Common Stock ,$208.95,3.29,1.60%,134929138836.00,United States,2018,5635833,Technology,Computer Manufacturing
DEO,Diageo plc Common Stock,$80.65,3.25,4.199%,44890043644.00,United Kingdom,,3046880,Consumer Staples,Beverages (Production/Distribution)
DERM,Journey Medical Corporation Common Stock,$5.15,0.15,3.00%,140753084.00,United States,2021,149128,Health Care,Biotechnology: Pharmaceutical Preparations
DETX,Liberty Defense Holdings Ltd. Common Shares,$3.96,-0.10,-2.463%,7857840.00,United States,,31310,Telecommunications,Telecommunications Equipment
DEVS,DevvStream Corp. Common Stock,$0.2862,-0.0017,-0.59%,1099478.00,Canada,2024,85018,Finance,Finance/Investors Services
DFDV,DeFi Development Corp. Common Stock,$4.39,0.34,8.395%,129493560.00,United States,2023,395879,Finance,Finance: Consumer Services
DFDVW,DeFi Development Corp. Warrant,$0.5311,0.0174,3.387%,15666066.00,United States,,926,,
DFH,Dream Finders Homes Inc. Class A Common Stock,$14.60,0.45,3.18%,1339824159.00,United States,2022,592391,Consumer Discretionary,Homebuilding
DFIN,Donnelley Financial Solutions Inc. Common Stock ,$50.30,-0.82,-1.604%,1435064282.00,United States,2016,200971,Consumer Discretionary,Other Consumer Services
DFLI,Dragonfly Energy Holdings Corp. Common Stock (NV),$2.01,0.08,4.145%,24419054.00,United States,2021,279929,Miscellaneous,Industrial Machinery/Components
DFLIW,Dragonfly Energy Holdings Corp. Warrant,$0.0417,0.004,10.61%,506604.00,United States,2021,2723,Miscellaneous,Industrial Machinery/Components
DFNS,T3 Defense Inc. Common Stock,$0.46,0.015,3.371%,17398827.00,United States,2020,1190329,Consumer Discretionary,Professional Services
DFNSW,T3 Defense Inc. Warrants,$0.0713,0.0026,3.785%,2696818.00,United States,2020,95737,Consumer Discretionary,Professional Services
DFP,Flaherty & Crumrine Dynamic Preferred and Income Fund Inc. Common Stock,$21.16,0.23,1.099%,0.00,,2013,61368,Finance,Investment Managers
DFSC,DEFSEC Technologies Inc. Common Stock,$3.06,0.53,20.949%,6100496.00,Canada,,434564,Technology,Computer Software: Prepackaged Software
DFTX,Definium Therapeutics Inc. Common Shares,$21.88,1.39,6.784%,2386381212.00,United States,,1579774,Health Care, Medicinal Chemicals and Botanical Products 
DG,Dollar General Corporation Common Stock,$115.88,1.75,1.533%,25519825962.00,United States,2009,3061354,Consumer Discretionary,Department/Specialty Retail Stores
DGICA,Donegal Group Inc. Class A Common Stock,$16.82,-0.81,-4.594%,622389854.00,United States,,179676,Finance,Property-Casualty Insurers
DGICB,Donegal Group Inc. Class B Common Stock,$19.25,-0.50,-2.532%,712307057.00,United States,1986,546,Finance,Property-Casualty Insurers
DGII,Digi International Inc. Common Stock,$56.04,1.39,2.543%,2107729406.00,United States,1989,315242,Telecommunications,Computer Communications Equipment
DGNX,Diginex Limited Ordinary Shares,$1.82,-0.57,-23.849%,52963713.00,Hong Kong,2025,1687806,Technology,EDP Services
DGX,Quest Diagnostics Incorporated Common Stock,$194.20,4.88,2.578%,21497246512.00,United States,,1110216,Health Care,Medical Specialities
DGXX,Digi Power X Inc. Subordinate Voting Shares,$3.37,0.26,8.36%,235251103.00,Canada,,1196965,Finance,Finance: Consumer Services
DH,Definitive Healthcare Corp. Class A Common Stock,$0.9531,0.0186,1.99%,136943612.00,United States,2021,220645,Technology,Computer Software: Prepackaged Software
DHC,Diversified Healthcare Trust Common Shares of Beneficial Interest,$7.54,-0.03,-0.396%,1825592529.00,United States,,1661501,Real Estate,Real Estate Investment Trusts
DHCNI,Diversified Healthcare Trust 5.625% Senior Notes due 2042,$17.85,0.125,0.705%,4309246272.00,United States,,13392,Real Estate,Real Estate Investment Trusts
DHCNL,Diversified Healthcare Trust 6.25% Senior Notes Due 2046,$18.86,0.06,0.319%,4553074773.00,United States,,8226,Real Estate,Real Estate Investment Trusts
DHF,BNY Mellon High Yield Strategies Fund Common Stock,$2.45,0.02,0.823%,0.00,United States,1998,453920,Finance,Finance Companies
DHI,D.R. Horton Inc. Common Stock,$153.86,2.21,1.457%,43631559256.00,United States,,1613833,Consumer Discretionary,Homebuilding
DHR,Danaher Corporation Common Stock,$178.95,0.15,0.084%,126655553702.00,United States,,5142692,Industrials,Industrial Machinery/Components
DHT,DHT Holdings Inc.,$18.48,0.21,1.149%,2976049452.00,Jersey,2005,2386732,Consumer Discretionary,Marine Transportation
DHX,DHI Group Inc. Common Stock,$2.39,-0.09,-3.629%,104917451.00,United States,2007,217863,Real Estate,Real Estate
DHY,Credit Suisse High Yield Credit Fund Common Stock,$1.76,0.00,0.00%,0.00,United States,1998,620236,Finance,Finance/Investors Services
DIBS,1stdibs.com Inc. Common Stock,$4.63,-0.31,-6.275%,168448799.00,United States,2021,171905,Consumer Discretionary,Catalog/Specialty Distribution
DIN,Dine Brands Global Inc. Common Stock,$27.78,0.46,1.684%,360593234.00,United States,,261160,Consumer Discretionary,Restaurants
