Symbol,Name,Last Sale,Net Change,% Change,Market Cap,Country,IPO Year,Volume,Sector,Industry
QSR,Restaurant Brands International Inc. Common Shares,$80.68,1.98,2.516%,36841379410.00,Canada,2014,4608776,Consumer Discretionary,Restaurants
QTI,QT Imaging Holdings Inc. Common Stock,$6.575,0.025,0.382%,79179438.00,United States,,47747,Health Care,Biotechnology: Electromedical & Electrotherapeutic Apparatus
QTRX,Quanterix Corporation Common Stock,$3.13,0.08,2.623%,147313412.00,United States,2017,981431,Industrials,Biotechnology: Laboratory Analytical Instruments
QTTB,Q32 Bio Inc. Common Stock,$5.60,0.10,1.818%,81924993.00,United States,2018,291794,Health Care,Biotechnology: Pharmaceutical Preparations
QTWO,Q2 Holdings Inc. Common Stock,$50.75,-1.76,-3.352%,3176971467.00,United States,2014,3196057,Technology,Computer Software: Prepackaged Software
QUAD,Quad Graphics Inc Class A Common Stock,$7.44,0.43,6.134%,383602851.00,United States,,260695,Consumer Discretionary,Publishing
QUBT,Quantum Computing Inc. Common Stock,$9.02,0.74,8.937%,2034208774.00,United States,,11042701,Technology,Computer Software: Prepackaged Software
QUCY,Quantum Cyber N.V. Ordinary Shares,$0.4265,-0.0304,-6.654%,5337791.00,Germany,2021,1247202,Health Care,Biotechnology: Pharmaceutical Preparations
QUIK,QuickLogic Corporation Common Stock,$15.97,1.87,13.262%,282995347.00,United States,1999,642497,Technology,Semiconductors
QUMS,Quantumsphere Acquisition Corp. Ordinary Shares,$10.16,0.00,0.00%,0.00,United States,2025,100,,
QUMSR,Quantumsphere Acquisition Corp. Rights,$0.26,0.04,18.182%,0.00,United States,2025,400,,
QURE,uniQure N.V. Ordinary Shares,$19.95,3.22,19.247%,1257513318.00,Netherlands,2014,4437591,Health Care,Biotechnology: Pharmaceutical Preparations
QXL,Quantum X Labs Inc. Common Stock,$3.11,3.11,,41476179.00,Israel,,42609,Technology,Computer Software: Prepackaged Software
QXO,QXO Inc. Common Stock,$20.07,0.46,2.346%,14551753540.00,United States,,14122196,Consumer Discretionary,RETAIL: Building Materials
QXO^B,QXO Inc.  Depositary Shares each representing a 1/20th interest in a share of 5.50% Series B Mandatory Convertible Preferred Stock,$56.58,0.81,1.452%,,United States,,40006,,
R,Ryder System Inc. Common Stock,$253.77,8.35,3.402%,9818619638.00,United States,,412347,Consumer Discretionary,Rental/Leasing Companies
RA,Brookfield Real Assets Income Fund Inc. Common Stock,$12.96,0.07,0.543%,0.00,United States,2016,334496,Finance,Investment Managers
RAAQ,Real Asset Acquisition Corp. Class A Ordinary Share,$10.90,0.00,0.00%,0.00,United States,2025,41635,Finance,Blank Checks
RAAQU,Real Asset Acquisition Corp. Unit,$12.50,0.00,0.00%,0.00,United States,2025,152,Finance,Blank Checks
RAAQW,Real Asset Acquisition Corp. Warrants,$2.425,0.025,1.042%,0.00,United States,2025,21635,Finance,Blank Checks
RAC,Rithm Acquisition Corp. Class A Ordinary Shares,$10.42,-0.015,-0.144%,0.00,,2025,12769,,
RACE,Ferrari N.V. Common Shares,$347.30,9.76,2.892%,81248936658.00,Italy,2015,556861,Industrials,Auto Manufacturing
RADX,Radiopharm Theranostics Limited American Depositary Shares,$4.27,-0.08,-1.839%,54459811.00,Australia,,21497,Health Care,Biotechnology: Pharmaceutical Preparations
RAIL,FreightCar America Inc. Common Stock,$8.24,0.11,1.353%,157072157.00,United States,2005,142945,Industrials,Railroads
RAIN,Rain Enhancement Technologies Holdco Inc. Class A Common Stock,$2.09,-0.145,-6.488%,17114661.00,United States,,17260,Technology,Industrial Machinery/Components
RAINW,Rain Enhancement Technologies Holdco Inc. Warrants,$0.21,-0.0056,-2.597%,1719655.00,United States,,645,Technology,Industrial Machinery/Components
RAL,Ralliant Corporation Common Stock,$45.44,1.82,4.172%,5086081251.00,United States,2025,1490610,Industrials,Industrial Machinery/Components
RAMP,LiveRamp Holdings Inc. Common Stock,$29.23,-0.41,-1.383%,1845140652.00,United States,2018,628527,Technology,EDP Services
RAND,Rand Capital Corporation Common Stock,$11.08,0.37,3.455%,32905539.00,United States,,3454,Finance,Finance: Consumer Services
RANG,Range Capital Acquisition Corp. Ordinary Shares,$10.60,0.02,0.189%,0.00,United States,2025,288,Finance,Blank Checks
RANGR,Range Capital Acquisition Corp. Rights,$0.295,0.005,1.724%,0.00,United States,2025,1000,Finance,Blank Checks
RANI,Rani Therapeutics Holdings Inc. Class A Common Stock,$0.8879,0.0144,1.649%,109826381.00,United States,2021,387387,Health Care,Biotechnology: Pharmaceutical Preparations
RAPP,Rapport Therapeutics Inc. Common Stock,$33.13,0.13,0.394%,1583866550.00,United States,2024,347916,Health Care,Biotechnology: Pharmaceutical Preparations
RARE,Ultragenyx Pharmaceutical Inc. Common Stock,$24.69,0.51,2.109%,2427210052.00,United States,2014,1790757,Health Care,Biotechnology: Pharmaceutical Preparations
RAVE,Rave Restaurant Group Inc. Common Stock,$2.77,0.04,1.465%,39366038.00,United States,,36971,Consumer Discretionary,Food Distributors
RAY,Raytech Holding Limited Ordinary Shares,$2.26,-0.1098,-4.633%,6158229.00,Hong Kong,2024,7847,Consumer Discretionary,Consumer Electronics/Appliances
RAYA,Erayak Power Solution Group Inc. Class A Ordinary Shares,$3.73,0.05,1.359%,3664982.00,China,2022,27535,Consumer Discretionary,Metal Fabrications
RBA,RB Global Inc. Common Stock,$104.30,-0.95,-0.903%,19367675809.00,Canada,,1635056,Real Estate,Real Estate
RBB,RBB Bancorp Common Stock,$24.12,0.41,1.729%,411828715.00,United States,2017,204171,Finance,Major Banks
RBBN,Ribbon Communications Inc. Common Stock,$2.64,0.265,11.158%,463340141.00,United States,,1308145,Technology,EDP Services
RBC,RBC Bearings Incorporated Common Stock,$599.09,14.60,2.498%,18942603345.00,United States,2022,191392,Industrials,Metal Fabrications
RBCAA,Republic Bancorp Inc. Class A Common Stock,$75.73,0.77,1.027%,1485015697.00,United States,1998,43055,Finance,Major Banks
RBKB,Rhinebeck Bancorp Inc. Common Stock,$16.34,0.25,1.554%,182239579.00,United States,2019,10329,Finance,Banks
RBLX,Roblox Corporation Class A Common Stock,$55.26,-1.02,-1.812%,39232725526.00,United States,2021,23970832,Technology,Computer Software: Prepackaged Software
RBNE,Robin Energy Ltd. Common Stock,$1.58,0.01,0.637%,4384287.00,Cyprus,,256200,Consumer Discretionary,Marine Transportation
RBRK,Rubrik Inc. Class A Common Stock,$53.18,-0.50,-0.931%,10944967078.00,United States,2024,2416447,Technology,Computer Software: Prepackaged Software
RC,Ready Capital Corporation Common Stock,$1.89,0.04,2.162%,307840892.00,United States,2013,1457166,Real Estate,Real Estate Investment Trusts
RC^C,Ready Capital Corporation 6.25% Series C Cumulative Convertible Preferred Stock,$12.0999,0.2399,2.023%,,United States,,511,,
RC^E,Ready Capital Corporation 6.50% Series E Cumulative Redeemable Preferred Stock,$12.55,0.065,0.521%,,United States,,10035,,
RCAT,Red Cat Holdings Inc. Common Stock,$11.72,0.65,5.872%,1419746314.00,United States,,6089068,Technology,Computer Software: Prepackaged Software
RCD,Ready Capital Corporation 9.00% Senior Notes due 2029,$22.01,0.11,0.502%,0.00,United States,2024,1395,Real Estate,Real Estate Investment Trusts
RCEL,Avita Medical Inc. Common Stock,$4.32,0.09,2.128%,132955296.00,United States,,126260,Health Care,Medical/Dental Instruments
RCG,RENN Fund Inc Common Stock,$2.79,0.03,1.087%,0.00,United States,,20400,Finance,Investment Managers
RCI,Rogers Communication Inc. Common Stock,$36.43,0.17,0.469%,19680370448.00,Canada,,737035,Telecommunications,Cable & Other Pay Television Services
RCKT,Rocket Pharmaceuticals Inc. Common Stock,$3.48,0.00,0.00%,379747473.00,United States,2015,1465152,Health Care,Biotechnology: Pharmaceutical Preparations
RCKY,Rocky Brands Inc. Common Stock,$36.67,0.46,1.27%,276519779.00,United States,1993,97389,Consumer Discretionary,Shoe Manufacturing
RCL,Royal Caribbean Cruises Ltd. Common Stock,$263.76,9.75,3.838%,70738512091.00,United States,1993,5219683,Consumer Discretionary,Marine Transportation
RCMT,RCM Technologies Inc. Common Stock,$31.29,-0.11,-0.35%,219792756.00,United States,,49882,Consumer Discretionary,Professional Services
RCON,Recon Technology Ltd. Class A Ordinary Shares,$0.93,-0.0687,-6.879%,28483506.00,China,2009,12319,Energy,Oilfield Services/Equipment
RCS,PIMCO Strategic Income Fund Inc.,$5.48,-0.05,-0.904%,0.00,United States,1994,198902,Finance,Investment Managers
RCT,RedCloud Holdings plc Ordinary Shares,$0.695,0.005,0.725%,38446255.00,United Kingdom,2025,234927,Technology,Computer Software: Programming Data Processing
RCUS,Arcus Biosciences Inc. Common Stock,$25.50,1.37,5.678%,3203531391.00,United States,2018,1163519,Health Care,Biotechnology: Pharmaceutical Preparations
RDAC,Rising Dragon Acquisition Corp. Ordinary Shares,$10.66,-9.85,-48.025%,0.00,China,2024,1205436,,
RDACR,Rising Dragon Acquisition Corp. Rights,$0.1301,-0.0359,-21.627%,0.00,China,2024,15967,Finance,Blank Checks
RDACU,Rising Dragon Acquisition Corp. Unit,$10.90,-5.10,-31.875%,0.00,China,2024,3818,Finance,Blank Checks
RDAG,Republic Digital Acquisition Company Class A Ordinary Shares,$10.25,-0.0029,-0.028%,0.00,United States,2025,14029,Finance,Blank Checks
RDAGW,Republic Digital Acquisition Company Warrants,$0.4499,-0.0051,-1.121%,0.00,United States,2025,2200,Finance,Blank Checks
RDCM,Radcom Ltd. Ordinary Shares,$15.96,0.44,2.835%,266379694.00,Israel,1997,374458,Technology,Computer peripheral equipment
RDDT,Reddit Inc. Class A Common Stock,$147.23,-0.52,-0.352%,28332226987.00,United States,2024,9383463,Technology,EDP Services
RDGT,Ridgetech Inc. Ordinary Shares,$1.38,0.01,0.73%,1240490.00,China,,132429,Consumer Staples,Retail-Drug Stores and Proprietary Stores
RDHL,Redhill Biopharma Ltd. American Depositary Shares,$1.09,0.05,4.808%,5550635.00,Israel,,32116,Health Care,Biotechnology: Pharmaceutical Preparations
RDI,Reading International Inc Class A Common Stock,$1.14,0.04,3.636%,25897676.00,United States,,3985,Consumer Discretionary,Movies/Entertainment
RDIB,Reading International Inc Class B Common Stock,$9.25,-0.25,-2.632%,210134655.00,United States,,2506,Consumer Discretionary,Movies/Entertainment
RDN,Radian Group Inc. Common Stock,$35.83,-1.48,-3.967%,4830839550.00,United States,,1849518,Finance,Property-Casualty Insurers
RDNT,RadNet Inc. Common Stock,$56.55,0.66,1.181%,4441196549.00,United States,,726006,Health Care,Medical Specialities
RDNW,RideNow Group Inc. Class B Common Stock,$7.31,0.05,0.689%,281797459.00,United States,,62759,Technology,EDP Services
RDVT,Red Violet Inc. Common Stock ,$37.43,-0.34,-0.90%,528226795.00,United States,,67915,Technology,Computer Software: Prepackaged Software
RDW,Redwire Corporation Common Stock,$9.19,0.59,6.86%,1828063110.00,United States,2021,14381591,Industrials,Military/Government/Technical
RDWR,Radware Ltd. Ordinary Shares,$26.80,0.53,2.018%,1133826796.00,Israel,1999,160881,Real Estate,Real Estate
RDY,Dr. Reddy's Laboratories Ltd Common Stock,$13.64,-0.09,-0.655%,11381971179.00,India,,2254834,Health Care,Biotechnology: Pharmaceutical Preparations
RDZN,Roadzen Inc. Ordinary Shares,$2.27,0.55,31.977%,180909175.00,United States,2022,1721826,Finance,Specialty Insurers
RDZNW,Roadzen Inc. Warrants,$0.20,0.045,29.032%,15939134.00,United States,2022,219534,Finance,Specialty Insurers
REAL,The RealReal Inc. Common Stock,$11.89,0.12,1.02%,1432303275.00,United States,2019,2052203,Consumer Discretionary,Other Specialty Stores
REAX,The Real Brokerage Inc. Common Shares,$2.10,-0.05,-2.326%,448346218.00,Canada,,2915032,Finance,Real Estate
REBN,Reborn Coffee Inc. Common Stock,$2.47,0.08,3.347%,20287234.00,United States,2022,52576,Consumer Discretionary,Restaurants
RECT,Rectitude Holdings Ltd Ordinary Shares,$1.37,0.055,4.183%,19865000.00,Singapore,2024,15253,Consumer Discretionary,Industrial Machinery/Components
REE,REE Automotive Ltd. Class A Ordinary Shares,$0.55,-0.02,-3.509%,17061513.00,Israel,,16118,Industrials,Auto Manufacturing
REED,Reed's Inc. Common Stock,$3.62,-0.08,-2.162%,0.00,,2025,118142,,
REFI,Chicago Atlantic Real Estate Finance Inc. Common Stock,$11.91,0.00,0.00%,252578085.00,United States,2021,176813,Real Estate,Real Estate Investment Trusts
REFR,Research Frontiers Incorporated Common Stock,$0.9199,-0.02,-2.128%,31872898.00,United States,,67088,Miscellaneous,Multi-Sector Companies
REG,Regency Centers Corporation Common Stock,$77.85,-1.53,-1.927%,14253040277.00,United States,1993,3195688,Real Estate,Real Estate Investment Trusts
REGCO,Regency Centers Corporation 5.875% Series B Cumulative Redeemable Preferred Stock,$22.1108,-0.0192,-0.087%,4048119755.00,United States,,7563,Real Estate,Real Estate Investment Trusts
REGCP,Regency Centers Corporation 6.25% Series A Cumulative Redeemable Preferred Stock,$23.06,0.12,0.523%,4221902489.00,United States,,4509,Real Estate,Real Estate Investment Trusts
REGN,Regeneron Pharmaceuticals Inc. Common Stock,$707.06,20.70,3.016%,74127485966.00,United States,1991,1096636,Health Care,Biotechnology: Pharmaceutical Preparations
REI,Ring Energy Inc. Common Stock,$1.88,0.02,1.075%,393662807.00,United States,,4890954,Energy,Oil & Gas Production
REKR,Rekor Systems Inc. Common Stock,$0.8198,0.0291,3.68%,111966790.00,United States,,1402627,Telecommunications,Telecommunications Equipment
RELL,Richardson Electronics Ltd. Common Stock,$14.40,0.65,4.727%,209619677.00,United States,1983,61742,Technology,Electronic Components
RELX,RELX PLC PLC American Depositary Shares (Each representing One Ordinary Share),$36.59,0.79,2.207%,66739336542.00,United Kingdom,2015,3106288,Real Estate,Real Estate
RELY,Remitly Global Inc. Common Stock,$21.89,0.00,0.00%,4604709104.00,United States,2021,2365619,Real Estate,Real Estate
RENT,Rent the Runway Inc. Class A Common Stock,$4.66,0.14,3.097%,155734465.00,United States,2021,48812,Consumer Discretionary,Other Specialty Stores
RENX,RenX Enterprises Corp. Common Stock,$2.85,0.18,6.742%,7146480.00,United States,,308182,Finance,Real Estate
REPL,Replimune Group Inc. Common Stock,$2.57,0.19,7.983%,212211631.00,United States,2018,2996278,Health Care,Biotechnology: Biological Products (No Diagnostic Substances)
REPX,Riley Exploration Permian Inc. Common Stock,$36.17,-0.11,-0.303%,780093871.00,United States,1999,281056,Energy,Oil & Gas Production
RERE,ATRenew Inc. American Depositary Shares (every three of which representing two Class A ordinary shares),$4.51,0.11,2.50%,988885132.00,Cayman Islands,2021,656386,Consumer Discretionary,Other Specialty Stores
RES,RPC Inc. Common Stock,$7.88,-0.03,-0.379%,1746517448.00,United States,,1529647,Energy,Oilfield Services/Equipment
RETO,ReTo Eco-Solutions Inc. Class A Shares,$0.60,-0.0301,-4.777%,1715305.00,China,2017,160386,Industrials,Industrial Machinery/Components
REVB,Revelation Biosciences Inc. Common Stock,$1.13,-0.02,-1.739%,4204075.00,United States,2020,51085,Health Care,Biotechnology: Pharmaceutical Preparations
REVBW,Revelation Biosciences Inc. Warrant,$0.008,-0.0004,-4.762%,29763.00,United States,2020,2945,Health Care,Biotechnology: Pharmaceutical Preparations
REX,REX American Resources Corporation,$48.50,0.09,0.186%,1597479323.00,United States,,185959,Industrials,Major Chemicals
REXR,Rexford Industrial Realty Inc. Common Stock,$35.89,0.38,1.07%,8101023291.00,United States,2013,2622632,Real Estate,Real Estate Investment Trusts
REXR^B,Rexford Industrial Realty Inc. 5.875% Series B Cumulative Redeemable Preferred Stock,$21.65,0.00,0.00%,,United States,,10082,,
REXR^C,Rexford Industrial Realty Inc. 5.625% Series C Cumulative Redeemable Preferred Stock par value $0.01 per share,$20.90,0.16,0.771%,,United States,,3561,,
REYN,Reynolds Consumer Products Inc. Common Stock,$20.97,0.41,1.994%,4419127419.00,United States,2020,1230057,Consumer Discretionary,Containers/Packaging
REZI,Resideo Technologies Inc. Common Stock ,$41.37,1.43,3.58%,6264295996.00,United States,2018,998502,Industrials,Wholesale Distributors
RF,Regions Financial Corporation Common Stock,$28.55,0.54,1.928%,24753331267.00,United States,,5648348,Finance,Major Banks
RF^C,Regions Financial Corporation Depositary Shares each Representing a 1/40th Interest in a  Share of 5.700% Fixed-to-Floating Rate Non-Cumulative  Perpetual Preferred Stock Series C,$24.84,0.12,0.485%,,United States,,60296,,
RF^E,Regions Financial Corporation Depositary Shares Each Representing a 1/40th Interest in a Share of 4.45% Non-Cumulative Perpetual Preferred Stock Series E,$16.72,0.0899,0.541%,,United States,,32937,,
RF^F,Regions Financial Corporation Depositary Shares Each Representing a 1/40th Interest in a Share of Non-Cumulative Perpetual Preferred Stock Series F,$25.74,0.33,1.299%,,United States,,41003,,
RFAI,RF Acquisition Corp II Ordinary Shares,$10.92,0.00,0.00%,0.00,Singapore,2024,2,,
RFAIR,RF Acquisition Corp II Right,$0.10,0.0001,0.10%,0.00,Singapore,2024,8303,Technology,Computer Software: Prepackaged Software
RFAM,RF Acquisition Corp III Ordinary Shares,$9.84,-0.01,-0.102%,0.00,Singapore,2026,10302,,
RFI,Cohen & Steers Total Return Realty Fund Inc. Common Stock,$11.66,0.13,1.127%,572956402.00,United States,1993,97472,Finance,Investment Managers
RFIL,RF Industries Ltd. Common Stock,$14.53,1.30,9.826%,157131300.00,United States,,128073,Technology,Electrical Products
RFL,Rafael Holdings Inc. Class B Common Stock,$1.27,0.03,2.419%,66055418.00,United States,2018,208964,Finance,Real Estate
RFM,RiverNorth Flexible Municipal Income Fund Inc. Common Stock,$14.3599,0.1499,1.055%,87806466.00,,2020,18966,Finance,Finance/Investors Services
RFMZ,RiverNorth Flexible Municipal Income Fund II Inc. Common Stock,$12.99,0.01,0.077%,316329310.00,,2021,94734,Finance,Trusts Except Educational Religious and Charitable
RGA,Reinsurance Group of America Incorporated Common Stock,$211.46,3.54,1.703%,13852582622.00,United States,,297690,Finance,Life Insurance
RGC,Regencell Bioscience Holdings Limited Ordinary Shares,$29.22,0.27,0.933%,14448965892.00,Hong Kong,2021,69626,Health Care, Medicinal Chemicals and Botanical Products 
RGCO,RGC Resources Inc. Common Stock,$22.73,0.57,2.572%,236266690.00,United States,,15803,Utilities,Oil & Gas Production
RGEN,Repligen Corporation Common Stock,$118.31,5.20,4.597%,6672598107.00,United States,1986,1822695,Health Care,Biotechnology: Biological Products (No Diagnostic Substances)
RGLD,Royal Gold Inc. Common Stock,$233.38,2.36,1.022%,19799749625.00,United States,,662799,Industrials,Precious Metals
RGNT,Regentis Biomaterials Ltd. Ordinary Shares,$2.91,-0.02,-0.683%,15071990.00,,2025,2106,Health Care,Biotechnology: Pharmaceutical Preparations
RGNX,REGENXBIO Inc. Common Stock,$8.97,0.57,6.786%,463006580.00,United States,2015,525506,Health Care,Biotechnology: Biological Products (No Diagnostic Substances)
RGP,Resources Connection Inc. Common Stock,$4.24,0.15,3.667%,145556419.00,United States,,205422,Real Estate,Real Estate
RGR,Sturm Ruger & Company Inc. Common Stock,$43.38,0.52,1.213%,691663734.00,United States,,76095,Industrials,Ordnance And Accessories
RGS,Regis Corporation Common Stock,$27.50,-0.32,-1.15%,68716395.00,United States,1991,16918,Consumer Discretionary,Other Consumer Services
RGT,Royce Global Trust Inc. Common Stock,$14.34,0.12,0.844%,89867963.00,,2013,8499,Finance,Trusts Except Educational Religious and Charitable
RGTI,Rigetti Computing Inc. Common Stock,$17.45,1.37,8.52%,5799429813.00,United States,,25523309,Technology,EDP Services
RGTIW,Rigetti Computing Inc. Warrants,$7.55,0.73,10.704%,2509208887.00,United States,,90596,Technology,EDP Services
RH,RH Common Stock,$131.96,-0.01,-0.008%,2485410649.00,United States,2012,736897,Consumer Discretionary,Other Specialty Stores
RHI,Robert Half Inc. Common Stock,$26.61,-0.58,-2.133%,2724736911.00,United States,,2298248,Consumer Discretionary,Professional Services
RHLD,Resolute Holdings Management Common Stock ,$136.09,3.37,2.539%,1123755282.00,United States,,187129,Finance,Finance: Consumer Services
RHP,Ryman Hospitality Properties Inc. (REIT),$105.09,1.47,1.419%,6632153394.00,United States,,857307,Real Estate,Real Estate Investment Trusts
RIBB,Ribbon Acquisition Corp Class A Ordinary Shares,$10.61,0.00,0.00%,0.00,Japan,2025,5,,
RICK,RCI Hospitality Holdings Inc. Common Stock,$25.02,-0.20,-0.793%,192904200.00,United States,1995,41708,Consumer Discretionary,Restaurants
RIG,Transocean Ltd (Switzerland) Common Stock,$6.82,-0.14,-2.011%,7548039276.00,Switzerland,,38486617,Energy,Oil & Gas Production
RIGL,Rigel Pharmaceuticals Inc. Common Stock,$28.90,-0.32,-1.095%,534072549.00,United States,2000,515686,Health Care,Biotechnology: Pharmaceutical Preparations
RILY,BRC Group Holdings Inc. Common Stock,$8.59,1.03,13.624%,301946506.00,United States,,1744199,Finance,Investment Managers
RILYG,BRC Group Holdings Inc. 5.00% Senior Notes due 2026,$23.96,-0.04,-0.167%,730709701.00,United States,,30591,Finance,Investment Managers
RILYL,BRC Group Holdings Inc. Depositary Shares each representing 1/1000th in a share of 7.375% Series B Cumulative Perpetual Preferred Stock par value $0.0001,$14.20,1.65,13.147%,499143234.00,United States,,31186,Finance,Investment Managers
RILYN,BRC Group Holdings Inc. 6.50% Senior Notes Due 2026,$24.76,-0.04,-0.161%,755107354.00,United States,,143792,Finance,Investment Managers
RILYP,BRC Group Holdings Inc. Depositary Shares each representing a 1/1000th fractional interest in a share of Series A Cumulative Perpetual Preferred Stock,$13.25,1.25,10.417%,465749849.00,United States,,35311,Finance,Investment Managers
RILYT,BRC Group Holdings Inc. 6.00% Senior Notes Due 2028,$20.41,0.80,4.08%,622445117.00,United States,,77806,Finance,Investment Managers
RILYZ,BRC Group Holdings Inc. 5.25% Senior Notes due 2028,$18.59,0.86,4.851%,566940457.00,United States,,107514,Finance,Investment Managers
RIME,Algorhythm Holdings Inc. Common Stock,$1.01,0.00,0.00%,14798182.00,United States,,268368,Consumer Staples,Diversified Electronic Products
RIO,Rio Tinto Plc Common Stock,$100.48,3.99,4.135%,126203916351.00,Australia,2002,3353120,Basic Materials,Metal Mining
RIOT,Riot Platforms Inc. Common Stock ,$17.24,1.26,7.885%,6536129637.00,United States,,22666637,Finance,Finance: Consumer Services
RITM,Rithm Capital Corp. Common Stock,$9.78,0.12,1.242%,5460238519.00,United States,,8629360,Real Estate,Real Estate Investment Trusts
RITM^A,Rithm Capital Corp. 7.50% Series A Fixed-to-Floating Rate Cumulative Redeemable Preferred Stock,$25.77,0.0601,0.234%,,United States,,11199,,
RITM^B,Rithm Capital Corp. 7.125% Series B Fixed-to-Floating Rate Cumulative Redeemable Preferred Stock,$25.60,0.03,0.117%,,United States,,28808,,
RITM^C,Rithm Capital Corp. 6.375% Series C Fixed-to-Floating Rate Cumulative Redeemable Preferred Stock,$25.06,0.095,0.381%,,United States,,34510,,
RITM^D,Rithm Capital Corp. 7.00% Fixed-Rate Reset Series D Cumulative Redeemable Preferred Stock,$25.15,0.00,0.00%,,United States,,88896,,
RITM^E,Rithm Capital Corp. 8.75% Series E Fixed-Rate Cumulative Redeemable Preferred Stock,$25.00,0.04,0.16%,,United States,,77696,,
RITM^F,Rithm Capital Corp. 8.750% Series F Fixed-Rate Reset Cumulative Redeemable Preferred Stock,$25.24,0.22,0.879%,,United States,,249518,,
RITR,Reitar Logtech Holdings Limited Ordinary shares,$0.481,-0.008,-1.636%,30035444.00,Hong Kong,2024,12877,Finance,Real Estate
RIV,RiverNorth Opportunities Fund Inc. Common Stock,$11.85,0.12,1.023%,0.00,United States,2015,140510,Finance,Finance Companies
RIV^A,RiverNorth Opportunities Fund Inc. 6.00% Series A Perpetual Preferred Stock,$22.87,0.115,0.505%,,United States,,3441,,
RIVN,Rivian Automotive Inc. Class A Common Stock,$16.40,0.34,2.117%,20670936774.00,United States,2021,31194428,Industrials,Auto Manufacturing
RJET,Republic Airways Holdings Inc. Common Stock,$16.66,-0.46,-2.687%,780179070.00,United States,2018,260402,Consumer Discretionary,Air Freight/Delivery Services
RJF,Raymond James Financial Inc. Common Stock,$158.32,2.74,1.761%,31203452978.00,United States,,1299926,Finance,Investment Bankers/Brokers/Service
RKDA,Arcadia Biosciences Inc. Common Stock,$1.05,-0.01,-0.943%,2159728.00,United States,2015,23119,Consumer Staples,Farming/Seeds/Milling
RKLB,Rocket Lab Corporation Common Stock,$82.51,5.49,7.128%,47506559923.00,United States,2020,17604207,Industrials,Military/Government/Technical
RKT,Rocket Companies Inc. Class A Common Stock,$14.62,0.22,1.528%,41360793179.00,United States,2020,14577520,Finance,Finance: Consumer Services
RL,Ralph Lauren Corporation Common Stock,$358.64,-0.81,-0.225%,21710779158.00,United States,1997,585075,Industrials,Garments and Clothing
RLAY,Relay Therapeutics Inc. Common Stock,$12.96,0.39,3.103%,2479760840.00,United States,2020,2389786,Health Care,Biotechnology: Biological Products (No Diagnostic Substances)
RLGT,Radiant Logistics Inc. Common Stock,$8.41,0.04,0.478%,393811235.00,United States,,179446,Industrials,Integrated Freight & Logistics
RLI,RLI Corp. Common Stock (DE),$51.77,0.62,1.212%,4759647396.00,United States,,962193,Finance,Property-Casualty Insurers
RLJ,RLJ Lodging Trust Common Shares of Beneficial Interest $0.01 par value,$8.24,-0.03,-0.363%,1251800505.00,United States,2011,1488237,Real Estate,Real Estate Investment Trusts
RLJ^A,RLJ Lodging Trust $1.95 Series A Cumulative Convertible  Preferred Shares,$25.14,0.08,0.319%,,United States,,40296,,
RLMD,Relmada Therapeutics Inc. Common Stock,$7.52,0.15,2.035%,788759437.00,United States,,922963,Health Care,Biotechnology: Pharmaceutical Preparations
RLTY,Cohen & Steers Real Estate Opportunities and Income Fund Common Shares of Beneficial Interest,$15.77,0.36,2.336%,0.00,,2022,44777,Finance,Investment Managers
RLX,RLX Technology Inc. American Depositary Shares each representing the right to receive one (1) Class A ordinary share,$2.21,0.07,3.271%,3423158078.00,Cayman Islands,2021,1449814,Health Care, Medicinal Chemicals and Botanical Products 
RLYB,Rallybio Corporation Common Stock,$8.98,0.10,1.126%,47501282.00,United States,2021,106832,Health Care,Biotechnology: Pharmaceutical Preparations
RM,Regional Management Corp. Common Stock,$37.35,-1.17,-3.037%,348467134.00,United States,2012,84092,Finance,Finance: Consumer Services
