ticker,source_type,source,title,url,published_at,engagement,relevance_score,tone,positive_hits,negative_hits,earnings_growth,ai_gemini,search_ads,cloud,youtube,waymo_autonomy,android_platform,regulatory_legal,capex_infra,valuation,shareholder_return
GOOGL,finnhub_news,Benzinga,"Google DeepMind Raids Bridgewater For Chief Scientist, Jasjeet Sekhon Says 'Excited' To Partner Directly With Hassabis",https://finnhub.io/api/news?id=79c66244da851917379d444dc7cfc11504449e1449ca4f32d422aa25da545ff4,2026-03-19T01:20:01+00:00,,6,neutral,0,0,0,3,0,0,0,0,0,0,0,0,0
GOOGL,finnhub_news,Yahoo,Exclusive-Bridgewater's chief scientist Sekhon to join Google's DeepMind AI unit,https://finnhub.io/api/news?id=2bb73c1a9b24ba90b51c737481211c98a70754195171b92ce863e344576361b8,2026-03-18T22:55:26+00:00,,6,neutral,0,0,0,3,0,0,0,0,0,0,0,0,0
GOOGL,finnhub_news,Yahoo,Is It Too Late To Consider Alphabet (GOOGL) After A 94% One Year Rally?,https://finnhub.io/api/news?id=588627aa924e0c3bed9e320e3d32ab44b526ddf6c516028aac253e0c296d7047,2026-03-18T21:08:13+00:00,,6,positive,2,1,0,1,0,1,0,0,0,0,0,1,0
GOOGL,finnhub_news,Yahoo,Alphabet’s Growing China Cooling Ties Add New Angle To AI Valuation,https://finnhub.io/api/news?id=5d4e1eb2c9ee02f3818fa2e03fb6032618611a492ad9d96c512cfc6f272e272b,2026-03-18T20:04:46+00:00,,3,neutral,1,1,0,1,1,1,0,0,0,1,2,1,0
GOOGL,finnhub_news,Benzinga,Waymo Under Fire: Lyft-Backed Union Alleges Teens Riding Solo In Robotaxis,https://finnhub.io/api/news?id=c70733247fabe7f2ccff18aa28c4230445707394bdbb2068755cdabd86f69e66,2026-03-18T16:28:22+00:00,,3,positive,1,0,0,0,0,0,0,2,0,0,0,1,0
GOOGL,finnhub_news,Yahoo,GOOGL's Wiz Buyout Expands Cloud Security Portfolio: What's Ahead?,https://finnhub.io/api/news?id=52aa562ee93a265ff30e3a65859a7594eba81c6896be59df59e26c83847a9731,2026-03-18T16:24:00+00:00,,4,positive,3,0,0,0,0,2,0,0,0,0,0,0,0
GOOGL,finnhub_news,Yahoo,Market Chatter: Alphabet Pitches Defense Partnership to Pentagon,https://finnhub.io/api/news?id=6fe962f866d003123b9eb556b33c72f5a3b5441b126a6ef82ebae2c8e7e78680,2026-03-18T16:20:49+00:00,,3,neutral,0,0,0,0,0,2,0,0,0,0,0,0,0
GOOGL,finnhub_news,Benzinga,"Google Introduces ""Vibe Design"" With Stitch",https://finnhub.io/api/news?id=7ac9acaf19234729f1286430ab74ebc1629d9c6ef926fa3ea4c2f757d7e69628,2026-03-18T14:18:31+00:00,,6,neutral,0,0,0,1,1,0,0,0,0,0,0,0,0
GOOGL,finnhub_news,Yahoo,Here's Why Google's $185 Billion AI Bet in 2026 Could Either Be a Masterstroke or Its Biggest Mistake,https://finnhub.io/api/news?id=c45b2b1205cef7c353fe119435dbd86641974527b718b52d566278e2fe7c51f9,2026-03-18T12:30:00+00:00,,6,neutral,0,0,1,1,0,0,0,0,0,0,1,0,0
GOOGL,finnhub_news,Benzinga,Google Announces General Availability Of Valkey 9.0,https://finnhub.io/api/news?id=383dec57273ff253c2105f3bf26225a60658e33f258bf0633db8001257df6e4c,2026-03-18T12:09:26+00:00,,6,neutral,0,0,0,0,0,1,0,0,0,0,0,0,0
GOOGL,finnhub_news,CNBC,"Meta will pay Instagram, TikTok and YouTube creators with big followings to post on Facebook",https://finnhub.io/api/news?id=a6395f39717df187263e79651a049ff7a2ca59e08653a1debf4793a9531cd52b,2026-03-18T12:00:01+00:00,,3,positive,2,0,0,0,0,0,2,0,0,0,0,0,0
GOOGL,finnhub_news,Benzinga,'Google Sits Pretty as A.I. Rivals Compete for Pentagon Favor'- New York Times,https://finnhub.io/api/news?id=66b87c3606ba390fd26d2654d62032ffd5d9b788a211b38fc035dfdc6fe3477d,2026-03-18T11:37:27+00:00,,6,neutral,0,0,0,0,1,0,0,0,0,0,0,0,0
GOOGL,finnhub_news,Yahoo,"GOOGL, NVDA, and More: Iron Condor Screener Results for March 18",https://finnhub.io/api/news?id=285df4eaf3cd89fc8c63f1938fcf04f236c4acfd23e7cf76ca994f1f04dbc14d,2026-03-18T11:00:02+00:00,,4,neutral,0,0,0,0,0,0,0,0,0,0,0,0,0
GOOGL,finnhub_news,Benzinga,Google Threat Intelligence Traces New iOS Full-Chain Exploit DarkSword,https://finnhub.io/api/news?id=1be1e7cb7c9b06d18aeda539496a4a569af6887ea4c46be3f89d280eaea45b15,2026-03-18T10:18:55+00:00,,6,negative,0,1,0,0,0,1,0,0,0,0,0,0,0
GOOGL,finnhub_news,Yahoo,What Sundar Pichai's $692 Million Pay Package Says About Alphabet's Next Chapter,https://finnhub.io/api/news?id=084f8067080a6dadf8f72b9f37d906947fcb74819a62b9ee5fc884685fc203ed,2026-03-18T09:03:00+00:00,,3,neutral,0,0,0,0,0,0,0,1,0,0,0,0,0
GOOGL,finnhub_news,Benzinga,"Google Working With U.K. Regulator Over New Digital Market Rules For Fairness, Choice While Protecting User Experience",https://finnhub.io/api/news?id=a5537595f9abb156d50188115b08a927d0833536df92aa2d2dbdac67d1ce8751,2026-03-18T08:57:33+00:00,,6,neutral,0,0,0,0,2,0,0,0,0,1,0,0,0
GOOGL,finnhub_news,Yahoo,Alphabet Inc. (GOOG) Outperforms Broader Market: What You Need to Know,https://finnhub.io/api/news?id=fcd142626f7722787084c474988023c3f5a18a1b14599a777192c4d807374dbb,2026-03-17T21:45:05+00:00,,6,positive,1,0,0,0,0,0,0,0,0,0,0,0,0
GOOGL,finnhub_news,Yahoo,Google's AI Push Faces A Cooling Challenge,https://finnhub.io/api/news?id=c463e258e8050268ed0d4fba1b2fb791ad16f1f74a9307ba15122c4051b2ea43,2026-03-17T18:57:59+00:00,,6,neutral,0,0,0,1,0,0,0,0,0,0,0,0,0
GOOGL,finnhub_news,Yahoo,How The Alphabet (GOOGL) Investment Story Is Shifting With AI Deals And Valuation Questions,https://finnhub.io/api/news?id=75bbcbf46de852bac682ef7c9897590d31bae3d24b1312275a61cf53ccb8001e,2026-03-17T18:10:51+00:00,,6,neutral,1,1,0,3,1,1,0,0,0,0,0,3,0
GOOGL,finnhub_news,MarketWatch,Google Partners With CMS on Linking Medical Records to Fitbit,https://finnhub.io/api/news?id=43c02c637d9dada3edc0b0be31444d499c849ed65d24928d416bb2d4e10c2cff,2026-03-17T17:37:00+00:00,,6,positive,1,0,1,0,0,0,0,0,0,0,0,0,0
GOOGL,finnhub_news,Yahoo,Alphabet Bets on Cooling as AI Infrastructure Heats Up,https://finnhub.io/api/news?id=afa4a06973903934272a5c5135d225926f24a45538469178616c3dfbbc04e44d,2026-03-17T17:19:08+00:00,,3,neutral,0,0,0,1,0,0,0,0,0,0,2,0,0
GOOGL,finnhub_news,Yahoo,"Is Alphabet Stock's 25.55X PE Still Worth it? Buy, Sell, or Hold?",https://finnhub.io/api/news?id=50f3128721844857f70ded9d1c17a2ebaf0697c25bc10f5a0b374dbcc1fa0e5d,2026-03-17T16:53:00+00:00,,3,neutral,2,2,1,0,1,1,0,0,0,0,1,1,0
GOOGL,finnhub_news,Yahoo,Google’s data center power playbook comes into focus,https://finnhub.io/api/news?id=45c6ac5c44e3be23bb2f638f5830ddfa7a445037dd145e073425aaf4df21f930,2026-03-17T16:46:02+00:00,,6,neutral,0,0,0,0,0,1,0,0,0,0,1,0,0
GOOGL,finnhub_news,Yahoo,Alphabet Data Center Push Ties Michigan Project To Renewable Power And AI,https://finnhub.io/api/news?id=ed064b45c45977de4f5361197185565fd4c630f39947a819ae82ac269e66c15c,2026-03-17T14:09:40+00:00,,3,neutral,0,0,0,1,0,1,0,0,0,0,2,0,0
GOOGL,finnhub_news,Yahoo,Alphabet Eyes Cooling Deals With Chinese Suppliers,https://finnhub.io/api/news?id=a8ffb81dc0a2a82d1bbdaf7bb2f5215690507aab01e4d75cd299be45d931a71f,2026-03-17T13:42:18+00:00,,3,neutral,0,0,0,1,0,0,0,0,0,0,1,0,0
GOOGL,finnhub_news,Yahoo,Are Amazon and Alphabet Among the Best Stocks to Buy Now?,https://finnhub.io/api/news?id=07adce479016912949419e4d42e0c61e1679daa05b7aea0f2fc592e938c659c5,2026-03-14T08:45:00+00:00,,3,neutral,0,0,0,0,0,1,0,0,0,0,0,1,0
GOOGL,finnhub_news,Yahoo,YouTube’s New Lead Over Disney Recasts Alphabet As Global Media Power,https://finnhub.io/api/news?id=b377dce22169d7da2c5920672d1fcad95aaae9627e1e384cfa6bce4886d8818e,2026-03-14T04:22:29+00:00,,3,positive,1,0,1,0,1,0,2,0,0,0,0,0,0
GOOGL,finnhub_news,Yahoo,Hut 8 (HUT) 2025 Revenue Rises to $235.1M as Firm Signs $7B Google-Backed AI Lease,https://finnhub.io/api/news?id=d901e4a230c37960277aec7a433170c47ce39c09337e32c2c6c82a4bc59e87eb,2026-03-14T02:42:18+00:00,,6,neutral,0,0,1,1,0,0,0,0,0,0,1,0,0
GOOGL,finnhub_news,Yahoo,Google commits $1B to North Carolina data centers as AI demand surges,https://finnhub.io/api/news?id=4b595b9a6bc23a443cb46ab764c366881d1d1f6e7f1a97c7de7658ad5c76ebba,2026-03-13T22:27:58+00:00,,6,neutral,0,0,0,1,0,1,0,0,0,0,1,0,0
GOOGL,finnhub_news,Yahoo,"Top Analyst Reports for Alphabet, Cisco & PepsiCo",https://finnhub.io/api/news?id=f0e022b22ea98b8e53800284238041f26c8cb55ff078406bccd56ba4600fba6e,2026-03-13T20:35:00+00:00,,3,neutral,1,1,1,0,0,1,0,0,0,0,0,1,0
GOOGL,finnhub_news,Yahoo,"Alphabet Inc. (GOOGL)’s Expanding Horizons: AI, Cloud, and Broadband Growth",https://finnhub.io/api/news?id=59922087ad71d3069e4c648416628dfa99e62007479681efcef9503e3638e14d,2026-03-13T18:30:38+00:00,,6,positive,1,0,0,0,0,1,0,0,0,0,0,0,0
GOOGL,finnhub_news,Yahoo,Avocado on Ice: Can Meta Afford to Pause While Google and OpenAI Sprint Ahead?,https://finnhub.io/api/news?id=d368e106e6f8518dc06caa1909ad299895be2f9fdc2e40b779651ff4471312bb,2026-03-13T15:30:52+00:00,,6,neutral,0,0,1,3,0,0,0,0,0,0,0,0,0
GOOGL,finnhub_news,Yahoo,Meta Delays New AI Model. Its Loss Could Be Google’s Gain.,https://finnhub.io/api/news?id=c157475e9c0f698929cf3b2e4c02aa198f2d15ac488c2810dfef41b91861fe5f,2026-03-13T14:59:00+00:00,,6,negative,0,1,0,2,0,0,0,0,0,0,0,0,0
GOOGL,finnhub_news,Yahoo,"Meta Is Falling Behind in AI Models. Its Loss Could Be Google’s Gain, Report Says.",https://finnhub.io/api/news?id=53a8fabd8a6105d3810d1a617234b47695f0b1043e338ffa0f75b25d7331d7e7,2026-03-13T13:24:00+00:00,,6,negative,0,1,0,2,0,0,0,0,0,0,0,0,0
GOOGL,finnhub_news,Yahoo,"Nvidia Stock Faces New Threat -- Google, Amazon, Meta Build Rival AI Chips",https://finnhub.io/api/news?id=0e031c39a4287d401ba3e5075ba1fc71c4d0c8843f715d8131082aaddb5d3411,2026-03-13T12:32:41+00:00,,6,negative,0,1,0,1,0,0,0,0,0,0,2,0,0
GOOGL,finnhub_news,Yahoo,"Here Are Friday’s Top Wall Street Analyst Research Calls: Adobe, Alcoa, Alphabet, Celanese, Knight-Swift, Linde Plc, Ollie’s Bargain Outlet, Tyson Foods, and More",https://finnhub.io/api/news?id=55f436fc6ac65f61afd16553b6697e3e169b443add3152375ab77d49032da967,2026-03-13T11:59:30+00:00,,3,positive,1,0,0,0,1,0,0,0,0,0,0,1,0
GOOGL,finnhub_news,Benzinga,"Needham Reiterates Buy on Alphabet, Maintains $400 Price Target",https://finnhub.io/api/news?id=524616b3dd66d7e49c29b601175b5bdfb38768510b7d3b6789f1294e07334e2d,2026-03-13T07:54:29+00:00,,3,neutral,0,0,0,0,0,0,0,0,0,0,0,2,0
GOOGL,finnhub_news,Benzinga,Meta May Delay 'Avocado' As Tech Underwhelms In Tests Against Google Gemini And Anthropic AI Models: Report,https://finnhub.io/api/news?id=6b425236695ca5032463a6d6cfeabff2243d211d783be2c08efd4cc999ac33d1,2026-03-13T03:39:10+00:00,,6,negative,0,1,0,3,0,0,0,0,0,0,0,0,0
GOOGL,finnhub_news,Yahoo,Alphabet News Highlights Shifting Capital Focus And Rising YouTube Risks,https://finnhub.io/api/news?id=5d60841f8bada19b49f9ccbe0a7fbb1b813d1b30976d34b806fe31f25f6926ce,2026-03-12T19:07:44+00:00,,3,neutral,2,2,2,0,0,0,1,1,0,2,0,0,0
GOOGL,finnhub_news,Yahoo,"Google (GOOGL) App Store Brings Back Fortnite, Changes Fee Structure",https://finnhub.io/api/news?id=df088128a4a7f45875fa09f49a5adfbc80f2366aa4f3f9a26b2a619c525a2c7c,2026-03-12T18:24:42+00:00,,6,neutral,0,0,0,0,0,0,0,0,2,0,0,0,0
GOOGL,finnhub_news,Yahoo,3 Reasons Why Alphabet Stock Is a Smart Buy,https://finnhub.io/api/news?id=faa22ceb140aa40c0fe5800f54edecab7aa31e945442c5e8e8948dfa340d3286,2026-03-12T18:20:00+00:00,,3,neutral,0,0,0,0,0,0,0,0,0,0,0,0,0
GOOGL,finnhub_news,Yahoo,Google Just Closed Its $32 Billion Wiz Deal. How Should You Play GOOGL Stock Here?,https://finnhub.io/api/news?id=ae75116ce361b12543adf971ae07a00ad52f02b6c2a9470b2e723f250f3f0cd2,2026-03-12T17:17:11+00:00,,6,positive,2,0,0,0,0,1,0,0,0,0,0,0,0
GOOGL,finnhub_news,Yahoo,Google to combine fiber unit with Astound Broadband,https://finnhub.io/api/news?id=bc67861c58a75dcda8e3a405fdce7d154cebecdeaf800e1fe851659045df010b,2026-03-12T15:57:36+00:00,,6,neutral,0,0,1,0,0,0,0,0,0,0,0,0,0
GOOGL,finnhub_news,Yahoo,"Alphabet Spins Off Fiber Control, Keeps a Seat at the Table",https://finnhub.io/api/news?id=11f6a9c7bfbaea2e1b7bc3b80e12d1e90e3c59cf82c9918da5172bd56ceb5e2e,2026-03-12T13:01:27+00:00,,3,neutral,0,0,1,0,0,0,0,0,0,0,0,0,0
GOOGL,finnhub_news,Yahoo,IPX Power Launches as Independent Power Producer Following Sale of Intersect to Google,https://finnhub.io/api/news?id=6b838093d6a12110cb1a955912a0d2010f15eb87a3acfc981254dc24996be8ee,2026-03-12T13:00:00+00:00,,6,positive,1,0,0,0,0,0,0,0,0,0,1,0,0
GOOGL,finnhub_news,Yahoo,"Market Chatter: UK Regulators Press Meta, TikTok, Snap, YouTube to Boost Child Safety Measures",https://finnhub.io/api/news?id=11798b44ac1d760322f3d438240e89d09cbb54cc7fe9b47a476712cab7069349,2026-03-12T11:19:26+00:00,,3,positive,1,0,0,0,0,0,1,0,0,1,0,0,0
GOOGL,finnhub_news,Yahoo,"The Zacks Analyst Blog  Microsoft, Amazon, Alphabet and Oracle",https://finnhub.io/api/news?id=5edc92ba969fbcd93583769dbd46df0dbba2bc6bc4e1ac3443ceb6e897726da5,2026-03-12T09:18:00+00:00,,3,positive,2,0,0,1,0,1,0,0,0,0,1,2,0
GOOGL,finnhub_news,DowJones,Google Tracks Flash Floods With a New AI Tool,https://finnhub.io/api/news?id=99cf2f9ed066d55448116eb5a13e357bd05224de94049fd857767cb9ff5b8bd8,2026-03-12T09:00:00+00:00,,6,neutral,0,0,0,1,0,0,0,0,0,0,0,0,0
GOOGL,finnhub_news,CNBC,Google brings more AI to navigation with 'Ask Maps' feature that lets users ask complex questions,https://finnhub.io/api/news?id=c36f47d17723a347f92aaf634faaba0e870b1c2e79cf2a93a46438f39c3288a5,2026-03-12T08:30:01+00:00,,6,neutral,0,0,0,1,0,0,0,0,0,0,0,0,0
GOOGL,finnhub_news,SeekingAlpha,Alphabet Q4: A Fairly Valued Tech Titan To Buy Now,https://finnhub.io/api/news?id=db3b2242677d1da861dc01730b21f4b9e41e85c94703b33144155d092e08666c,2026-03-12T07:30:00+00:00,,3,positive,1,0,3,0,0,0,0,0,0,0,0,1,0
GOOGL,finnhub_news,Yahoo,Google’s AI Dominance Is Being Tested. Here’s What Investors Need to Know,https://finnhub.io/api/news?id=d58632f6bae83ee32ce960f33169a75a16f5a28f210acb8086cb0e733644fffd,2026-03-11T20:29:48+00:00,,6,neutral,0,0,2,1,0,0,0,0,0,0,1,0,0
GOOGL,finnhub_news,CNBC,"Google sells partial stake in fiber business, becomes minority owner of new venture ",https://finnhub.io/api/news?id=cf90b61b5494edf04b9b821633bd95332dad6639394ef4626cceefb64817fd36,2026-03-11T19:27:29+00:00,,6,neutral,0,0,0,0,0,0,0,0,0,0,0,0,0
GOOGL,finnhub_news,Yahoo,Alphabet Closes $32B Acquisition of Cybersecurity Firm Wiz,https://finnhub.io/api/news?id=67226a04fb5951299fbd36523ce9fd653f81914a908c0f429253f649e56b0ec8,2026-03-11T19:03:44+00:00,,3,neutral,0,0,0,0,0,1,0,0,0,0,0,0,0
GOOGL,finnhub_news,Yahoo,Alphabet’s Wiz Deal And Canal Plus AI Pact Reframe Cloud Story,https://finnhub.io/api/news?id=b253aae78ebaefc934d60870042f8000a82af411e0cbbf7940747625c9d598b0,2026-03-11T18:10:33+00:00,,3,neutral,1,1,1,1,0,2,1,0,0,0,0,0,0
GOOGL,finnhub_news,Yahoo,Disney Investors Just Got Really Bad News from Alphabet,https://finnhub.io/api/news?id=a0875099dadb224c4dbc84952465c3e6985e3e0721b73e0d8d6aae47e2b4e2f8,2026-03-11T17:37:28+00:00,,3,neutral,0,0,0,0,0,0,0,0,0,0,0,0,0
GOOGL,finnhub_news,Benzinga,"Accenture Expands Its Strategic Partnership With Google Cloud To Help Organizations Stay Ahead Of Escalating AI-Driven Cyber Threats, From Hyper-Personalized Social Engineering To Autonomous Malware",https://finnhub.io/api/news?id=3e009abca9212f86a3e1433d666df156c96990dd161ed81c030876c14d234966,2026-03-11T17:34:06+00:00,,6,negative,0,1,0,0,0,2,0,1,0,0,0,0,0
GOOGL,finnhub_news,Yahoo,YouTube just crushed Hollywood in a major milestone,https://finnhub.io/api/news?id=8e5e27e43de86cbd4a3ca864ad4f9718968a37dc29be0f0321c89b9bbc52cdc8,2026-03-11T16:45:54+00:00,,3,neutral,0,0,1,0,2,0,2,0,0,0,0,0,0
GOOGL,finnhub_news,MarketWatch,Tesla and Google Team Up to Lower Electricity Bills—Kind Of,https://finnhub.io/api/news?id=f7d6b1e8124bbcef29c444877c0dcad531ee5c8939022341b0e586e986b05ec2,2026-03-11T16:23:00+00:00,,6,neutral,0,0,0,0,0,0,0,0,0,0,0,0,0
GOOGL,finnhub_news,Yahoo,Google Acquires Wiz in Biggest Deal Ever of $32 Billion,https://finnhub.io/api/news?id=c3782e5078ebdc3aca1a4d8f9084663a5a436e4d150935ba5634a51ea5840964,2026-03-11T15:02:30+00:00,,6,positive,1,0,0,0,0,2,0,0,0,0,0,0,0
GOOGL,finnhub_news,Yahoo,"Iran threatens to attack Google, Amazon and Microsoft",https://finnhub.io/api/news?id=aab141942286c97c4a0e85a77dab2a7ce5e7f93b3eeb207cb46641d6e500de5e,2026-03-11T14:36:36+00:00,,6,negative,0,1,0,0,0,0,0,0,0,0,0,0,0
GOOGL,finnhub_news,Yahoo,Google wraps up $32B acquisition of cloud cybersecurity startup Wiz,https://finnhub.io/api/news?id=07f8a769f63afde2a02d711d8ec5acceffa04cc4b1ba96ad245a7cec2d605994,2026-03-11T12:56:54+00:00,,6,neutral,0,0,0,0,0,1,0,0,0,0,0,0,0
GOOGL,finnhub_news,Yahoo,Google Completes Acquisition of Wiz,https://finnhub.io/api/news?id=7f20a9a8912afb5abe43d98beef760728797d31ee4f1bf0f2f027bbf27474822,2026-03-11T12:38:00+00:00,,6,neutral,0,0,1,1,0,2,0,0,0,0,0,0,0
GOOGL,finnhub_news,Yahoo,Tesla and Google Team Up to Lower Electricity Bills,https://finnhub.io/api/news?id=65b86026cfb8568d00cf93b154254985a6e0372f1adaa7dd0885dc9ee86e0b6a,2026-03-11T12:02:00+00:00,,6,neutral,0,0,0,0,0,0,0,0,0,0,0,1,0
GOOGL,finnhub_news,Yahoo,"U.S. Data Center Construction Market Outlook Report 2026-2031 Featuring Key Investors - Apple, Applied Digital, AWS, CyrusOne, DataBank, Digital Realty, Equinix, Google, Meta, Microsoft, NTT, Vantage",https://finnhub.io/api/news?id=e3ff7d39aed6177f6b4e85a1c38be824c6efd597111da8a6e0d592b1933f030b,2026-03-11T11:12:00+00:00,,6,positive,1,0,0,1,1,1,0,0,0,0,1,1,0
GOOGL,finnhub_news,Yahoo,"Saudi Arabia Data Center Market Investment Analysis Report 2026-2031 Featuring Alibaba, DAMAC Digital, Google, Gulf Data Hub, Mobily, Oracle, Quantum Switch, Sahayeb Data Centers, center3, TONOMUS",https://finnhub.io/api/news?id=2b1da07fb428abb5dfd2e377c4cdc279338c615df1c8488022155732b5d48506,2026-03-11T10:55:00+00:00,,6,positive,2,0,0,1,0,1,0,0,0,0,1,0,0
GOOGL,finnhub_news,Yahoo,Netflix Rival Strikes Deal With Google in Battle for AI Content,https://finnhub.io/api/news?id=ebc788d1f780b4522aa06d5184a5c651f3fc6b5c4e9309b987ab64a6c616208b,2026-03-11T10:40:00+00:00,,4,neutral,0,0,0,2,0,0,0,0,0,0,0,0,0
GOOGL,finnhub_news,Yahoo,Google acquires Intersect Power for $4.75bn,https://finnhub.io/api/news?id=daa9f710510a26c24529876ebe93f38eb2e2a5d076e48b1208b83bf9719052b7,2026-03-11T09:44:51+00:00,,6,positive,1,0,0,0,0,0,0,0,0,0,0,0,0
GOOGL,finnhub_news,Benzinga,"Palantir, Nvidia, Oracle, Microsoft, Alphabet, IBM Listed As Iran's New 'Targets' Amid Middle East Conflict",https://finnhub.io/api/news?id=542a0067dac1506b567cb031fccca07a1172c85d94bc93a1ee5347e166cc5825,2026-03-11T09:18:37+00:00,,3,neutral,0,0,0,0,0,0,0,0,0,0,0,0,0
GOOGL,finnhub_news,MarketWatch,Google Completes $32 Billion Acquisition of Cybersecurity Firm Wiz,https://finnhub.io/api/news?id=3ef4e43e547e6b3c685d932a53f00f5836a0cfd61d830349ad224a89435a813d,2026-03-11T09:18:00+00:00,,6,neutral,0,0,0,0,0,0,0,0,0,0,0,0,0
GOOGL,finnhub_news,Yahoo,"Zacks Investment Ideas feature highlights Microsoft, Alphabet, Amazon, Meta, Oracle, Micron, Sandisk, Bloom Energy, IREN, and   NVIDIA",https://finnhub.io/api/news?id=66578dfef3e02d6389553e95ff4070d845f165b4a082ec8c70e5181875543c58,2026-03-11T09:06:00+00:00,,3,neutral,0,0,0,0,0,0,0,0,0,0,0,0,0
GOOGL,finnhub_news,Benzinga,Decoy Therapeutics Partners With Quantori To Build Google Cloud-Native Peptide Design Platform,https://finnhub.io/api/news?id=f3b5a67c8b5fbec3a1c1fd3c707aca0820bb386378931e7154219baf9b0b8cc8,2026-03-11T08:35:54+00:00,,6,neutral,0,0,0,0,0,2,0,0,0,1,0,1,0
GOOGL,finnhub_news,Yahoo,"Canal+ taps Google's AI for video production, content recommendation",https://finnhub.io/api/news?id=61cc60ebd86e045226e290a7144c2aabee5c7d4f668b1355b485f68f4da932e5,2026-03-11T07:06:47+00:00,,6,positive,1,0,0,3,0,2,1,0,0,0,1,0,0
GOOGL,finnhub_news,Benzinga,"YouTube Expands AI Deepfake Detection Tool To Politicians, Journalists",https://finnhub.io/api/news?id=2f2b764fd20ba2da61abf96c4d10af906a207278d476829ef45d1bd234d8aba2,2026-03-11T06:22:09+00:00,,3,neutral,0,0,0,1,0,0,1,0,0,0,0,0,0
GOOGL,finnhub_news,Benzinga,CANAL+ And Google Cloud Announce Multi-Year AI Partnership To Optimize Content Recommendations And Propel Video Creativity Across European And African Markets,https://finnhub.io/api/news?id=817a071853beb8f3c8c1a62506a25950b43a2e93b2ee1bd9219507178dd4ec29,2026-03-11T03:58:18+00:00,,6,neutral,0,0,0,1,0,2,0,0,0,1,0,0,0
GOOGL,finnhub_news,Yahoo,The Bull Case For Synaptics (SYNA) Could Change Following New Google-Backed Edge AI Coral Dev Board,https://finnhub.io/api/news?id=ed2e88077e4bd294765caf3ac972b7f00a841b383db0352f39511252e64665cc,2026-03-11T03:15:02+00:00,,6,positive,1,0,0,1,1,0,0,0,0,0,0,0,0
GOOGL,finnhub_news,Yahoo,Google and Tesla think we’re managing the electrical grid all wrong,https://finnhub.io/api/news?id=661dc942bdfc06c7ef645050751719d8e25a0f62c9b51d1be482bbfbe545d650,2026-03-10T20:42:44+00:00,,6,neutral,0,0,0,0,0,0,0,0,0,0,0,0,0
GOOGL,finnhub_news,Yahoo,Greenbelt Capital Partners Completes Sale of Intersect Power to Google and Announces the Launch of IPX Power,https://finnhub.io/api/news?id=896d6aa6fec80127131daad38649584bd3a4cc3aef3f9c8ba345b4121ccdb42a,2026-03-10T18:59:00+00:00,,6,neutral,0,0,0,0,0,0,0,0,0,0,0,0,0
GOOGL,finnhub_news,Yahoo,"YouTube's $62B Revenue Tops Disney, Signaling Tech's Media Power Shift",https://finnhub.io/api/news?id=5084c787b7c8ef327f4951b5fd69f04d4a4c07eb495a3d4d40eef17c09a99e80,2026-03-10T18:01:00+00:00,,3,positive,1,0,1,0,1,0,1,0,0,0,0,0,0
GOOGL,finnhub_news,Yahoo,Indonesia’s Youth YouTube Ban Adds Fresh Regulatory Questions For Alphabet,https://finnhub.io/api/news?id=214f9ac919a37af6a3aa6ff0a6c918ecef97657c4718fedfeabad1a8c1932631,2026-03-10T17:11:45+00:00,,3,negative,0,1,0,0,0,0,1,0,0,1,0,0,0
GOOGL,finnhub_news,Benzinga,"Tesla Turns To Facebook, YouTube For Advertising: Good News For Investors Or Worrying Sign?",https://finnhub.io/api/news?id=e4616fac60397895e5d60945dd3faf791a8a3044e36c25aa41afdc0ba4cfd6d8,2026-03-10T16:50:47+00:00,,3,neutral,0,0,0,0,1,0,1,0,0,0,0,0,0
GOOGL,finnhub_news,Yahoo,Alphabet Owns 8.9 Million Shares of This Hot Space Stock. Is It a Buy?,https://finnhub.io/api/news?id=7f8a90ba841df97ef9f672f8203ac87c79d58e4824f06a8ee798382cf2bf9951,2026-03-07T23:25:00+00:00,,3,neutral,0,0,0,0,0,0,0,0,0,0,0,0,0
GOOGL,finnhub_news,Yahoo,"Tesla Robotaxi Rival Waymo Now Operates In 10 Cities, Touts 200 Million Autonomous Miles Driven: Here's How Other Companies Fair",https://finnhub.io/api/news?id=618afcd311382c1e4524ff15cb7813a0806e4a847f8d780fe12c7d46e5a90368,2026-03-07T21:30:44+00:00,,3,neutral,0,0,0,0,0,0,0,3,0,0,0,1,0
GOOGL,finnhub_news,Yahoo,Prediction: This Will Be Alphabet's Stock Price in 5 Years,https://finnhub.io/api/news?id=26ca7fc03e19767fa973cdfa55a7bb8d531312bbc6efd376777928ad3837e696,2026-03-07T19:32:00+00:00,,3,positive,1,0,0,0,0,1,0,0,0,0,1,0,0
GOOGL,finnhub_news,Yahoo,Magnificent 7 News: Microsoft Rebounds While Apple and Alphabet Fall This Week,https://finnhub.io/api/news?id=7310da9d38afcd95eb42a9e685a5b47638d6ee26c2fddf79248fb5e4c1a9f337,2026-03-07T19:13:58+00:00,,3,positive,3,2,1,1,0,0,0,0,0,0,0,0,0
GOOGL,finnhub_news,Yahoo,Google Owns a $1 Billion Unicorn Defense Company Now,https://finnhub.io/api/news?id=957829cc90a59a243c43256fa5826c133b053100372c9b98ca304b02778e0185,2026-03-07T12:27:00+00:00,,6,neutral,0,0,0,0,0,0,0,0,0,0,0,0,0
GOOGL,finnhub_news,Yahoo,"Google, Meta and the AI ‘hyperscalers’ are on a $1 trillion borrowing binge after years of printing cash. Here’s why Big Tech’s pivot to debt matters",https://finnhub.io/api/news?id=a2ed2dc0dbf7b93079027eca423ef315095ccdf8d547893bda56e90fb7ffeea5,2026-03-07T10:04:00+00:00,,6,neutral,1,1,0,1,0,0,0,0,0,0,1,0,0
GOOGL,finnhub_news,Yahoo,Google gives CEO new pay deal worth up to $692 million,https://finnhub.io/api/news?id=1e90d6a04e2897ddd95534363737bc627680f028dcae9425899d6c3bfc2ad0c4,2026-03-07T07:48:21+00:00,,6,negative,0,1,0,0,0,0,0,0,0,0,0,0,0
GOOGL,finnhub_news,Yahoo,Alphabet Faces Gemini Lawsuit While Deepening Healthcare AI Role With CVS,https://finnhub.io/api/news?id=489cdfb43d726076eacb57c4c749968a77fc81b28c4f0a4462f7dd47a1268b4a,2026-03-07T06:09:18+00:00,,3,negative,0,1,0,2,0,1,0,0,0,1,0,0,0
GOOGL,finnhub_news,Yahoo,Twilio Expands European Reach With KPN And Google RCS Partnership,https://finnhub.io/api/news?id=ef8fa6dca86a84e553c30a15cf876bdd5bea20d2d97e2f401fb02a71abc14c52,2026-03-07T05:11:18+00:00,,6,neutral,0,0,0,0,0,1,0,0,0,1,0,0,0
GOOGL,finnhub_news,Benzinga,What To Know About Google CEO Sundar Pichai's New $692 Million Equity Pay Package,https://finnhub.io/api/news?id=81c8d462f996a02dc7bbe2cd52d2a3a1e6c241b18b99eef5038e6514261c7093,2026-03-07T04:28:49+00:00,,6,positive,2,0,0,0,0,0,0,1,0,0,0,0,0
GOOGL,finnhub_news,Yahoo,Google gives CEO Sundar Pichai new pay deal worth up to $692 million,https://finnhub.io/api/news?id=2fd8d06a786a22351d5115b1bd501901b5eb6a65323e8d87dc66f2e37a163c8e,2026-03-07T01:10:33+00:00,,6,neutral,0,0,0,0,0,0,0,0,0,0,0,0,0
GOOGL,finnhub_news,Benzinga,"Amazon, Google And Microsoft Keep Anthropic AI For Clients Despite Pentagon Risk Label",https://finnhub.io/api/news?id=47fe7a64e82859ab5b86431cc0b58c8cb3f1b07305f759ce9c5e80f48a8b2d41,2026-03-07T00:49:26+00:00,,6,negative,0,1,0,1,0,0,0,0,0,0,0,0,0
GOOGL,finnhub_news,Yahoo,How Amazon and Google are taking on smart homes with AI,https://finnhub.io/api/news?id=c56fbff5b1cccf00b1a22ef38c3b92d728b79eb0e791291737ed74d007c1bcd4,2026-03-06T22:09:41+00:00,,6,neutral,0,0,0,2,0,0,0,0,0,0,0,0,0
GOOGL,finnhub_news,Yahoo,Alphabet and Nvidia Just Might Be the Ultimate AI Stocks. But Which Will Be the Bigger Winner Over the Next 10 Years?,https://finnhub.io/api/news?id=ff9354f6fd4eaff907026e263b04ec94fd5ffcbe84d351f0d5047fd415d1fd6f,2026-03-06T21:13:00+00:00,,3,positive,2,1,1,2,0,1,0,0,0,0,0,0,0
GOOGL,finnhub_news,Yahoo,Google Backing Recasts TeraWulf As AI Infrastructure And Data Center Play,https://finnhub.io/api/news?id=385e5660efa26089d1e8cea473b97d798d06873026626a0d62702787e5c77018,2026-03-06T18:07:52+00:00,,6,neutral,0,0,0,1,0,1,0,0,0,0,2,0,0
GOOGL,finnhub_news,Yahoo,Why the Charts Say It Might Be Time for a Big Short on Google Stock,https://finnhub.io/api/news?id=7a9828d8717c25ee7fb1d32c313dd5844b7b7fcbc25048a31270b43165620325,2026-03-06T16:36:54+00:00,,6,negative,0,1,0,0,0,0,0,0,0,0,0,1,0
GOOGL,finnhub_news,Yahoo,Alphabet (GOOGL) Down 9.2% Since Last Earnings Report: Can It Rebound?,https://finnhub.io/api/news?id=5b70d2b604a89b02e4b2cdf0669c01e17e6ed8445f6660f52528a5491f82ad90,2026-03-06T16:30:11+00:00,,6,positive,1,0,1,0,0,0,0,0,0,0,0,0,0
