ticker,source_type,source,title,url,published_at,engagement,relevance_score,tone,positive_hits,negative_hits,earnings_growth,ai_gemini,search_ads,cloud,youtube,waymo_autonomy,android_platform,regulatory_legal,capex_infra,valuation,shareholder_return
GOOGL,finnhub_news,Yahoo,Update: Market Chatter: Google in Talks to Allow Pentagon to Use Gemini AI Models in Classified Settings,https://finnhub.io/api/news?id=91f4a26a9e419c46fec0ae5954e0b6059a148cbb087af40eb990b1e0fb37bdc1,2026-04-16T14:03:49+00:00,,6,neutral,0,0,0,3,0,0,0,0,0,0,0,0,0
GOOGL,finnhub_news,Finnhub,Google Cloud announces general availability of BigQuery Studio notebook gallery,https://finnhub.io/api/news?id=0832efc96e9f985fbc53dbfcee7efb59dfecdff3e53b7972dffe055fb209c3e4,2026-04-16T13:47:54+00:00,,6,neutral,0,0,0,0,0,2,0,0,0,0,0,0,0
GOOGL,finnhub_news,Yahoo,"OpenAI Pushes Into Digital Ads, Setting Up New Competition with Alphabet (GOOGL) and Meta (META)",https://finnhub.io/api/news?id=d4b41432c8f96ac12aa09653633d2ae43c3dffc360fc500d2fc708b84fe6d419,2026-04-16T13:45:43+00:00,,6,neutral,0,0,1,2,1,0,0,0,0,0,0,0,0
GOOGL,finnhub_news,Yahoo,Jim Cramer Discusses AppLovin in Light of Google Competition Fears,https://finnhub.io/api/news?id=708c55799ddf5518d168cc782f8d29b40c3d3d12983a74b4cf4adca98dfcbb07,2026-04-16T13:39:47+00:00,,6,positive,1,0,0,0,0,0,0,0,0,0,0,0,0
GOOGL,finnhub_news,Yahoo,"Google, Pentagon discuss classified AI deal, the Information reports",https://finnhub.io/api/news?id=7980aa29b1676909b1a6197a85e32e4298a04cf6594a33560312dbaccd5e8715,2026-04-16T13:23:58+00:00,,6,neutral,0,0,0,3,0,0,0,1,0,0,0,0,0
GOOGL,finnhub_news,Yahoo,"Quickplay Deploys Gray Media's New Streaming Platform -- Powered by Google Cloud AI -- Across 113 Markets, Redefining the Future of Local Media Delivery",https://finnhub.io/api/news?id=1237da55e410bdf9c1f2b6807afbd10291f980af3838aacc2ac2ccade39c5257,2026-04-16T13:05:00+00:00,,6,positive,1,0,0,1,0,2,1,0,0,0,0,0,0
GOOGL,finnhub_news,Yahoo,Is Alphabet (GOOGL) Still an Undervalued AI Stock to Buy Now?,https://finnhub.io/api/news?id=928a6a69ec05181d826a40b3909e0ce56d4aee7317a9728fff9b17f35cb6e68f,2026-04-16T13:00:02+00:00,,6,positive,1,0,0,1,2,0,0,0,0,0,0,2,0
GOOGL,finnhub_news,Yahoo,NetApp Collaborates with Google Cloud to Power Data Infrastructure for Distributed Cloud,https://finnhub.io/api/news?id=afaba49a5fda6a2536015e26f40e2b2313b92290f75870fecc6c2b5810dd7a6d,2026-04-16T12:00:00+00:00,,6,neutral,0,0,0,0,0,2,0,0,0,0,1,0,0
GOOGL,finnhub_news,Yahoo,Avid and Google Cloud Announce Partnership to Bring Agentic AI to Media Production,https://finnhub.io/api/news?id=bb76b9e5b72563dd158993ed7b955691805a0a22c89c10593a5ed1f1fab60743,2026-04-16T12:00:00+00:00,,6,neutral,0,0,0,3,0,2,0,0,0,0,0,0,0
GOOGL,finnhub_news,Yahoo,Update: Google Sent Preliminary Findings From European Commission on Proposed DMA Compliance Measures,https://finnhub.io/api/news?id=05ad4ba576c2983d93fea6ef2cdf2aab31eadefdf09f3b9390078d30e247c373,2026-04-16T11:39:01+00:00,,6,negative,0,1,0,0,0,0,0,0,0,1,0,0,0
GOOGL,finnhub_news,Finnhub,Google in talks with Pentagon to deploy AI in classified environments,https://finnhub.io/api/news?id=ab3390df44f4461b9f012bb612847bdb932aa39ee740eea36fb39912f7e395e5,2026-04-16T11:08:42+00:00,,6,neutral,0,0,0,4,0,0,0,0,0,0,0,0,0
GOOGL,finnhub_news,SeekingAlpha,Broadcom Asserts XPU Advantage While Partner Alphabet Rejoins The $4T Club,https://finnhub.io/api/news?id=d296729085f667f416af3ab6c9aa81f0eccf949b5cd5d80514ae1a3de9ea61d0,2026-04-16T10:46:26+00:00,,3,neutral,0,0,0,0,0,0,0,0,0,0,0,0,0
GOOGL,finnhub_news,Yahoo,"AI Native Market Research and Forecast Report 2026-2032 with Deep Dives Into Cursor/Anysphere, Lovable, Replit, Tessl, Windsurf, and the Hyperscale Plays from Microsoft, Google, and AWS",https://finnhub.io/api/news?id=0cee83123e20049aea0bc9dbaa55e994127fcc94d45e93113b6d706e7b32255f,2026-04-16T10:36:00+00:00,,6,neutral,1,1,0,1,1,0,0,1,0,0,0,0,0
GOOGL,finnhub_news,Benzinga,"Trade Strategy For SPY, QQQ, AAPL, MSFT, NVDA, GOOGL, META, And TSLA",https://finnhub.io/api/news?id=6fa3ba9a489c15e851532504e38c2a0811676b199f380a7005e7cd8fd8196674,2026-04-16T10:29:17+00:00,,2,neutral,0,0,0,0,0,0,0,0,0,0,0,0,0
GOOGL,finnhub_news,Yahoo,"Google should allow third-party search engines access to data, EU says",https://finnhub.io/api/news?id=3314d50c47bfb7b3e65e8aec250b832ad0075f40ee656bc38d2e1012996e4cb8,2026-04-16T10:14:20+00:00,,6,negative,0,1,0,1,1,0,0,0,0,2,0,0,0
GOOGL,finnhub_news,Benzinga,'Google and Pentagon Discuss Classified AI Deal as Company Rebuilds Military Ties'- The Information,https://finnhub.io/api/news?id=1c4495bfe8117ecb13d48ab85c8f631da0c2b53d046409e3e50313212f132ede,2026-04-16T09:45:45+00:00,,6,neutral,0,0,0,1,0,0,0,0,0,0,0,0,0
GOOGL,finnhub_news,Yahoo,"Global Market for Computing and AI for Data Centers 2026-2040: AI ASICs is the Fastest-growing Processor Category, As Companies Including Google, Amazon, Microsoft, Meta Invest Heavily",https://finnhub.io/api/news?id=37a2a6ab294234d39bd4b622f1449b0e99c83ba4019690c15f1a768bf5c4ca0d,2026-04-16T09:31:00+00:00,,6,positive,2,0,0,2,1,1,0,0,0,0,1,0,0
GOOGL,finnhub_news,Benzinga,Commission Proposes Measures To Google On Sharing Search Engine Data With Third Parties Under Digital Markets Act,https://finnhub.io/api/news?id=1fa5cfa36d972083857e6881dd86a7300189d71f1969549978cfa180c20c094a,2026-04-16T09:15:12+00:00,,6,negative,0,1,0,0,1,0,0,0,0,1,0,0,0
GOOGL,finnhub_news,Finnhub,Rpt: Google and Pentagon discuss classified AI deal as company rebuilds military ties - The Information,https://finnhub.io/api/news?id=8c070416671eb0eb8b5d3fc857331aed722814bae8d782df184f442955eb07d9,2026-04-16T09:05:19+00:00,,6,neutral,0,0,0,1,0,0,0,0,0,0,0,0,0
GOOGL,finnhub_news,Finnhub,EU Tells Google to Open Up Search Engine Data to Rivals -- Update,https://finnhub.io/api/news?id=ff4f5ceb2e59bd81627dc92ac226e996c2fa31b9d646f6d11783dcb7b8d6661c,2026-04-16T08:51:47+00:00,,6,neutral,0,0,1,0,1,0,0,0,0,1,0,0,0
GOOGL,finnhub_news,Yahoo,"Zacks Investment Ideas feature highlights: Coherent, Bloom Energy, Nebius Group, Amazon, Alphabet and Meta Platforms",https://finnhub.io/api/news?id=03fb1f8565b36456201379295442e348bdb32a73322dfe66e27c01d4a07d287a,2026-04-16T07:04:00+00:00,,3,positive,1,0,0,1,0,0,0,0,0,0,0,0,0
GOOGL,finnhub_news,Yahoo,"Alphabet Targets Higher AI Capex for 2026, Does This Make It a Buy?",https://finnhub.io/api/news?id=2874c4acf9059c8174d5d7d00828fcee31729878eae4994a2fc9fec6048cd9a4,2026-04-16T06:45:55+00:00,,3,neutral,0,0,0,1,0,0,0,0,0,0,2,1,0
GOOGL,finnhub_news,Finnhub,"Eu Commission Due To Issue Final Decision, Which Will Be Binding For Google, By July 27",https://finnhub.io/api/news?id=be100440999f1974b3557db8f52e939ccccd633bd5b6b4ae8955b04dc0abd6a3,2026-04-16T05:59:33+00:00,,6,negative,0,1,0,0,0,0,0,0,0,1,0,0,0
GOOGL,finnhub_news,Finnhub,Eu commission: google should allow third party search engines to access search data,https://finnhub.io/api/news?id=1fe7bd3a40e4a1c1a8f73866f31c2042cebec8c3dbdc3385b51fc1a7bb07d497,2026-04-16T05:57:25+00:00,,6,negative,0,1,0,0,1,0,0,0,0,1,0,0,0
GOOGL,finnhub_news,Finnhub,Eu Commission Proposes Measures To Google On Sharing Search Engine Data With Third Parties,https://finnhub.io/api/news?id=06c86e64937b0c6784c50c4874142dc5aa1b19dee51a5a59dc76ed779a123169,2026-04-16T05:55:37+00:00,,6,negative,0,1,0,0,1,0,0,0,0,1,0,0,0
GOOGL,finnhub_news,Yahoo,Alphabet Faces Legal Pressures While Pursuing Enterprise AI Growth Potential,https://finnhub.io/api/news?id=1995da9eabb5a67dc49c552e11654c0bce09550e644b9e0238875f88a33d2990,2026-04-15T22:06:57+00:00,,3,negative,1,3,0,2,1,0,0,0,1,3,0,0,0
GOOGL,finnhub_news,Yahoo,GitLab Stock Surges on Google Cloud Deal. Here's What It Means for Investors,https://finnhub.io/api/news?id=ad996f4f50ad75daca8bd767bb34e5c312cf1bac982485342e2fa742490546dc,2026-04-15T20:47:29+00:00,,6,neutral,0,0,0,1,0,2,0,0,0,0,0,0,0
GOOGL,finnhub_news,Yahoo,Google Faces Another App Store Showdown,https://finnhub.io/api/news?id=2dd03d86b422e58f6ff28ad018683891a9d733db59b4564841e2ad49227d3c95,2026-04-15T19:24:28+00:00,,6,negative,0,1,0,0,0,0,0,0,2,1,0,0,0
GOOGL,finnhub_news,Yahoo,Google Push May Accelerate Enterprise AI Adoption,https://finnhub.io/api/news?id=d219133ff0d775aab41a68b234a5f0fc52a68d9ae92353505516d9fb449609d0,2026-04-15T19:16:18+00:00,,6,neutral,0,0,0,1,0,0,0,0,0,0,0,0,0
GOOGL,finnhub_news,Yahoo,"Cadence Design Systems Expands Nvidia Partnership, Collaborates with Google Over AI Chip Design, Accelerated Computing",https://finnhub.io/api/news?id=f7b9c8f6b5f44776817046935061c0f8d3d88f34d13359141a0b015b2358756c,2026-04-15T18:05:05+00:00,,6,neutral,0,0,0,1,0,0,0,0,0,0,0,0,0
GOOGL,finnhub_news,Yahoo,Cadence and Google Collaborate to Scale AI-Driven Chip Design with ChipStack AI Super Agent on Google Cloud,https://finnhub.io/api/news?id=ddbc14839a213d95e457a7af5d748ef8e93c974ce31f1f79ef77cc9020ff0c05,2026-04-15T17:30:00+00:00,,6,neutral,0,0,0,2,0,2,0,0,0,0,1,0,0
GOOGL,finnhub_news,Benzinga,'Google-Linked Data Centers Selling Record $5.7B Junk Bond'- Bloomberg,https://finnhub.io/api/news?id=e6b1d0c46d2267982d9ffe71753354e5298063414f9e2b190c1070f701dfcbb1,2026-04-15T16:50:26+00:00,,6,positive,1,0,1,0,0,1,0,0,0,0,1,0,0
GOOGL,finnhub_news,Yahoo,"Dear Google Stock Fans, Mark Your Calendars for April 22",https://finnhub.io/api/news?id=00c561769ebb48d5ae053e1fa9f196ffcf6e6cd8b24d12c4e9e910302e1fcf21,2026-04-15T16:13:31+00:00,,6,neutral,0,0,0,0,0,2,0,0,0,0,0,0,0
GOOGL,finnhub_news,Yahoo,Will Alphabet (GOOGL) Beat Estimates Again in Its Next Earnings Report?,https://finnhub.io/api/news?id=a2ad515da9b08f0795e9eac381218566e1c2466ffab237f7b46c89e9ce034cd4,2026-04-15T16:10:02+00:00,,6,positive,2,0,3,0,0,0,0,0,0,0,0,0,0
GOOGL,finnhub_news,Yahoo,"This CEO has teamed up with Google, Microsoft, and McKinsey to build an AI degree that could rival Harvard—and it will only cost $10,000 to attend",https://finnhub.io/api/news?id=c564c2519a34bac66224da680072cc8dbb09bade5419e78611535174ccd52fcf,2026-04-15T15:20:35+00:00,,6,neutral,0,0,0,1,0,0,0,0,0,0,0,0,0
GOOGL,finnhub_news,Benzinga,'Alphabet Poised for $100 Billion Windfall on SpaceX Investment' - Bloomberg,https://finnhub.io/api/news?id=593e4ff2aa5cdc17e751fdf182d87c945f6d008a88cf69e36dc99c0f8ba66d53,2026-04-15T14:50:34+00:00,,3,neutral,1,1,0,0,0,0,0,0,0,0,0,0,0
GOOGL,finnhub_news,Finnhub,Alphabet poised for $100 billion windfall on SpaceX investment - Bloomberg news,https://finnhub.io/api/news?id=37b958769474ee8fd17a213e778a697f0401430a6c636066d48971603ddc332f,2026-04-15T14:41:33+00:00,,3,neutral,1,1,0,0,0,0,0,0,0,0,0,0,0
GOOGL,finnhub_news,Finnhub,Cadence Partners With Google to Connect Its AI Tools With Gemini,https://finnhub.io/api/news?id=001f39f22364ca7443688774da6d8aa3d601a812456fe3bc50de82ded8892d30,2026-04-15T14:18:12+00:00,,6,neutral,0,0,0,4,1,1,0,0,0,0,0,0,0
GOOGL,finnhub_news,Finnhub,Cadence Design Systems says it is integrating its chip design AI with Google's Gemini AI assistant and will be available on Google's Cloud,https://finnhub.io/api/news?id=4fa02e9648989a0c00508413788725e503ed717964329fff193e0c22a37b85f9,2026-04-15T13:35:34+00:00,,6,neutral,0,0,0,2,0,1,0,0,0,0,0,1,0
GOOGL,finnhub_news,Finnhub,Cadence & Google collaborate to scale AI-driven chip design,https://finnhub.io/api/news?id=1abc06149bcd7a8372fe71133b8867db9e9283c4a88e850c990480739e132fe0,2026-04-15T13:33:34+00:00,,6,neutral,0,0,0,1,0,2,0,0,0,0,1,0,0
GOOGL,finnhub_news,Benzinga,"Cadence Design Systems Teams With Google To Integrate Gemini AI Into ChipStack Super Agent, Targeting Up To 10× Chip Design Productivity Gains",https://finnhub.io/api/news?id=b8d012bf44b83ecf13d743a4137c787bb6d8fd9d45ddbc2ec5416c18b395b2f5,2026-04-15T13:32:15+00:00,,6,neutral,0,0,0,3,0,0,0,0,0,0,1,0,0
GOOGL,finnhub_news,Yahoo,"Dow Jones Futures Eye U.S.-Iran Talks; Google, Amazon, Nvidia In Buy Areas",https://finnhub.io/api/news?id=ff1f0209f14200f6ff2b5a1ce57fa47649765a9d4d9ab750265f6dcb42716e44,2026-04-11T21:18:15+00:00,,4,neutral,0,0,1,0,0,0,0,0,0,0,0,0,0
GOOGL,finnhub_news,Yahoo,"Dow Jones Futures Eye Direct U.S.-Iran Talks; Google, Amazon, Nvidia In Buy Areas",https://finnhub.io/api/news?id=c69e0d6ed7648d0cbadb4013d0ae5e20a1b65818660e9338b1997e88255a1c36,2026-04-11T19:49:03+00:00,,4,neutral,0,0,1,0,0,0,0,0,0,0,0,0,0
GOOGL,finnhub_news,Yahoo,"Google (GOOGL), Intel (INTC) Partner to Advance AI Cloud Infrastructure",https://finnhub.io/api/news?id=22288566ed12f72426053e4addd1a4b5e2616f8064e387c6cb4736ad8193c4a6,2026-04-11T17:34:35+00:00,,6,neutral,0,0,0,1,0,1,0,0,0,0,1,1,0
GOOGL,finnhub_news,Yahoo,Alphabet’s SpaceX Windfall Could Recast Funding For AI And Cloud Growth,https://finnhub.io/api/news?id=4439a06886d068cc79fec9eda380c7ee8cfdb25ce638c3b2a10a226275db43eb,2026-04-11T17:12:04+00:00,,3,positive,4,1,1,1,0,1,0,0,0,0,0,1,0
GOOGL,finnhub_news,Yahoo,"Dow Jones Futures: Direct U.S.-Iran Talks Begin; Google, Amazon, Nvidia In Buy Areas",https://finnhub.io/api/news?id=0207dba5f957c8bd41860c1ffa8c51034ecf9c355943b483d7b4bc7797c17323,2026-04-11T16:12:31+00:00,,4,neutral,0,0,1,0,0,0,0,0,0,0,0,0,0
GOOGL,finnhub_news,Yahoo,Alphabet (GOOGL) Is Up 7.3% After Waymo Expands Robotaxi Service To Nashville - What's Changed,https://finnhub.io/api/news?id=046f799d9e53c7540483b4b47de19ad53a709c9785ba95be1d5b8e32b944e3f8,2026-04-11T16:07:57+00:00,,6,neutral,0,0,0,1,0,0,0,3,0,0,0,0,0
GOOGL,finnhub_news,Yahoo,Google And Four Blue Dots Lead 5 Stocks Near Buy Points,https://finnhub.io/api/news?id=53d9c98af65b7bd30734763f97da40ffe9fb8de7517fc97aaf15daa6e931aab9,2026-04-11T15:30:37+00:00,,6,negative,0,1,0,0,0,0,0,0,0,0,0,1,0
GOOGL,finnhub_news,Yahoo,Analysts Love Alphabet Stock — They Just Can’t Agree On a Direction,https://finnhub.io/api/news?id=548df2a75d01f52df41a53a5438751afb11f070194b9945e4928751803c06c11,2026-04-11T15:15:28+00:00,,3,positive,3,0,0,0,1,0,0,0,0,0,0,3,0
GOOGL,finnhub_news,Yahoo,"Dow Jones Futures: U.S.-Iran Peace Talks Begin; Google, Amazon, Nvidia In Buy Areas",https://finnhub.io/api/news?id=c17c990df3f7b5459d0bd93fb41bc0c99ec34c8b12e7e2cbb68d445bff21ec42,2026-04-11T13:18:43+00:00,,4,neutral,0,0,1,0,0,0,0,0,0,0,0,0,0
GOOGL,finnhub_news,Yahoo,Ross Gerber Demands $10K Refund If Tesla's New FSD Doesn't Work 'Unsupervised'—Says Google Has 'Solved' Autonomy With Waymo,https://finnhub.io/api/news?id=0952c267a06a23e4dfc420f0f8fefaec44619bbd32060c42481c0656d68fa71e,2026-04-10T21:30:40+00:00,,6,neutral,0,0,0,0,0,0,0,2,0,0,0,0,0
GOOGL,finnhub_news,Yahoo,I'm Calling It: Alphabet Stock Is a Buy Before June 2026,https://finnhub.io/api/news?id=5ab64a52bb838d0e0211aaf6fe7ccf28c62753ce26a1183214f2342059c4d9c7,2026-04-10T21:25:00+00:00,,3,neutral,0,0,0,0,0,0,0,0,0,0,0,0,0
GOOGL,finnhub_news,Yahoo,"Dow Jones Futures: Iran Talks, Earnings In Focus; Google, Amazon, Nvidia In Buy Areas",https://finnhub.io/api/news?id=14f791d3660039c38e1792a07cc7e22609a60b6747819fa254e4bc6ef473a359,2026-04-10T20:37:29+00:00,,4,neutral,0,0,1,0,0,0,0,0,0,0,0,0,0
GOOGL,finnhub_news,Yahoo,Why Alphabet is a 'really misunderstood story' for investors,https://finnhub.io/api/news?id=534952c89f21b9be4d9bc5e51ee3468c2a137be8691c1154fb426b5299463d3f,2026-04-10T20:31:47+00:00,,3,neutral,0,0,1,0,0,0,0,0,0,0,0,0,0
GOOGL,finnhub_news,Yahoo,YouTube Raises Prices But There's A Bigger Shift Behind It,https://finnhub.io/api/news?id=a0837df8936861976c1b50879305628c947ae565a6d0419afb8f554d31694f77,2026-04-10T19:23:56+00:00,,3,neutral,0,0,0,0,0,0,2,0,0,0,0,0,0
GOOGL,finnhub_news,Yahoo,"Google, IBD Stock Of The Day, Rebounding Ahead Of First Quarter Earnings Amid Capex Worries",https://finnhub.io/api/news?id=56e37c635de1c53663ab67e8965a4c5ef8a546f171a615ab35e57102bc378f19,2026-04-10T17:11:37+00:00,,6,positive,2,0,2,1,1,0,0,0,0,0,1,0,0
GOOGL,finnhub_news,Yahoo,"Got $10,000? Here’s the Clear Winner Between Meta and Alphabet",https://finnhub.io/api/news?id=a5c9f2fdc4370cb9f9d092cd1f6458b6095d55f1526a6ef6856036ecc5beed19,2026-04-10T16:27:44+00:00,,3,positive,3,2,2,2,1,2,0,0,0,1,0,0,0
GOOGL,finnhub_news,Yahoo,Alphabet Intel Chip Alliance Tests AI Growth Against Resource Constraints,https://finnhub.io/api/news?id=5e078861eeedb78f3119d6c3741abff5493d6c30fad6a4b25f6305e70e4db1a7,2026-04-10T16:12:51+00:00,,3,positive,2,0,0,1,1,3,0,0,0,0,3,0,0
GOOGL,finnhub_news,Yahoo,Update: Alphabet's YouTube Raises US Premium Subscription Prices,https://finnhub.io/api/news?id=b61d5ca3ce6d5d2ce7a613a4a185f2542ed8b536cc3ecb59fc95ce2e3fc96ec4,2026-04-10T16:11:06+00:00,,3,neutral,0,0,0,0,0,0,1,0,0,0,0,0,0
GOOGL,finnhub_news,Yahoo,Can Intel's Long-Term AI Cloud Deal With Google Drive Future Profit?,https://finnhub.io/api/news?id=644ac2d57a7de8ab049c7d4fcda17c9734710fe6f6038434943f5bb383b75659,2026-04-10T15:11:00+00:00,,6,positive,1,0,1,1,0,2,0,0,0,0,1,0,0
GOOGL,finnhub_news,Yahoo,Alphabet's Google Has Given Birth to 3 Millionaire-Maker Stocks Hiding in Plain Sight. All of Them Are Trading at Incredible Valuations Right Now.,https://finnhub.io/api/news?id=1c81ae271ed86bb99201bbdae9ba5cbcbed116c122f06606ce31503c48726df0,2026-04-10T14:50:00+00:00,,6,positive,1,0,0,0,0,0,0,0,0,0,0,1,0
GOOGL,finnhub_news,Yahoo,"Meta's Muse Spark AI Model Impressed. Here's The Next Test In Race With Google, OpenAI.",https://finnhub.io/api/news?id=8641a8ff27f0c0f056ff273f7c124235ce8d0139eb8f1973897bbe8af1a2b103,2026-04-10T14:49:18+00:00,,6,neutral,0,0,0,3,0,0,0,0,0,0,0,1,0
GOOGL,finnhub_news,Yahoo,Intel-Google Deal Hints At AI's Next Real Fight,https://finnhub.io/api/news?id=e954e52212a76ac8c9446acb2ca3975d7045cd47a7a2b571558e337db63c21e8,2026-04-10T14:36:40+00:00,,6,neutral,0,0,0,0,1,0,0,0,0,0,1,0,0
GOOGL,finnhub_news,Yahoo,RDDT vs. GOOGL: Which Digital Advertising Stock Is a Better Buy?,https://finnhub.io/api/news?id=ffebf55c8e64d146f656b336e258effa66b807177e8c7f3991597a475241eca3,2026-04-10T14:36:00+00:00,,4,positive,3,0,0,0,1,0,0,0,0,0,0,0,0
GOOGL,finnhub_news,Yahoo,Alphabet Inc. (GOOGL): Israel Englander Trims Holding,https://finnhub.io/api/news?id=ac64d437e50298dab1cfe7294c6f5350d9b97a6c78cc9286e2d281fb44dd4478,2026-04-10T14:33:21+00:00,,6,neutral,0,0,1,0,0,0,0,0,0,0,0,0,0
GOOGL,finnhub_news,Yahoo,Intel Teams Up With Google on AI Infrastructure,https://finnhub.io/api/news?id=897dcfef6e8f0214bcbfe1aa8d7c0ca43ba7ac328d7942a488de018ac37202d4,2026-04-10T14:32:23+00:00,,6,neutral,0,0,0,1,0,1,0,0,0,0,1,0,0
GOOGL,finnhub_news,Yahoo,Is Microsoft Stock A Smarter Buy Than Google After Its Massive 250% Rally?,https://finnhub.io/api/news?id=a609ee22a1703959d0520a3d17ba8e4c6b8ef018de7b3053125fed3fbf18d646,2026-04-10T13:56:14+00:00,,6,positive,1,0,1,0,0,0,0,0,0,0,0,1,0
GOOGL,finnhub_news,Benzinga,"Google's Gemini, Anthropic's Claude Siphon Market Share From ChatGPT: Analyst",https://finnhub.io/api/news?id=cf183ce96c3513e8938d188eee0e8bdc0e997dcd59d986ac11721cf6f0462613,2026-04-10T13:49:55+00:00,,6,positive,1,0,0,3,0,0,0,0,0,0,0,1,0
GOOGL,finnhub_news,Yahoo,This Billionaire Is Piling Into Alphabet (GOOGL) Shares Despite AI Search Threats – Here’s Why,https://finnhub.io/api/news?id=38a1b8a00341ddb4c761ffcffdb6d1bc59f1ed3bedcbf5cb6d6414536e9e2807,2026-04-10T13:12:19+00:00,,6,negative,0,1,1,1,1,0,0,0,0,0,0,0,0
GOOGL,finnhub_news,Yahoo,Alphabet Is Quietly Building Its Next Major Business -- and It Could Be Bigger Than You Think,https://finnhub.io/api/news?id=dc64a2ea2ea8464976a1e57b441f13be9d29d36ebf3816ae6b527cb277511b0a,2026-04-10T12:50:00+00:00,,3,neutral,0,0,0,2,0,0,0,0,0,0,1,0,0
GOOGL,finnhub_news,Benzinga,"If You Invested $1000 In Alphabet Stock 15 Years Ago, You Would Have This Much Today",https://finnhub.io/api/news?id=8267600e85ebe48711b218b687fefc0c8624ffa51ed0920a733394e375d36ee3,2026-04-10T12:45:58+00:00,,3,neutral,0,0,0,0,0,0,0,0,0,0,0,0,0
GOOGL,finnhub_news,Yahoo,Google Just Changed the Rules - Chris Jacques Reveals What Businesses Must Do to Survive in 2026,https://finnhub.io/api/news?id=e743e3aac4c8bd4e73589d0455d0bb6063fe7d153b27819e13e4ce06f08b7e21,2026-04-10T12:30:00+00:00,,6,neutral,0,0,0,0,2,0,0,0,0,0,0,0,0
GOOGL,finnhub_news,Yahoo,Broadcom Higher Amid Alphabet Partnership After Earnings Beat,https://finnhub.io/api/news?id=f3fb53ff9f68414cc4dbaf0004c9d5a98ea24fb92211f8688f1fe03931c011cb,2026-04-10T12:00:26+00:00,,3,positive,2,0,2,1,0,0,0,0,0,0,0,0,0
GOOGL,finnhub_news,Benzinga,'YouTube Premium Is Increasing U.S. Prices For The First Time Since 2023; Says Individual Subscription Plan To Cost $15.99 Per Month; Family Plan $26.99 Per Month' - Business Insider,https://finnhub.io/api/news?id=85f18bd8e03f639bbed2b0d3a716b71e384414d17648022046fd7cbeed02e6da,2026-04-10T11:01:47+00:00,,3,neutral,0,0,0,0,0,0,1,0,0,0,0,0,0
GOOGL,finnhub_news,Yahoo,Why Microsoft and Google could be the best Mag 7 stock picks,https://finnhub.io/api/news?id=47724d7d2050eb4d4321daea5788c6004ef3122fe3c274ffd3750a03412273a6,2026-04-10T11:00:00+00:00,,6,neutral,0,0,0,0,0,0,0,0,0,0,0,0,0
GOOGL,finnhub_news,Yahoo,"While Amazon, Microsoft, Google Struggle With AI On Land — China Looks To The Sea",https://finnhub.io/api/news?id=2f08aa2aed420d6c0cdf62608dc954a8e167c924da08d00843d9fe2b37f77c2c,2026-04-10T09:46:02+00:00,,6,neutral,1,1,0,1,0,1,0,0,0,1,2,1,0
GOOGL,finnhub_news,SeekingAlpha,Intel: Why The Alphabet Collaboration Is A Bigger Signal Than It Looks,https://finnhub.io/api/news?id=86eaf047db0ca3f6161d96fa93ca1c3ba4f69448a6d5f07af34bd72d38fdf375,2026-04-10T09:32:13+00:00,,3,neutral,0,0,0,1,0,0,0,0,0,0,0,0,0
GOOGL,finnhub_news,Yahoo,Swedish Court Reschedules Delivery of Judgment in PriceRunner vs Google Antitrust Case,https://finnhub.io/api/news?id=b2507304485694f9a41231326dc2e04a15e14038376d05e1d6f4239557cc2c72,2026-04-10T09:30:00+00:00,,6,negative,0,1,0,0,1,0,0,0,0,2,0,0,0
GOOGL,finnhub_news,Yahoo,Why Hut 8 (HUT) Is Up 31.8% After Google AI Deal And $10 Billion Data Center Plan,https://finnhub.io/api/news?id=4c03361c203da5b85c25ca73a212d715cb02a35f6fe79bddfe1be3f5b526a552,2026-04-10T09:19:38+00:00,,6,neutral,0,0,1,2,0,1,0,0,0,0,2,0,0
GOOGL,finnhub_news,Yahoo,Jim Cramer Shows Positive Sentiment Toward Broadcom’s Google and Anthropic Deals,https://finnhub.io/api/news?id=239621cea3e2260c33412c672b9bf5f3594aea12a6d8b2c6dd7e56484145ba36,2026-04-10T06:03:08+00:00,,6,neutral,0,0,0,0,0,0,0,0,0,0,1,0,0
GOOGL,finnhub_news,Yahoo,Jim Cramer Explains Why He Chose to Stay in Alphabet Stock,https://finnhub.io/api/news?id=52225bc732dabcfea7ee395370ffee4d35a2aaad9c2de48ceeb1f728b0997840,2026-04-10T06:03:07+00:00,,3,positive,1,0,0,1,0,0,0,0,0,0,0,0,0
GOOGL,finnhub_news,Benzinga,Alphabet's Tesla Robotaxi Rival Waymo Announces Partnership With Waze To Help Cities Fix Potholes,https://finnhub.io/api/news?id=5eda4044ebb420cb542560ec1955dfeec593ce1fc26a743c1a1a4a0e6cb53783,2026-04-10T05:14:03+00:00,,3,neutral,0,0,0,0,0,0,0,2,0,0,0,0,0
GOOGL,finnhub_news,Yahoo,Is Alphabet (GOOGL) One of the Best Growth Stocks to Buy for the Next Decade?,https://finnhub.io/api/news?id=66e5ea7e88d937e8a65d578b4bec7c12789e996da8c6c4d6f2f710f81ea73fd9,2026-04-10T05:02:32+00:00,,6,positive,2,0,0,0,0,2,0,0,0,0,0,0,0
GOOGL,finnhub_news,Yahoo,Intel And Google Tie AI IPU Push To Lofty Share Price,https://finnhub.io/api/news?id=edd913da8533e2d5a8b7802694368b2a0ce689c2f008ce6275b1a27f91d4e776,2026-04-09T23:12:30+00:00,,6,neutral,0,0,0,1,1,1,0,0,0,0,1,2,0
GOOGL,finnhub_news,Yahoo,Intel Announces Google Commitment To Future Xeon Chips In AI Push,https://finnhub.io/api/news?id=6d466acd5fb6b6bbfb90320bc5d96eb631b574ee1434290917e2e0ed23c37f70,2026-04-09T22:36:15+00:00,,6,neutral,0,0,0,1,0,0,0,0,0,0,2,0,0
GOOGL,finnhub_news,Yahoo,3 Reasons We’re Fans of Alphabet (GOOGL),https://finnhub.io/api/news?id=145e523453a7732bf756a6d420c6c2a6e66e0ac68a3f9d471b79f906af37dc27,2026-04-09T21:33:47+00:00,,6,positive,1,0,2,0,0,0,0,0,0,0,0,0,1
GOOGL,finnhub_news,Yahoo,Google and Intel deepen AI infrastructure partnership,https://finnhub.io/api/news?id=bd52026a6c6689bcde9c9ab723f307736c2047041d64879927b0cbb98600b8de,2026-04-09T18:27:47+00:00,,6,positive,1,0,0,1,0,0,0,0,0,0,2,0,0
GOOGL,finnhub_news,Yahoo,Intel Stock Rises on Massive Google Deal,https://finnhub.io/api/news?id=4ce4c65744695ad8c7ce626621c4e90563a9ca1c8539fff3e7dc6cb11646dbcb,2026-04-09T17:31:31+00:00,,6,neutral,0,0,0,1,0,1,0,0,0,0,1,0,0
GOOGL,finnhub_news,Yahoo,Alphabet vs. Microsoft: A Comparison of Recent Revenue Trends,https://finnhub.io/api/news?id=e74fa881cc52179c40fb02c3cb4ffa8b7cd40f58e40589c08e29fab8fac132f9,2026-04-09T17:01:16+00:00,,3,positive,1,0,4,1,0,0,0,0,0,0,0,0,0
GOOGL,finnhub_news,Yahoo,Intel Racks Up Another Win With Google AI Chip Deal,https://finnhub.io/api/news?id=431a3e2652aaabcafb9333a4a1f37a88e34ec12f2acbd24418b226476c7f350f,2026-04-09T16:45:25+00:00,,6,positive,1,0,0,1,0,0,0,0,0,0,0,0,0
GOOGL,finnhub_news,Yahoo,DeepMind CEO Called It Wartime When ChatGPT Hit 100 Million Users and Google Went All In,https://finnhub.io/api/news?id=48bf6c15118f489a6399ac476faa4ccf758c3027be4517a51685cba40488fb69,2026-04-09T15:32:33+00:00,,6,neutral,0,0,1,3,0,0,0,0,0,0,0,0,0
GOOGL,finnhub_news,Yahoo,"Top Midday Stories: CoreWeave Signs $21 Billion AI Deal With Meta; Intel, Google Expand Partnership",https://finnhub.io/api/news?id=abb23d53f2ad667effb813ab97b158b479c847863c45ebf4230db7535e585249,2026-04-09T15:30:26+00:00,,6,neutral,0,0,0,1,0,0,0,0,0,0,0,0,0
GOOGL,finnhub_news,SeekingAlpha,Alphabet Stock Defies AI's Gravity,https://finnhub.io/api/news?id=b2e2d238b478ce1af3e366409696ee9334e9e2ec16bb60dc539cf5147b3d59a9,2026-04-09T15:09:30+00:00,,3,positive,2,0,0,0,0,1,1,0,0,0,0,1,0
GOOGL,finnhub_news,Yahoo,William O’Neil Reinstates Alphabet With a Buy: Is the Search Giant’s Self-Driving Future Finally Getting Its Due?,https://finnhub.io/api/news?id=0c9a0453892e339c5561e3c49dd73deb04da292bd03d9318072e28521c5c5919,2026-04-09T14:32:37+00:00,,3,positive,1,0,1,0,1,0,0,2,0,0,0,2,0
GOOGL,finnhub_news,Yahoo,Intel extends weekly gain to over 33% on Google AI collaboration,https://finnhub.io/api/news?id=99e7c4ef0ec5f83cdf8bbf61af64e4904e87a87d588638e5f377bbbf5491bbdd,2026-04-09T13:55:39+00:00,,6,neutral,0,0,0,1,0,0,0,0,0,0,1,0,0
