ticker,source_type,source,title,url,published_at,engagement,relevance_score,tone,positive_hits,negative_hits,earnings_profitability,nii_margin_rates,credit_risk_provisions,investment_banking_markets,consumer_cards_deposits,dimond_ceo_governance,regulation_capital,capital_return_buyback,ai_technology_fintech,valuation_defensive_bank,macro_geopolitical
JPM,finnhub_news,Yahoo,Jamie Dimon says the next credit crisis will be 'worse than people expect' — here's what big bank earnings have revealed,https://finnhub.io/api/news?id=14c80b6becf286df7ac6bcc91f61ebb4b8132a9340a8ce211f39e84c76710f75,2026-05-02 11:15:00+00:00,,15,neutral,0,0,2,0,2,0,0,3,0,0,0,0,0
JPM,finnhub_news,Yahoo,"JPMorganChase Files Form 10-Q for the Quarter Ended March 31, 2026",https://finnhub.io/api/news?id=b6bf6ad03c139094f84468c6712f0f2115c011e323c67b3199596eb2abca1735,2026-05-01 20:28:00+00:00,,10,neutral,0,0,1,0,0,0,0,0,0,0,0,0,0
JPM,finnhub_news,Yahoo,Jamie Dimon Says This Problem Is Killing Companies — and He Blames ‘Jerks’ Who Won’t Fix It,https://finnhub.io/api/news?id=a8c296bf7c251ce3376f61fffe5826282ab6d88cd87a9757b97adae9d3a341cc,2026-05-01 17:40:41+00:00,,14,neutral,0,0,1,0,0,0,0,3,0,0,0,0,0
JPM,finnhub_news,Yahoo,"JPMorgan Is Betting On Tokenization, But ETF Exec Says 'Good Use Cases' Are Years Away",https://finnhub.io/api/news?id=398e273f2952407ad7340e2c78cc7afdddda2ff61de1b3a3d3c586791e45a588,2026-05-01 16:02:31+00:00,,9,neutral,0,0,0,0,0,0,0,0,0,0,0,0,0
JPM,finnhub_news,Yahoo,JPMorgan Chase & Co. (JPM) is Attracting Investor Attention: Here is What You Should Know,https://finnhub.io/api/news?id=2ab15940e54d7101eb5116600e02a89c7dd37fd2359fb9a70097c24820a4121c,2026-05-01 13:00:04+00:00,,9,neutral,0,0,0,0,0,0,0,0,0,0,0,0,0
JPM,finnhub_news,Yahoo,"Here's How Much Exposure JPMorgan Chase, Bank of America, Wells Fargo, and Citigroup Have to Private Credit",https://finnhub.io/api/news?id=ec29b71d3eb0e2eebb3e3a9dd2bd4c9dc0f8967d49dc77617ae6a4b38bc4ce17,2026-05-01 11:05:00+00:00,,7,negative,0,1,0,0,1,0,0,0,0,0,0,0,0
JPM,finnhub_news,ChartMill,JPMorgan Chase & Co. (NYSE:JPM) Breakout Setup with Strong Technical and Setup Ratings,https://finnhub.io/api/news?id=588d928f3a761b44c5715fb56945bdde59094caedece0e48bd7912af127e1b20,2026-05-01 10:20:40+00:00,,9,neutral,1,1,0,0,0,0,0,0,0,0,0,0,0
JPM,finnhub_news,Benzinga,"'Ares, JPMorgan Ink $800 Million Private Credit Deal for GoodLife'- Bloomberg",https://finnhub.io/api/news?id=703bd9960e29c9a20d6ead335c40fde950c1e17ac7b479db1036759505f38c8f,2026-04-30 17:12:09+00:00,,5,neutral,0,0,0,0,1,1,0,0,0,0,0,0,0
JPM,finnhub_news,Finnhub,JPMorgan hires KBW's Mihok as MD in banking team,https://finnhub.io/api/news?id=45952fcd8eefa79e458a50a383378be91481116fcc0231ea8b2955e0646e8df1,2026-04-30 14:45:56+00:00,,6,neutral,0,0,0,0,0,0,0,0,0,0,0,0,0
JPM,finnhub_news,Yahoo,What Are Wall Street Analysts' Target Price for JPMorgan Chase Stock?,https://finnhub.io/api/news?id=069ab341b9123c94863385cf1467d3a36448f138f76cf6c7f82a4cbed9a59798,2026-04-30 11:50:18+00:00,,7,neutral,0,0,0,0,0,0,0,0,0,0,0,1,0
JPM,finnhub_news,Yahoo,Is JPMorgan’s Olympic Banking Deal Reshaping the Global Tech-Expansion Narrative for JPMorgan Chase (JPM)?,https://finnhub.io/api/news?id=79f4b20c94da1408120655a121cbdb41dedbb479039ff19634db6d0eb53bddb4,2026-04-30 11:06:02+00:00,,11,positive,1,0,0,0,0,1,0,0,0,0,1,0,0
JPM,finnhub_news,Yahoo,JPM Stock In Focus After Massive European Growth Initiative,https://finnhub.io/api/news?id=d78ed6c47d2e1eab69ecaa4f05b9848fdac40a440036b2333d2cb840b766fe6b,2026-04-30 09:16:37+00:00,,9,positive,3,0,0,0,0,0,0,0,0,0,0,0,0
JPM,finnhub_news,Benzinga,"Jamie Dimon Says Markets May Be Too Complacent As Deficits Rise, Warns A 'Bond Crisis' And Even Stagflation Could Be Coming",https://finnhub.io/api/news?id=541b3e1331a4a29c118d9f7a3ba175d0433278fc315168eb21fd328842e1ffbf,2026-04-30 07:41:56+00:00,,11,neutral,0,0,0,0,0,0,0,3,0,0,0,0,1
JPM,finnhub_news,Benzinga,Jamie Dimon Warns Trump: 'Economic Relations Are Not Just Tariffs...',https://finnhub.io/api/news?id=03dc2e225b305a12e9bf048d4db9256894696aaa2ab8867584176e5c22d9b84b,2026-04-30 06:00:12+00:00,,8,neutral,0,0,0,0,0,0,0,2,0,0,0,0,1
JPM,finnhub_news,Yahoo,Jamie Dimon says bureaucracy sinks companies and the solution may be getting rid of the ‘jerks’ who don’t want to solve it,https://finnhub.io/api/news?id=29a26d074d377df19d638f499ea758e929a69ddaf9fd767e6296a73b1fbe1959,2026-04-29 19:49:23+00:00,,10,neutral,0,0,0,0,0,0,0,3,0,0,0,0,0
JPM,finnhub_news,Yahoo,JPMorgan CEO has an urgent message for bond market investors,https://finnhub.io/api/news?id=e9465e2b668fa07d3797dd592175da615502a17c5c6b659cf2d5a3f6b66520d7,2026-04-29 18:47:00+00:00,,11,positive,1,0,0,0,1,0,0,3,0,0,0,0,0
JPM,finnhub_news,Yahoo,JPMorgan Chase CEO Jamie Dimon Just Warned Investors of a Potential Debt Crisis. Here's What Investors Should Do.,https://finnhub.io/api/news?id=7f738d154adfb42050d2234a4b51119366d87aa1d922e3a4179325abcbf763ba,2026-04-29 17:07:05+00:00,,13,negative,0,1,0,0,0,0,0,3,0,0,0,0,0
JPM,finnhub_news,Benzinga,Here's How Much You Would Have Made Owning JPMorgan Chase Stock In The Last 20 Years,https://finnhub.io/api/news?id=206ba65159c14084102d4e7cb80f3969ca2026a5c2ca60e27cb9df1fa850ce4d,2026-04-29 10:15:51+00:00,,6,neutral,0,0,0,0,0,0,0,0,0,0,0,0,0
JPM,finnhub_news,Yahoo,JPMorgan Chase becomes first global banking partner of Olympic Games,https://finnhub.io/api/news?id=9f8097ba7346490613620e33b852086a3899fa33f0720a3919ae99d0a234ed51,2026-04-29 09:28:23+00:00,,6,neutral,0,0,0,0,0,0,0,0,0,0,0,0,0
JPM,finnhub_news,Yahoo,Dimon Warns $1.8 Trillion Private Credit Market May Face Sharper Downturn,https://finnhub.io/api/news?id=482149521acd704d47fae837d551cafa7458996a9344f49228ec26c64316c661,2026-04-28 19:32:30+00:00,,8,positive,1,0,0,0,2,0,0,2,0,0,0,0,0
JPM,finnhub_news,Benzinga,Dimon On Private Credit: 'It Won't Be Terrible — Just Worse Than People Think',https://finnhub.io/api/news?id=a9446b62c280f2eddc013257fab5c88f7040d7728be23e0d4c1040d67a338daa,2026-04-28 17:56:06+00:00,,8,neutral,0,0,0,0,2,0,0,3,0,0,0,0,0
JPM,finnhub_news,Benzinga,"CNBC Reporter Seema Mody Posts On X ""WH meeting today on #Mythos included Policy heads from Microsoft, Red Hat, Amazon, Google, CrowdStrike, Palo Alto, Goldman Sachs and JP Morgan, per a source familiar. $ GS $MSFT $AMZN  $JPM  $PANW $CRWD. I'm told no overarching solution came together but discussions are ongoing.""",https://finnhub.io/api/news?id=5592bfe5edd422435963fb16de994462212723f4a6dcf895f512c26f0302d700,2026-04-28 17:41:14+00:00,,6,neutral,0,0,0,0,0,0,0,0,0,0,0,0,0
JPM,finnhub_news,Yahoo,Is It Time To Reassess JPMorgan Chase (JPM) After Its 30% One Year Rally?,https://finnhub.io/api/news?id=0e23fe3c640acf7210fa6175135a3a2201a7b9fa534ab470da163295f57ec164,2026-04-28 17:07:00+00:00,,9,negative,1,2,0,0,0,0,0,0,0,0,0,0,0
JPM,finnhub_news,Finnhub,"JPMorgan CEO says not worried about inflation, risks remain of higher prices",https://finnhub.io/api/news?id=ecd491adc2d1699cfea6f70e79378aa71705535af2b02b171d08a3e0eefc66fb,2026-04-28 14:35:44+00:00,,8,positive,1,0,0,0,0,0,0,1,0,0,0,0,2
JPM,finnhub_news,Yahoo,JPM Off to a Solid 2026 Start: Should Investors Buy the Stock?,https://finnhub.io/api/news?id=48ad2adc67b606b3049d36d9fd685af0dcf4a3d06df4c4fa8cd142ca3bf4c0e1,2026-04-28 13:20:00+00:00,,11,positive,3,0,3,1,0,0,0,0,0,0,0,1,0
JPM,finnhub_news,CNBC,Jamie Dimon warns of 'some kind of bond crisis' ahead as global debt risks build,https://finnhub.io/api/news?id=a581e8066c14cb0c3aa6e1d1b51f1b715949f33075dc09bc58878bc8f2b520fe,2026-04-28 11:55:10+00:00,,13,positive,1,0,0,0,0,0,0,2,0,0,0,0,0
JPM,finnhub_news,Finnhub,JPMorgan Chase CEO Jamie Dimon speaks at the Norges Bank Investment Conference 2026,https://finnhub.io/api/news?id=a09c60b77603635b91c2ca8b9168c18b5e83e4f0a360be84a768a66c400ac4b6,2026-04-28 10:48:27+00:00,,13,neutral,0,0,0,0,0,0,0,3,0,0,0,0,0
JPM,finnhub_news,Benzinga,"Speaking At Norges Bank Investment Conference, JPMorgan CEO Jamie Dimon Says Credit Downturn Will Be Worse Than People Think; Worst Case I Worry About Is Deflation",https://finnhub.io/api/news?id=7d9f4cf0a20808e59d0989a36848e7b0155c61ec412ee7393b3beb7432d13e73,2026-04-28 10:43:25+00:00,,11,neutral,0,0,0,0,1,0,0,3,0,0,0,0,0
JPM,finnhub_news,Yahoo,JPMorgan Says Firms Avoid Raising Forecasts Due to War Concerns,https://finnhub.io/api/news?id=24c469537fd3467b78a443b6f11bb2a250c7d44de7ab0fdf61116bb284a36f19,2026-04-28 10:31:53+00:00,,9,neutral,1,1,1,0,0,0,0,0,0,0,1,0,3
JPM,finnhub_news,Yahoo,JPMorgan Backs Quantum And Blockchain While Valuation Suggests Upside Potential,https://finnhub.io/api/news?id=727d80483cdeca89972b5d56449d5194488bf15f9b18a8b25eda26332a37bc2e,2026-04-28 04:29:41+00:00,,11,negative,0,2,0,0,0,0,0,0,0,0,2,1,0
JPM,finnhub_news,Yahoo,JPMorganChase to Present at the Bernstein Strategic Decisions Conference,https://finnhub.io/api/news?id=9bf7f9fe1d16534ba2f975b36e0f6281db0499bf2a85e3e024df3135207900d6,2026-04-27 20:22:00+00:00,,7,neutral,0,0,0,0,0,0,0,2,0,0,0,0,0
JPM,finnhub_news,Yahoo,"Goldman Sachs, JPMorgan sharply diverge on quantum computing",https://finnhub.io/api/news?id=4babdb1cd2a60f5d760a441657ea27e3ea1b52a49a11715aa1004901a2e65340,2026-04-27 19:29:40+00:00,,9,neutral,0,0,0,0,0,0,0,0,0,0,0,0,0
JPM,finnhub_news,Benzinga,'JPMorgan among banks providing financing for Kuwaiti oil pipeline stake deal' - Reuters Exclusive,https://finnhub.io/api/news?id=c1974604646edbca908052ffe9aac0c1a0e04ddb1b24c80f396eaf95e4d17f76,2026-04-27 14:06:59+00:00,,5,neutral,0,0,0,0,0,1,0,0,0,0,0,0,1
JPM,finnhub_news,Yahoo,Jim Cramer Shares Why JPMorgan’s (JPM) Conference Wasn’t Great,https://finnhub.io/api/news?id=5ef5b87248a753958a7caf386856280bbcd2211ac5f00e535c9b691b96edbef4,2026-04-27 14:02:56+00:00,,11,neutral,0,0,0,0,0,1,0,0,0,0,1,0,0
JPM,finnhub_news,Finnhub,JPMorgan among banks providing financing for Kuwaiti oil pipeline stake deal,https://finnhub.io/api/news?id=d09536c68a19834b1e626d349a76934de7438c91315f4bacc6f4b1cf30478799,2026-04-27 13:34:47+00:00,,5,neutral,0,0,0,0,0,1,0,0,0,0,0,0,1
JPM,finnhub_news,Yahoo,JPMorgan Says Tokenization Could Transform Fund Operations Over the Next Few Years,https://finnhub.io/api/news?id=3c7928e6df86aa056aa62a8bec903d72b26758dbe8864a5f1889bb5d9aea78e9,2026-04-25 20:15:00+00:00,,6,neutral,0,0,0,0,0,0,0,0,0,0,0,0,0
JPM,finnhub_news,Yahoo,JPMorgan Chase Insiders Sold US$149m Of Shares Suggesting Hesitancy,https://finnhub.io/api/news?id=7556ca5d318c963cba68c18190b5dff1262174ec25b59c427f0f43cfd65a6d22,2026-04-25 11:00:13+00:00,,9,neutral,0,0,0,0,0,0,0,0,0,0,0,0,0
JPM,finnhub_news,Yahoo,Week’s Best: JPMorgan’s AI Plans Spook Investors,https://finnhub.io/api/news?id=32a2e6fbd19d4291f3c10483c544aaf8412b58073c6a53f5ba15bb3cda444f85,2026-04-24 19:47:00+00:00,,6,positive,1,0,1,0,0,0,0,1,0,0,2,0,0
JPM,finnhub_news,Benzinga,JPMorgan Is Building A Massive Private Credit Machine Powered By Bank Loans,https://finnhub.io/api/news?id=34a63c9f53a0ef8644922f6869464f3b19cfdd593cccd8fd59e1ba70cbff109a,2026-04-24 14:33:30+00:00,,7,neutral,0,0,0,0,1,0,0,0,0,0,0,0,0
JPM,finnhub_news,Finnhub,African Development Bank and Jpmorgan Align On Financing Africa's Growth and Energy Transition [announcement],https://finnhub.io/api/news?id=7d800662deb0d1564c14f2f3dc49bf98821a5f84cfa2c5997ae94c86e9669c89,2026-04-24 14:08:08+00:00,,6,positive,1,0,0,0,0,0,0,0,0,0,0,0,0
JPM,finnhub_news,Yahoo,JPMorgan leads by value and Houlihan Lokey by volume in Q1 tech M&A,https://finnhub.io/api/news?id=cf07300da733d2d294f08951f53869b998268a0161977c376a7609ee2b0ba773,2026-04-24 02:51:36+00:00,,5,neutral,0,0,1,0,0,2,0,0,0,0,0,0,0
JPM,finnhub_news,Yahoo,"JPMorgan Chase CEO Jamie Dimon Pushes For In-Office Work, Saying 'If You Go To A Meeting With Me, You Got My Full Freaking Attention'",https://finnhub.io/api/news?id=53867ce971ff214cab8ad0ae58eb97db37dbf43fa8719bf8a00426b2aa65d855,2026-04-23 15:46:07+00:00,,16,neutral,0,0,0,0,0,0,0,3,0,0,0,0,0
JPM,finnhub_news,Yahoo,JPMorgan Readies Fresh Private Credit Push After Needling Market,https://finnhub.io/api/news?id=f6c04a8753460a1d8fc9bb6b9b079d2b7de2ed1cb48e87522cd1bee8095c2df7,2026-04-23 12:30:26+00:00,,8,neutral,0,0,0,0,1,0,0,0,0,0,0,0,1
JPM,finnhub_news,SeekingAlpha,JPMorgan Preferreds Pair Trade Idea,https://finnhub.io/api/news?id=0b076911044828377ade4c9f9d3e0a21dd547e6a3ecfe7cef117db15e117de06,2026-04-23 10:35:00+00:00,,6,neutral,0,0,0,0,0,0,0,0,0,0,0,0,0
JPM,finnhub_news,Yahoo,"Market Chatter: Citigroup, JPMorgan Hired by Bain Capital to Sell Stake in Bridge Data Centres",https://finnhub.io/api/news?id=c9866b1eeb8502776f18719cb7bb0b6c922598f916bcc38629387d10751a9432,2026-04-23 09:45:46+00:00,,6,negative,0,1,0,0,0,0,0,0,0,0,0,0,0
JPM,finnhub_news,Yahoo,Evercore ISI Boosts JPMorgan Chase & Co. (JPM) Valuation to $340 on Exceptional Q1 Performance,https://finnhub.io/api/news?id=63fc5cb1a8f6b4b40eaa8a973216a3ea8778fc65d4e42b8afcad913a5df3b9cf,2026-04-23 08:41:04+00:00,,11,positive,2,0,1,0,0,0,0,0,0,0,0,2,0
JPM,finnhub_news,Yahoo,JPMorgan Chase & Co. (JPM) Closing in on Record $38B Oracle Data Center Loan,https://finnhub.io/api/news?id=84e40307ff3f766183ed07b346e93d56dcc6c0e55e63168df4bd99a521a2cdcc,2026-04-22 22:43:26+00:00,,9,positive,1,0,0,0,0,0,0,0,0,0,0,0,0
JPM,finnhub_news,Yahoo,JPMorgan Brokerage Unit Recruits $1.1 Billion Advisor From William Blair,https://finnhub.io/api/news?id=411718816c880363f5470f23fb5774afe2f52845b6eab2a9a5c4475db5052ff1,2026-04-22 16:12:00+00:00,,6,neutral,0,0,0,0,0,0,0,0,0,0,0,0,0
JPM,finnhub_news,Finnhub,"JPMorgan hires two top technology bankers from Bank of America, memo says",https://finnhub.io/api/news?id=6e8de3a8f2028e89da72de7549768e0e93a85e38b948a2994f28c8e09c42bbb9,2026-04-22 15:36:54+00:00,,7,neutral,0,0,0,0,0,1,0,0,0,0,1,0,0
JPM,finnhub_news,Yahoo,JPMorgan resets S&P 500 price target for the rest of 2026,https://finnhub.io/api/news?id=984694e2c0e0bd0ef268728cd19579e1839b5a16385b48076a6e13430ffdab2d,2026-04-21 19:00:26+00:00,,5,neutral,0,0,0,0,0,0,0,0,0,0,0,1,1
JPM,finnhub_news,Yahoo,Trump Urges Judge Not to Let Dimon ‘Escape’ JPMorgan Lawsuit,https://finnhub.io/api/news?id=32b614b39063468aefba5d09c722cca2b820d1e56673f4bfba01e32d9a648019,2026-04-21 14:45:14+00:00,,15,negative,0,1,0,0,0,1,0,2,0,0,0,0,2
JPM,finnhub_news,Finnhub,"HSBC hires JP Morgan executive as global precious metals sales lead, sources say",https://finnhub.io/api/news?id=fc92ed937255c3cb20c2e1b66618e2cd4fc0fbf1760a3c0f1bb1dd3b65997999,2026-04-21 13:10:23+00:00,,6,neutral,0,0,0,0,0,0,0,0,0,0,0,0,0
JPM,finnhub_news,Yahoo,JPMorgan Expands European Security Initiative As Long Term Returns Stand Out,https://finnhub.io/api/news?id=50e879547b1d8b489591dd8f55c28c7ede31cbd9afa01489181742830a2e79e5,2026-04-21 12:02:55+00:00,,10,neutral,0,0,0,0,0,1,0,0,0,0,0,0,0
JPM,finnhub_news,Yahoo,5 Insightful Analyst Questions From JPMorgan Chase’s Q1 Earnings Call,https://finnhub.io/api/news?id=352f6ceca0790c81d315bda08113e96c2bf6a809c827b0e0da0fd07b559acaf0,2026-04-21 10:45:51+00:00,,21,positive,3,0,5,0,1,1,2,3,0,0,0,0,0
JPM,finnhub_news,Yahoo,"The Zacks Analyst Blog Broadcom, JPMorgan, Cisco, Preformed Line Products and CompX",https://finnhub.io/api/news?id=bd16fe83ded97a8d53470f8838842c65a570ce8cd0a8af538384358b6accc023,2026-04-21 07:47:00+00:00,,5,positive,1,0,0,0,0,1,0,0,0,0,1,0,0
JPM,finnhub_news,Benzinga,Jamie Dimon Sounds The Alarm On Critical Mineral Vulnerability,https://finnhub.io/api/news?id=2b938352b6350cd15061af6616a242e90223b948ebf4c8fd9972ea817eb5bd84,2026-04-21 06:32:08+00:00,,10,neutral,0,0,0,0,0,0,0,2,0,0,0,0,0
JPM,finnhub_news,Finnhub,JPMorgan Chase & Co. Appoints Admiral Sir Tony Radakin to the SRI External Advisory Council,https://finnhub.io/api/news?id=6d15fd1a4c5363d5f962dbd83471dd5e78d5977542c290150a6a01a7375d7f97,2026-04-21 02:35:35+00:00,,7,neutral,0,0,0,0,0,1,0,0,0,0,0,0,0
JPM,finnhub_news,Finnhub,JPMorgan Chase & Co. Announces Expansion of Security and Resiliency Initiative Across Europe,https://finnhub.io/api/news?id=cab830959f44f0e7183e4d763a6dffe57cedd7e7651d0c2dea6a59f3becedea6,2026-04-21 02:20:30+00:00,,6,positive,2,0,0,0,0,0,0,0,0,0,0,0,0
JPM,finnhub_news,Yahoo,Assessing JPMorgan Chase (JPM) Valuation After Recent Share Performance And Earnings Strength,https://finnhub.io/api/news?id=577cbe6d6eb82ce0edf40a523007d50673afe8ceb7bea91922843c472b6f4975,2026-04-21 01:08:47+00:00,,15,neutral,0,0,2,0,0,1,2,0,0,0,0,1,0
JPM,finnhub_news,Yahoo,Truist Lifts PT on JPMorgan Chase & Co. (JPM) to $332 From $323,https://finnhub.io/api/news?id=a0a5e284534881d6064a0a4a3450b1ec46163f42110212020e867de9f2a27b30,2026-04-20 22:16:11+00:00,,11,neutral,0,0,2,0,0,0,0,0,0,0,0,1,0
JPM,finnhub_news,Yahoo,"Top Research Reports for Broadcom, JPMorgan & Cisco",https://finnhub.io/api/news?id=6c12378e2859ae640f9f5a6f27bfa6c50a0d53c7f013b336a09a4a0dca652028,2026-04-20 20:28:00+00:00,,7,positive,3,0,0,0,0,0,0,0,0,0,1,0,0
JPM,finnhub_news,Yahoo,Why JPMorgan Chase & Co. (JPM) is a Top Stock for the Long-Term,https://finnhub.io/api/news?id=e41313d2e89ef7844c615fab4a391b3aa8d9a40f48b2c3d1d7ef7c02d9ee5818,2026-04-20 13:30:03+00:00,,9,positive,1,0,0,0,0,0,0,0,0,0,0,0,0
JPM,finnhub_news,Yahoo,JPMorgan Chase & Co. (JPM) Is a Trending Stock: Facts to Know Before Betting on It,https://finnhub.io/api/news?id=f92eb9a44056e7fc806477d2927349ace9e7678feec559bfaa4df81f8db62308,2026-04-20 13:00:03+00:00,,9,neutral,0,0,0,0,0,0,0,0,0,0,0,0,0
JPM,finnhub_news,Yahoo,JPMorgan's CEO has an urgent and concerning message for investors,https://finnhub.io/api/news?id=ac12f4cd6232aa4624a9cb5b67e5b0348fbeb551540ce8edc963e6432d5af71c,2026-04-19 20:07:00+00:00,,16,positive,1,0,4,0,1,0,0,3,0,0,0,0,1
JPM,finnhub_news,Yahoo,Jamie Dimon says the next credit crisis will be 'worse than people expect' — here's what big bank earnings have revealed,https://finnhub.io/api/news?id=bf4ae70bf23f0c8c0ee30ed541d2997fcd78bebafa48a0f4374778b4319b0f1d,2026-04-18 10:30:00+00:00,,15,neutral,0,0,2,0,2,0,0,3,0,0,0,0,0
JPM,finnhub_news,Yahoo,Charles Schwab Gets Dual Price Target Boosts From Deutsche Bank and JPMorgan: Is the Brokerage Giant Ready to Run?,https://finnhub.io/api/news?id=908101e69165048d05cf3a5c1dcabb2c6dbe48686d7637f9b7fa11f57f3afbca,2026-04-17 14:49:28+00:00,,5,positive,2,0,2,0,0,0,0,0,0,0,0,1,0
JPM,finnhub_news,Yahoo,"Update: Market Chatter: JPMorgan, Others Offering Credit Default Swaps on Blackstone, Apollo, Ares Funds",https://finnhub.io/api/news?id=efeadf70ba5ce6ba0d87b0b8596f9684d5f023eb3be5a57f3700fc9eda7e5165,2026-04-17 12:59:07+00:00,,10,neutral,0,0,0,0,2,0,0,0,0,0,0,0,0
JPM,finnhub_news,Yahoo,Mastercard and JPMorgan dividends fuel this fund’s outsized 6.2% payout,https://finnhub.io/api/news?id=6273fb4ec421dc3ab62f170354ae4d456824a8881b4aca616c169819b5e8a5a5,2026-04-17 12:18:05+00:00,,5,neutral,0,0,0,0,0,0,0,0,0,2,0,1,0
JPM,finnhub_news,Finnhub,JPMorgan Chase : Financial report - JPMORGAN CHASE & CO.,https://finnhub.io/api/news?id=716f278278156dd132e0e57ce1da6e65a0d87be1e2db0dd6b7608a19774c8236,2026-04-17 10:26:18+00:00,,6,neutral,0,0,0,0,0,0,0,0,0,0,0,0,0
JPM,finnhub_news,Yahoo,"Market Chatter: JPMorgan, Others Offering Credit Default Swaps on Blackstone, Apollo, Ares Funds",https://finnhub.io/api/news?id=83130b4348c7dfd27e8182dadc7b53baaf589855d77fcb411329c7522671ad0d,2026-04-17 09:31:35+00:00,,10,neutral,0,0,0,0,2,0,0,0,0,0,0,0,0
JPM,finnhub_news,Yahoo,"'Increasingly complex set of risks': Dimon sends warning on the US economy, says Americans shouldn't get too comfortable",https://finnhub.io/api/news?id=8b4ca00ad19f3b41383fe5fe985654e084947f116896484b442b396d5648e1c9,2026-04-17 09:15:00+00:00,,12,positive,1,0,1,0,0,0,0,2,0,0,0,0,1
JPM,finnhub_news,Benzinga,"Evercore ISI Group Maintains Outperform on JPMorgan Chase, Raises Price Target to $340",https://finnhub.io/api/news?id=a6741faa0142dc93f3600effb0ec4f956b3370c9e264504949f083bdcb554c6d,2026-04-17 08:31:00+00:00,,10,positive,1,0,0,0,0,0,0,0,0,0,0,1,0
JPM,finnhub_news,Finnhub,JPMorgan Chase : Prospectus - C-032501,https://finnhub.io/api/news?id=a3a22f56410c40d8cb4a7bc8f45ac3c38cdd66ff63f156ec89c8f7bab4b79284,2026-04-16 21:08:10+00:00,,6,neutral,0,0,0,0,0,0,0,0,0,0,0,0,0
JPM,finnhub_news,Benzinga,U.S. Office Of The Comptroller Of The Currency Terminates 2024 Consent Order Against JPMorgan Chase,https://finnhub.io/api/news?id=510b4d72ba94dae23db611d3668421d8e24072dc6d5c9cf0761016da55652bb4,2026-04-16 14:05:29+00:00,,6,neutral,0,0,0,0,0,0,0,0,0,0,0,0,0
JPM,finnhub_news,Yahoo,Here's Why JPMorgan Chase & Co. (JPM) is a Strong Momentum Stock,https://finnhub.io/api/news?id=d06c25e3f9cca5ce12f7ea5e3f205e40b024fd971b670365afeb9cff98cc3315,2026-04-16 13:50:03+00:00,,9,positive,2,0,0,0,0,0,0,0,0,0,0,0,0
JPM,finnhub_news,Benzinga,"Clarity Act Is Moving Along Well, JP Morgan Analysts Say",https://finnhub.io/api/news?id=0cc3d697617f0b0266743c4010e1694135e4df9c70f694d9ca281d85373dbb78,2026-04-16 11:30:02+00:00,,7,neutral,0,0,0,0,0,0,0,0,0,0,1,0,0
JPM,finnhub_news,SeekingAlpha,JPMorgan Q1: The Banking Giant Still Offers Relative Safety And Potential Long-Term Returns,https://finnhub.io/api/news?id=d1347e54fffe7a00b85046d9b8c6b166666ccc532e4210e0ff09cfa755263d35,2026-04-16 10:30:07+00:00,,8,positive,1,0,3,0,1,0,0,0,0,0,0,0,0
JPM,finnhub_news,Yahoo,"Zacks Earnings Trends Highlights: JPMorgan, Wells Fargo and Citigroup",https://finnhub.io/api/news?id=71defaf7b55fef8d589d12be0fae38b3be9d6cf8fb4b47f08aae4fcd525bafe9,2026-04-16 06:58:00+00:00,,7,positive,2,0,2,0,0,0,0,0,0,0,0,0,0
JPM,finnhub_news,SeekingAlpha,JPMorgan Chase: The Warning May Be More Important Than The Earnings,https://finnhub.io/api/news?id=29609cb6b4617070751f0d30a48fab3dda90e6c9eadb8e123479eec2e3df2a04,2026-04-16 03:38:45+00:00,,10,positive,3,0,1,0,0,0,0,0,0,0,0,0,0
JPM,reddit_post,investing,"JPM beat, Citi beat, and the reactions were different. Is earnings season mostly about expectations now?",https://www.reddit.com/r/investing/comments/1smrd1a/jpm_beat_citi_beat_and_the_reactions_were/,2026-04-16 02:57:33+00:00,15.0,14,positive,3,2,5,2,0,2,0,0,0,0,0,2,0
JPM,finnhub_news,Yahoo,Jamie Dimon Sells $40 Million of JPMorgan Stock,https://finnhub.io/api/news?id=9b112a5abb6cad36d6c304aa29d3b45aedb3f036a580ebfd4fa94b2cbb9362b4,2026-04-15 23:08:05+00:00,,10,neutral,0,0,0,0,0,0,0,2,0,0,0,0,0
JPM,finnhub_news,Finnhub,JPMorgan Chase : Supplement - C-032557,https://finnhub.io/api/news?id=f5d55fb65faf35d8b3c4368e8d0fc8df51f3c296432d3b262069428657356e40,2026-04-15 21:04:12+00:00,,6,neutral,0,0,0,0,0,0,0,0,0,0,0,0,0
JPM,finnhub_news,Yahoo,JPMorganChase 2026 Annual Meeting of Shareholders,https://finnhub.io/api/news?id=c4e6fb393c9b7a1c493fcfeacc655560efe506317ef111ae8ea3fdc8f40f9645,2026-04-15 20:32:00+00:00,,9,neutral,0,0,0,0,0,0,0,0,0,0,0,0,0
JPM,finnhub_news,Yahoo,JPMorganChase Declares Preferred Stock Dividends,https://finnhub.io/api/news?id=6daa187e77955660706092d6bcbdc92ec5004cc585397cf10001b32ffc71be2d,2026-04-15 20:31:00+00:00,,9,neutral,0,0,0,0,0,0,0,0,0,0,0,0,0
JPM,finnhub_news,Yahoo,Jamie Dimon Says JPMorgan Stock Isn’t Cheap. Why the Bank Is Still Buying Back Billions.,https://finnhub.io/api/news?id=0f0c4dc6af799e5657b73752f106e819845a4587f8950624285b9618f35b264d,2026-04-15 19:46:00+00:00,,12,neutral,0,0,1,0,0,0,0,3,0,1,0,0,0
JPM,finnhub_news,Yahoo,JPMorgan Plans At Least $7 Billion Bond Sale As Trading Revenue Jumps 20%,https://finnhub.io/api/news?id=5e1f7582c2c3c8e89136d3666e1f5bb0c961468717c02e4ccdcbb831404441db,2026-04-15 16:52:46+00:00,,7,positive,1,0,2,0,0,1,0,0,0,0,0,0,0
JPM,finnhub_news,Yahoo,Truist Raises JPMorgan Price Target to $332: Is This Banking Titan Still Worth Its Premium Valuation?,https://finnhub.io/api/news?id=8985edbc53ab712b7755d79d339203ac2614665f5eafd2b9f79255f6afad0763,2026-04-15 14:59:51+00:00,,14,positive,3,0,2,0,1,0,0,0,0,0,0,3,0
JPM,finnhub_news,Yahoo,US consumers haven't fallen off a cliff with $4 gas: JPMorgan CEO Jamie Dimon,https://finnhub.io/api/news?id=f8b5a4013fca242a3f60142e7ddfdffeadf3c9a07d9cba32d6b881074c980d73,2026-04-15 13:40:43+00:00,,11,neutral,0,0,0,0,0,0,1,3,0,0,0,0,0
JPM,finnhub_news,Yahoo,"Down 7% from Its All-Time Highs, Should You Buy the Dip in JPMorgan Stock?",https://finnhub.io/api/news?id=fc48a4c934c6ab5ffbd3f7d86aae4e75c4d7267fdf971f6e6fbf619d8148feaf,2026-04-15 12:00:02+00:00,,7,positive,1,0,2,0,0,0,0,0,0,0,0,0,0
JPM,finnhub_news,Yahoo,JPMorgan Chase quarterly profit rises 13% to $16.5bn,https://finnhub.io/api/news?id=f11c045a5905b06588745071f9da610824df95bbf62e2879f06c489e190792d6,2026-04-15 11:25:14+00:00,,7,positive,1,0,1,0,0,0,0,0,0,0,0,0,0
JPM,finnhub_news,Yahoo,"JPMorgan revenue rises on payments, card income",https://finnhub.io/api/news?id=28e644325e35d4217a2ca07b2060ca710e6237144824f2b6e0a946904db3c3b7,2026-04-15 11:17:00+00:00,,6,neutral,0,0,2,0,0,0,1,0,0,0,1,0,0
JPM,finnhub_news,Benzinga,'JPMorgan Looks to Raise at Least $7 Billion From US Bond Sale' - Bloomberg News,https://finnhub.io/api/news?id=31505d98f4b5991a660db1861f729683f712fa35169f548ccda214ef0a67a3f3,2026-04-15 09:14:53+00:00,,7,positive,2,0,1,0,0,1,0,0,0,0,0,0,0
JPM,finnhub_news,Benzinga,Transcript: JPMorgan Chase Q1 2026 Earnings Conference Call,https://finnhub.io/api/news?id=33119ba8614d9fb4911559b56e09615bafb6b703d7425c2c2799ad9346bbe627,2026-04-15 08:01:11+00:00,,7,neutral,0,0,2,0,0,0,0,0,0,0,0,0,0
JPM,finnhub_news,Yahoo,"JPM Q1 Deep Dive: Markets, Asset Management, and Regulatory Uncertainty Shape Outlook",https://finnhub.io/api/news?id=7a98d66630576ebe2244dfae9abe440937f29e5bbc532df9d52f3cea3bfac15f,2026-04-15 07:46:27+00:00,,11,positive,2,0,4,0,0,0,0,0,1,0,0,0,0
JPM,finnhub_news,Yahoo,JPMorgan Chase & Co (JPM) Q1 2026 Earnings Call Highlights: Strong Net Income and Revenue ...,https://finnhub.io/api/news?id=bd2e90fe4763f6bef9263c22636633e153a6575d16de0270504fcefffd23a4dc,2026-04-15 07:00:58+00:00,,11,positive,2,0,3,0,1,0,0,0,0,0,0,0,0
JPM,finnhub_news,ChartMill,"Oil Drops, Dimon Warns, and the Record Is Within Reach",https://finnhub.io/api/news?id=3f6a5e16b6b2fffe55ad546636b33d3310afd60e8f97fe448e529d688d7bd3c1,2026-04-15 06:32:10+00:00,,5,neutral,1,1,0,0,0,0,0,1,0,0,0,0,1
