ticker,source_type,source,title,url,published_at,engagement,relevance_score,tone,positive_hits,negative_hits,earnings_growth,ai_gemini,search_ads,cloud,youtube,waymo_autonomy,android_platform,regulatory_legal,capex_infra,valuation,shareholder_return
GOOGL,finnhub_news,Yahoo,Why Alphabet (GOOGL) Stock Is Trading Up Today,https://finnhub.io/api/news?id=57174ea18800206f23b3ed68c6343a0ed70744657179ef995c5dbdb8e1cb4d6a,2026-05-02T06:44:55+00:00,,6,positive,4,0,2,1,1,1,0,0,0,0,0,0,0
GOOGL,finnhub_news,Yahoo,"Amazon, Alphabet, Microsoft, Meta, and Apple Just Reported Earnings. I Think This Was the Best Report of Them All.",https://finnhub.io/api/news?id=1bc6d6f3720383c0e0aba458428b30ac48801ff4f5c13f8d9c9e1c12e9c39c4f,2026-05-02T01:52:00+00:00,,3,positive,2,0,2,1,0,0,0,0,0,0,1,1,0
GOOGL,finnhub_news,SeekingAlpha,Alphabet Q1 2026: Stratospheric Heights In Performance And Expectations,https://finnhub.io/api/news?id=aa5efe27d5850e71af57bbfdc15d65d3a1d622126f85ca6dc827f32f4a69840b,2026-05-01T23:55:00+00:00,,3,neutral,0,0,1,0,0,0,0,0,0,0,0,0,0
GOOGL,finnhub_news,Yahoo,Alphabet Takes the Spotlight Among Mag 7 Hyperscalers,https://finnhub.io/api/news?id=938c04ebc8a72be4c1e17ea7c3416d320fcea6c0802a17315d312d41c4511ad8,2026-05-01T21:23:00+00:00,,3,positive,2,1,0,1,0,1,0,0,0,1,0,0,0
GOOGL,finnhub_news,Yahoo,"Nvidia, Google, Microsoft Win Major Pentagon AI Contracts",https://finnhub.io/api/news?id=d90b158e7fd8b9865d0e45080e42504bdc607de1314f2e3309b07b88676113d5,2026-05-01T20:24:08+00:00,,6,positive,1,0,0,2,0,0,0,0,0,0,0,0,0
GOOGL,finnhub_news,Yahoo,Alphabet’s AI Bet Deepens As Cloud Surges And TPU Sales Begin,https://finnhub.io/api/news?id=445ffa27356be1a6222c717f8de9bdbc943a53df6796ce17f2fbd9c983453fcf,2026-05-01T20:14:48+00:00,,3,negative,0,1,4,2,0,2,0,0,0,0,4,0,0
GOOGL,finnhub_news,Yahoo,"Earnings: Google is biggest AI winner, OpenAI could be a 'surprise' loser",https://finnhub.io/api/news?id=e87702063952278838c4ba16d915c285d0511d07f8e85ce0ac5abdf6b6dbf9e3,2026-05-01T19:56:54+00:00,,6,positive,1,0,2,2,0,0,0,0,0,0,0,0,0
GOOGL,finnhub_news,Yahoo,"Cathie Wood’s ARK Bought Alphabet, Meta—and Sold This Chip Stock",https://finnhub.io/api/news?id=5fc63c45544dff7026c73ffb0df973568b1570796fe03b48b64917e2021bdebd,2026-05-01T19:44:00+00:00,,3,positive,1,0,2,0,0,0,0,0,0,0,0,0,0
GOOGL,finnhub_news,Yahoo,Google just had its best month since 2004,https://finnhub.io/api/news?id=f2a2af6178b7649c96287deb9c808db3d24d6ecebe4e2a6e8330b430965cb7f4,2026-05-01T16:27:17+00:00,,6,neutral,0,0,0,0,0,0,0,0,0,0,0,0,0
GOOGL,finnhub_news,Yahoo,Jim Cramer Says “Alphabet Crushed It”,https://finnhub.io/api/news?id=55e4e4d249cd2fe48f21b6fa803c7f54f93337b9c88bec2774f1468b86cbb6b9,2026-05-01T16:14:04+00:00,,3,neutral,0,0,2,0,0,0,0,0,0,0,0,0,0
GOOGL,finnhub_news,Yahoo,"Nvidia, Google Join Pentagon AI Deals for Classified Work",https://finnhub.io/api/news?id=0089311b6f03587a4e37ed47bcd482efc8b11b56de2e70a87c7071b9ab8d5746,2026-05-01T16:12:08+00:00,,6,neutral,0,0,0,1,0,0,0,0,0,0,0,0,0
GOOGL,finnhub_news,Yahoo,"Stock Market Rallies To New Highs; Apple, Google, Amazon, Sandisk, Powell In Focus: Weekly Review",https://finnhub.io/api/news?id=8d62bb3377cc0c375c834e199b0e510ab097ea4f5861347dba39e53ab29cb69d,2026-05-01T15:51:02+00:00,,6,positive,2,0,2,0,0,0,0,0,0,0,0,0,0
GOOGL,finnhub_news,Yahoo,"Cathie Wood Loads Up on Meta, Alphabet Sells AMD",https://finnhub.io/api/news?id=2e877a16d8d0f67b6e74b940dd91a24f665272263f160355733722139a79f7b1,2026-05-01T15:49:37+00:00,,3,neutral,0,0,0,0,1,0,0,0,0,0,0,0,0
GOOGL,finnhub_news,Yahoo,Alphabet Goes All-In on AI Infrastructure With TPU Push,https://finnhub.io/api/news?id=6c122e5bd11c22391dc65e4f7c4027b545e619f8772a46eb1ab62da29207475b,2026-05-01T15:41:13+00:00,,3,neutral,1,1,0,2,0,1,0,0,0,0,3,0,0
GOOGL,finnhub_news,Yahoo,Alphabet Inc. (GOOGL) Price Target Raised by Raymond James to $425 Following Q1 Financial Results,https://finnhub.io/api/news?id=b18779600956000106c3be52ce3cd60f7e723a3a732ab5b7654e39a47f592a0d,2026-05-01T14:35:02+00:00,,6,positive,3,0,1,1,0,0,0,0,0,0,0,2,0
GOOGL,finnhub_news,Benzinga,"Stifel Maintains Buy on Alphabet, Raises Price Target to $420",https://finnhub.io/api/news?id=eb6413fe8ca4453275aaf8ad1844c55b2d5fa074b65e52b8c0744b975890913d,2026-05-01T13:51:59+00:00,,3,neutral,0,0,0,0,0,0,0,0,0,0,0,2,0
GOOGL,finnhub_news,Yahoo,"Meta, Microsoft, or Alphabet: Which Magnificent 7 Stock Dominated in April?",https://finnhub.io/api/news?id=15e1320c9f4428033ea0e043d914e5c43e13dffacfc2fbae7d6a2224e01d165b,2026-05-01T13:48:07+00:00,,3,negative,0,1,2,0,0,0,0,0,0,1,0,0,0
GOOGL,finnhub_news,Yahoo,"Is Alphabet (GOOG, GOOGL) Still The Best AI Stock to Buy After Latest Post-Earnings Surge?",https://finnhub.io/api/news?id=b004e8ec38e53d1bc536c73eeed0b20ef4ecd79b2fafdb83bda2590b332017b6,2026-05-01T13:27:59+00:00,,6,neutral,0,0,1,1,0,0,0,0,0,0,0,0,0
GOOGL,finnhub_news,Yahoo,Forget MSFT: Google Search Revenue is Up 19% Despite ‘Nearly Monopoly-Like Market Share’,https://finnhub.io/api/news?id=09da8e100746fca27c384262e4d882d76c38ab895df831406defcb39f0bfeb41,2026-05-01T13:15:39+00:00,,6,neutral,1,1,1,0,1,0,0,0,0,1,0,0,0
GOOGL,finnhub_news,CNBC,Alphabet is winning the AI revolution. Here's how Mike Khouw is trading it,https://finnhub.io/api/news?id=a30b72c30410de29eb74d1e9b16850382cbbcfe0567dab98c0c1d06844c66680,2026-05-01T11:33:37+00:00,,3,positive,1,0,0,1,0,0,0,0,0,0,0,0,0
GOOGL,finnhub_news,ChartMill,Alphabet Inc. (NASDAQ:GOOGL): A GARP Stock Fit for Peter Lynch Investors,https://finnhub.io/api/news?id=ec995c2e09bd3ddb1de34bc8dd6cef227aa8922b9c2e9f5753392eaac634b5c0,2026-05-01T11:30:55+00:00,,6,positive,3,0,2,0,0,0,0,0,0,0,0,1,0
GOOGL,finnhub_news,CNBC,Options Action: Betting on Alphabet winning the AI revolution,https://finnhub.io/api/news?id=1aa863cfe96583388387dd00a2d1d01bce908c3aafb120463fbfa76e045aec4c,2026-05-01T11:30:44+00:00,,3,positive,1,0,0,2,0,0,0,0,0,0,0,0,0
GOOGL,finnhub_news,CNBC,Alphabet could reclaim top spot among Mag-7: Here's what to know,https://finnhub.io/api/news?id=152780c21834163ae414cea6af038c0fd283f3662c409f52c3457b27ea0e1b06,2026-05-01T11:30:17+00:00,,3,neutral,0,0,0,0,0,0,0,0,0,0,0,0,0
GOOGL,finnhub_news,SeekingAlpha,"Why OpenAI's Smartphone Will Disrupt Apple, But Alphabet Will Ultimately Win",https://finnhub.io/api/news?id=a89fd5d7e4bedf7791a31932ccb84580758f041600fac24c30008cb1c03a40a6,2026-05-01T11:17:09+00:00,,3,neutral,1,1,1,2,0,0,0,0,0,0,0,0,0
GOOGL,finnhub_news,SeekingAlpha,Alphabet Q1 Earnings: Double-Digit Revenue Growth As CAPEX Pays Off,https://finnhub.io/api/news?id=bddb507c96c3cdecd885f4a954d2bba675ff6dc98f62400861f6e0f18d0aef61,2026-05-01T11:11:14+00:00,,3,positive,2,0,4,0,0,0,0,0,0,0,1,0,0
GOOGL,finnhub_news,Benzinga,"Wells Fargo Maintains Overweight on Alphabet, Raises Price Target to $427",https://finnhub.io/api/news?id=c896f1ad7a8fa7e30655b922b12f706206250faadfb4f6c702d533574d456de2,2026-05-01T10:44:24+00:00,,3,neutral,0,0,0,0,0,0,0,0,0,0,0,2,0
GOOGL,finnhub_news,Yahoo,"Alphabet CEO Sundar Pichai Says Google's Custom Chips, Gemini Models And Cloud Stack Give It Unique AI Edge: 'We Are Compute Constrained'",https://finnhub.io/api/news?id=e938e02be7c6e005c7d95a7eb524d7d7f00a4286f5abe47c663b314ebd636e9e,2026-05-01T09:45:00+00:00,,6,neutral,0,0,2,4,0,1,0,0,0,0,2,0,0
GOOGL,finnhub_news,ChartMill,"Tech Earnings Crack Open a Fault Line, Alphabet and Apple Take the High Ground",https://finnhub.io/api/news?id=1f8fdb15630faf36d89ed8213f9ea535520e5327d1bbdfaae47cb4d59fee35fd,2026-05-01T08:04:27+00:00,,3,neutral,0,0,1,0,0,0,0,0,0,0,0,0,0
GOOGL,finnhub_news,SeekingAlpha,Alphabet's TPU Move Changes The Entire Narrative,https://finnhub.io/api/news?id=2a509d497f5fc8eed8f2227e9b2700c5d368f4008054b80007a0d77841371de0,2026-05-01T06:24:39+00:00,,3,neutral,0,0,0,2,0,0,0,0,0,0,2,0,0
GOOGL,finnhub_news,Yahoo,Why Alphabet Stock Surged to an All-Time High Today,https://finnhub.io/api/news?id=c15292137d2fba2265d8d98f035aed5d018e85f1d913de595e185c2f2b0b77d5,2026-05-01T03:11:49+00:00,,3,neutral,0,0,0,1,1,0,0,0,0,0,0,0,0
GOOGL,finnhub_news,Yahoo,Rubrik (RBRK) Expands Cyber Resilience to Google Cloud SQL for Managed PostgreSQL Databases,https://finnhub.io/api/news?id=28cf6b99533161dbc7256c5e5c1607e3d444bd5d2165f3e16659ada171a6d45f,2026-05-01T01:08:55+00:00,,6,neutral,0,0,0,0,1,2,0,0,0,0,0,0,0
GOOGL,finnhub_news,Yahoo,Everyone's Wondering What's Next for Nvidia. This News From Amazon and Alphabet Offers Us an Idea That's Strikingly Clear,https://finnhub.io/api/news?id=5dbaaa55ef25b89c54dfcdfe927f7e97bd64eb6450a17f4ccccb18507a75ef37,2026-04-30T22:30:00+00:00,,3,neutral,0,0,0,0,0,0,0,0,0,0,0,0,0
GOOGL,finnhub_news,Yahoo,"Stock Market Today, April 30: Alphabet Surges After Reporting Accelerating Google Cloud Growth",https://finnhub.io/api/news?id=766b1535f170344e3a3d57c19d72f4edce9fc6d72469fd16f7100f2b8346b4a3,2026-04-30T22:13:37+00:00,,4,positive,1,0,0,0,0,2,0,0,0,0,2,1,0
GOOGL,finnhub_news,Yahoo,How US Stock Markets Rewarded Google But Punished Meta After Q1 Earnings,https://finnhub.io/api/news?id=f59227b7403bf24a31da2126e1d9bb356d2855a602606814ed802334e3606a28,2026-04-30T21:42:43+00:00,,6,negative,0,1,2,1,0,0,0,0,0,0,1,0,0
GOOGL,finnhub_news,Yahoo,"Alphabet checks boxes, Meta raises AI worries, says investor",https://finnhub.io/api/news?id=efe9bbbea9a8f070bc88d95f30a674256b40abba4281b28271d0a5cb57f0c76b,2026-04-30T20:52:05+00:00,,3,positive,1,0,0,1,0,0,0,0,0,0,2,0,0
GOOGL,finnhub_news,Yahoo,"Alphabet’s Quarter Didn’t Just Impress, It May Be the Catalyst That Pushes the Stock to Lead the Mag 7 Higher",https://finnhub.io/api/news?id=5d96121e5dbeef9953b7c1a4896f009908632d6a90496ece36f5234cbbdabf78,2026-04-30T20:11:05+00:00,,3,positive,1,0,3,0,0,0,0,0,0,0,0,0,0
GOOGL,finnhub_news,Yahoo,Google Stock Soars On Q1 Earnings As Analysts Trumpet 'Full Stack' AI Platform,https://finnhub.io/api/news?id=c21e411c943c2b548cf025fb92a1f5c3ef8432d696f36bc9f016e402e59da56a,2026-04-30T20:04:56+00:00,,6,positive,3,0,2,1,2,1,0,0,0,0,0,1,0
GOOGL,finnhub_news,Benzinga,"Canaccord Genuity Maintains Buy on Alphabet, Raises Price Target to $450",https://finnhub.io/api/news?id=3840c044513a9c001abb9f59cca6d8a0ed84cde8664174d2f7928c64f28208e1,2026-04-30T19:10:51+00:00,,3,neutral,0,0,0,0,0,0,0,0,0,0,0,2,0
GOOGL,finnhub_news,Yahoo,"""Magnificent Seven"" Companies Microsoft, Amazon, Alphabet, and Meta Just Reported Earnings. Here Are the Winners and Losers",https://finnhub.io/api/news?id=7a3e6cbee473d089ba9343de9c16647bf75406f9a0c5fe03ab400e8066c8b473,2026-04-30T17:40:33+00:00,,3,positive,1,0,1,0,0,0,0,0,0,0,0,0,0
GOOGL,finnhub_news,Yahoo,"Amazon, Meta, Alphabet, and Microsoft Just Reported Earnings. Here's the Best of the Bunch.",https://finnhub.io/api/news?id=d6786be7ab26137c7b4462ceba12b6a83a64fb4257f3a26be3f0c0a70d61704d,2026-04-30T17:30:00+00:00,,3,neutral,0,0,1,0,0,0,0,0,0,0,0,0,0
GOOGL,finnhub_news,Yahoo,"Alphabet's Q1 Highlights Search, Cloud Strength While Costs Climb, UBS Says",https://finnhub.io/api/news?id=e6bc6da4172e90a319d9dafc752cbb6ad441eebff8e70932b1d293197d938cd8,2026-04-30T17:02:21+00:00,,3,positive,2,0,2,0,1,1,0,0,0,0,0,0,0
GOOGL,finnhub_news,Yahoo,"If AI Is Doing 75% of Google’s New Coding, the Stock Might Be Underpriced",https://finnhub.io/api/news?id=a1234e245a02ef85b315788f778d46c5a43de7430478bec329afc67c6be1c555,2026-04-30T16:25:48+00:00,,6,positive,1,0,3,1,1,2,0,0,0,0,0,0,0
GOOGL,finnhub_news,Benzinga,"UBS Maintains Neutral on Alphabet, Raises Price Target to $410",https://finnhub.io/api/news?id=52294b02887a0af843b63b36c94e2ff591e34773bd7333e086112135b9f44a69,2026-04-30T16:19:35+00:00,,3,neutral,0,0,0,0,0,0,0,0,0,1,0,2,0
GOOGL,finnhub_news,Yahoo,Wall Street Lifts Alphabet Price Targets After Cloud’s 63% Growth: Is the AI Stack Story Just Getting Started?,https://finnhub.io/api/news?id=a3df16a7945a79a5079b9d031c7b676c1c769b21ea6fb3025207d01116de4e68,2026-04-30T16:15:59+00:00,,3,positive,1,0,1,1,0,1,0,0,0,0,0,1,0
GOOGL,finnhub_news,Yahoo,"Google Stock Soars, Meta Tumbles as Investors Digest Latest Big Tech Earnings",https://finnhub.io/api/news?id=19255133ed73b610a8c8f5b43adfcf836d2bd369a00c79d781799620f3a6d76e,2026-04-30T15:38:09+00:00,,6,positive,2,0,3,1,0,0,0,0,0,0,1,0,0
GOOGL,finnhub_news,Yahoo,Google & Amazon vs. Meta & Microsoft: Earnings winners and losers,https://finnhub.io/api/news?id=9c411e4b2350529cf3956f31466ceed9711d45a1a64a2250e0775096b6e623d0,2026-04-30T15:20:26+00:00,,6,positive,1,0,2,0,0,0,0,0,0,0,0,0,0
GOOGL,finnhub_news,Yahoo,Nvidia stock plunges as investors weigh rising competition from Google and Amazon,https://finnhub.io/api/news?id=9348a97b7c572e6bfaf208d163f516794e65b1639199479cd0e4aeffeacdfc9a,2026-04-30T15:18:39+00:00,,6,neutral,0,0,2,1,0,0,0,0,0,0,1,0,0
GOOGL,finnhub_news,Yahoo,Forget STX’s 13% Pop — Alphabet Is Where AI Infrastructure Investors Should Actually Be,https://finnhub.io/api/news?id=ca09ca4a39d9383b7c63cd7941eaa6e65ab4cc5398671456974f291d20f367de,2026-04-30T15:16:30+00:00,,3,positive,1,0,2,1,0,0,0,0,0,0,1,0,0
GOOGL,finnhub_news,Yahoo,Why The Google Stock Rally Could Be Premature,https://finnhub.io/api/news?id=1d8715b8be4242ef53f816c80262d751abe3e58f556803cc85edc95016993cf1,2026-04-30T15:05:11+00:00,,6,positive,3,0,3,1,0,0,0,0,0,0,0,0,0
GOOGL,finnhub_news,Benzinga,"Bernstein Maintains Market Perform on Alphabet, Raises Price Target to $390",https://finnhub.io/api/news?id=cdd9a5b1813e80543948624c9e3b4766bef299e0835a09568515bfb5988cfc1c,2026-04-30T14:47:32+00:00,,3,neutral,0,0,0,0,0,0,0,0,0,0,0,2,0
GOOGL,finnhub_news,Benzinga,"Alphabet's AI Surge Stuns Street: Cloud, Gemini, Chips Drive Breakout Quarter",https://finnhub.io/api/news?id=209d8735a1efdcce58784fc1b994b966c966716510c6e5c97846a288bb972f86,2026-04-30T14:42:49+00:00,,3,positive,1,0,2,3,0,1,0,0,0,0,2,0,0
GOOGL,finnhub_news,Yahoo,AI Was Supposed to Kill Google Search — Instead It Reignited Growth,https://finnhub.io/api/news?id=7faae6941ad3000cd0b40b5c97fe7d7b4d76d50851de553b5584f0a19a3ca2da,2026-04-30T14:36:53+00:00,,6,positive,2,0,3,1,1,0,0,0,0,0,0,0,0
GOOGL,finnhub_news,Benzinga,"Citigroup Maintains Buy on Alphabet, Raises Price Target to $447",https://finnhub.io/api/news?id=d497359b0b454291d5ff470cc4fac16007b90fa5726e0d5275c7511b23a2f1d5,2026-04-30T14:06:46+00:00,,3,neutral,0,0,0,0,0,0,0,0,0,0,0,2,0
GOOGL,finnhub_news,Benzinga,"Morgan Stanley Maintains Overweight on Alphabet, Raises Price Target to $375",https://finnhub.io/api/news?id=5535b336673d7296c819facd69a78306ac7bfbeb84225b9e29aa158da7b1ec18,2026-04-30T13:50:37+00:00,,3,neutral,0,0,0,0,0,0,0,0,0,0,0,2,0
GOOGL,finnhub_news,Yahoo,Alphabet Pops 5% on Q1 Earnings: Is the Full-Stack AI Strategy Finally Paying Off?,https://finnhub.io/api/news?id=d19b91c3a4fa7a8cba1cd4aec116ad43d7e149dc6d5f68cdaaae7ac118a1bfa5,2026-04-30T13:46:44+00:00,,3,positive,1,0,4,1,1,0,0,0,0,0,0,0,0
GOOGL,finnhub_news,Yahoo,"Alphabet stock gaining on Q1 earnings, Google Cloud growth",https://finnhub.io/api/news?id=11be8b823720c4a49bf9c47cd608bd71e9bb0bd3ed34eb1de995ce9679980c09,2026-04-30T13:34:16+00:00,,6,positive,2,0,4,0,0,2,0,0,0,0,2,0,0
GOOGL,finnhub_news,Benzinga,"Susquehanna Maintains Positive on Alphabet, Raises Price Target to $460",https://finnhub.io/api/news?id=d5a84c266b5cbce0ccf7ca793d676990ac68965d6dd925f4970e3f912c665b73,2026-04-30T13:29:27+00:00,,3,neutral,0,0,0,0,0,0,0,0,0,0,0,2,0
GOOGL,finnhub_news,Yahoo,Alphabet Rises as Cloud Revenue Beats Estimates,https://finnhub.io/api/news?id=29e57c85aa9dc3adcd226be6eaf6d7f340949cf55bcac24c38fa09ad5296e3c6,2026-04-30T13:24:32+00:00,,3,positive,3,0,3,1,0,2,0,0,0,0,0,0,0
GOOGL,finnhub_news,Finnhub,OG&E announces landmark contract with Google,https://finnhub.io/api/news?id=86b53452706a9d24d7691c95ef8439e2ddb4b82ede076302b2801daa10e239d6,2026-04-30T13:11:00+00:00,,6,neutral,0,0,0,0,0,1,0,0,0,0,1,0,0
GOOGL,finnhub_news,Yahoo,Google Stock Pops On Q1 Earnings As Analysts Trumpet 'Full Stack' AI Platform,https://finnhub.io/api/news?id=93aee7a4b063728bf14b3c2bc723b26c82698d242981be1119518eca1577aa0b,2026-04-30T13:03:04+00:00,,6,positive,2,0,2,1,2,1,0,0,0,0,0,1,0
GOOGL,finnhub_news,Yahoo,Google Partner NovaCore Labs and AIBotics Advance Acquisition and Expand Robot Deployment Across Jamaica,https://finnhub.io/api/news?id=58a6817040ba7c82e98ff3e5ffe574560bd9cfd31f4f5573ad8fa650df7fd062,2026-04-30T13:00:00+00:00,,6,neutral,0,0,0,0,0,0,0,0,0,0,0,0,0
GOOGL,finnhub_news,CNBC,The mega-cap winners and losers: Alphabet and Meta,https://finnhub.io/api/news?id=354e78b90f570e80f2c55e874c5586d2810976c5857e4482a39d54be5b4a4687,2026-04-30T12:58:46+00:00,,3,neutral,1,1,1,0,0,0,0,0,0,0,1,0,0
GOOGL,finnhub_news,Yahoo,Alphabet’s US$40b Anthropic Bet Tests AI Capex And Cloud Economics,https://finnhub.io/api/news?id=bf207cae5f1dbdc16593035f6ea77b1a9b04dccad99defa91ed867246c53a397,2026-04-25T19:03:22+00:00,,3,neutral,0,0,0,2,0,2,0,0,0,0,4,0,0
GOOGL,finnhub_news,Yahoo,"Dow Jones Futures: Iran Talks Shelved; Apple, Amazon, Google Lead Earnings Wave",https://finnhub.io/api/news?id=78c0ed323449a46a240119fc1fbb6cb0b84487d18ed0d37419c4654156c97973,2026-04-25T17:10:41+00:00,,4,neutral,0,0,1,0,0,0,0,0,0,0,1,0,0
GOOGL,finnhub_news,SeekingAlpha,Alphabet Is Getting Ready For War,https://finnhub.io/api/news?id=03457fd5f7595b54bce7f414d7eebc594d38a2bf50b299d3e2c37cac5a8f8bc8,2026-04-25T12:05:57+00:00,,3,positive,1,0,1,3,0,1,0,0,0,0,2,0,0
GOOGL,finnhub_news,Yahoo,Google Cloud Next 2026 Event Bets Big on AI Infrastructure,https://finnhub.io/api/news?id=861b31d2f0a7f87208e5a8f1a6e069699017b8bffc1bb2e56e74b2c8b581f0bb,2026-04-25T11:35:00+00:00,,6,neutral,0,0,0,3,0,2,0,0,0,0,3,0,0
GOOGL,finnhub_news,Yahoo,Alphabet's Google Could Supercharge This Artificial Intelligence (AI) Stock That Has Soared 78% in 2026. Here's Why You Should Buy It Hand Over Fist Before It Is Too Late.,https://finnhub.io/api/news?id=8a727c5f68dc9c3e3263cfdfbf101b900a17130e1e0013d7be318ffc098a80fb,2026-04-25T11:29:00+00:00,,6,positive,2,0,0,3,0,0,0,0,0,0,1,0,0
GOOGL,finnhub_news,Yahoo,Alphabet Next: Google Cloud Says 75% of Customers Use AI as Pichai Targets $175B-$185B CapEx,https://finnhub.io/api/news?id=c15ffe054afee84740e4846ec8fa8983c5204685f2f7788922f0e79c2be0c0e3,2026-04-25T06:03:10+00:00,,6,neutral,0,0,0,2,0,2,0,0,0,0,1,0,0
GOOGL,finnhub_news,Yahoo,Marvell Shares Rise on Reports of Talks with Alphabet Inc’s (GOOGL) Google to Create Two AI Chips,https://finnhub.io/api/news?id=a30888b64c05cfe706d4178145f0d9d44091baa494b0be026844b1e8847fb082,2026-04-25T05:57:37+00:00,,6,neutral,0,0,0,1,0,0,0,0,0,1,1,0,0
GOOGL,finnhub_news,Yahoo,Jim Cramer Believes “Alphabet’s Going to $400”,https://finnhub.io/api/news?id=a400d341a2cbd6bd48e6b5d4745ad8011cdf96a285d9b0fd0cfbec8b27e2c7ce,2026-04-25T03:26:49+00:00,,3,positive,1,0,0,0,2,1,0,0,0,0,0,0,0
GOOGL,finnhub_news,Benzinga,Google May Pour Up To $40 Billion Into Anthropic As AI Compute Demand Booms,https://finnhub.io/api/news?id=c32cdb40d70be27c269bd6291df4e5cbba1f9861a9073f5fa8daf2dfebb454c8,2026-04-25T02:15:03+00:00,,6,neutral,0,0,0,1,0,0,0,0,0,0,0,0,0
GOOGL,finnhub_news,Yahoo,"Dow Jones Futures: Apple, Amazon, Google Lead Earnings Wave For AI-Led Stock Market",https://finnhub.io/api/news?id=c9d21eb957c793049697fc8e6c67ff6c0fafdc7040780d576bd69dd3071b9870,2026-04-24T20:42:02+00:00,,4,neutral,0,0,1,0,0,0,0,0,0,0,1,0,0
GOOGL,finnhub_news,Benzinga,Here's How Much $100 Invested In Alphabet 10 Years Ago Would Be Worth Today,https://finnhub.io/api/news?id=50d1155dfa448df1cacec12dda9eaf09bbed56f064605918fff0e78593fa2709,2026-04-24T19:30:38+00:00,,3,neutral,0,0,0,0,0,0,0,0,0,0,0,0,0
GOOGL,finnhub_news,Yahoo,Elastic Expands Google Alliance As New Tools Target Regulated Cloud Demand,https://finnhub.io/api/news?id=2258092c610f0cf93dbe2ec26434e3545aea853c54430c7dde3fb055ee6eb491,2026-04-24T19:05:18+00:00,,6,neutral,0,0,0,1,1,1,0,0,0,1,0,1,0
GOOGL,finnhub_news,Yahoo,Anthropic says Google to pump $40 bn into AI startup,https://finnhub.io/api/news?id=747be40a53f6cf43c341c36eda0740a20ca25e371ce2b9c74a75bbb85a136b91,2026-04-24T18:53:15+00:00,,6,neutral,0,0,0,2,0,0,0,0,0,0,0,0,0
GOOGL,finnhub_news,Yahoo,Bank of America resets Google stock forecast ahead of earnings,https://finnhub.io/api/news?id=7966261988d5333da08afbc90bd9756b7ca9bdbe420c4e5a27f59b02b857a535,2026-04-24T18:33:00+00:00,,6,neutral,0,0,2,0,1,2,0,0,0,0,0,0,0
GOOGL,finnhub_news,Yahoo,"Nvidia market cap back above $5T, Alphabet to invest $40B in Anthropic",https://finnhub.io/api/news?id=1cf90fd93a4ab6e0839f132b3bf417da30dc8a5e961c5b94990427c4472be351,2026-04-24T18:09:07+00:00,,3,neutral,0,0,0,0,0,0,0,0,0,0,0,0,0
GOOGL,finnhub_news,CNBC,"Final Trade: NVO, MSFT, GOOG, SLG",https://finnhub.io/api/news?id=d71e996448abf93ad9c712a39f5888564dae6c62806a4bbd150d5c61ee3d7eef,2026-04-24T18:08:19+00:00,,4,neutral,0,0,0,0,0,0,0,0,0,0,0,0,0
GOOGL,finnhub_news,Yahoo,"Cadence’s Expanded AI Alliances With TSMC, NVIDIA and Google Might Change The Case For Investing In Cadence Design Systems (CDNS)",https://finnhub.io/api/news?id=1b1f7ba6b265f33e5fda91562395dd4ba9cc50ceb8d6bfbbb3211ec389c873f1,2026-04-24T18:07:45+00:00,,6,positive,1,0,0,1,0,1,0,0,0,0,1,0,0
GOOGL,finnhub_news,Yahoo,Google Stock Rises After Massive $40B AI Bet on Anthropic,https://finnhub.io/api/news?id=48583a5d1f9356ba920a7a9a15dfec581ba06dab83ed1fa71fe8407ecfe44805,2026-04-24T18:07:12+00:00,,6,neutral,0,0,0,1,0,0,0,0,0,0,0,0,0
GOOGL,finnhub_news,Yahoo,Google to invest up to $40B in Anthropic in cash and compute,https://finnhub.io/api/news?id=cae90c8e07dd3832ad112432dd93d34a78034c29ccb37b1bcaae6807f7e28554,2026-04-24T18:00:03+00:00,,6,positive,1,0,0,2,0,0,0,0,0,0,0,0,0
GOOGL,finnhub_news,Finnhub,Alphabet : Announces Internet Availability of Proxy Materials for its 2026 Annual Meeting of Shareholders,https://finnhub.io/api/news?id=e4b16e3ecd69ea63ed7d5e813ddf618d49a6149f0a070c76e7496db5d4dd7a6d,2026-04-24T17:17:12+00:00,,3,negative,0,1,0,0,0,0,0,0,0,0,0,0,1
GOOGL,finnhub_news,Yahoo,"Intel stock hits record high, Hut 8's Google-backed data center",https://finnhub.io/api/news?id=c913406416a806655f3547d2814b2a4c778945ca629a0d8ee1e17b5ead228119,2026-04-24T17:13:12+00:00,,6,positive,1,0,2,0,0,1,0,0,0,0,1,0,0
GOOGL,finnhub_news,Yahoo,Alphabet Inc. (GOOGL): Bill Ackman Likes This Technology Powerhouse,https://finnhub.io/api/news?id=d401b9d7d75efe2df12653de712e7acb5a434b9e313d2496edbe472afceca92b,2026-04-24T16:48:59+00:00,,6,neutral,0,0,1,0,0,0,0,0,0,0,0,0,0
GOOGL,finnhub_news,Yahoo,Google investing up to $40 billion in Anthropic,https://finnhub.io/api/news?id=ef2de38190a2af4653e21ce486922be345f7bf5de038d5eeb015dd36d1715f21,2026-04-24T16:38:05+00:00,,6,neutral,0,0,0,0,0,0,0,0,0,0,0,0,0
GOOGL,finnhub_news,Yahoo,Google and Anthropic deepen ties: $40B deal sets stage for infrastructure buildout,https://finnhub.io/api/news?id=8e788219974ec15b18acd7bc5f0399c26c83ba1337908e8d013316be649e1834,2026-04-24T16:37:33+00:00,,6,positive,1,0,0,0,0,0,0,0,0,0,1,0,0
GOOGL,finnhub_news,Yahoo,"Amazon, Microsoft, Alphabet, Oracle, CoreWeave seen as key AI compute beneficiaries after Google Cloud Next",https://finnhub.io/api/news?id=c8ec80bcfbea4c674b39e915abbee826efbaa713395e242411bde9b7a6b5e623,2026-04-24T16:03:00+00:00,,6,positive,1,0,0,1,0,2,0,0,0,0,0,2,0
GOOGL,finnhub_news,Yahoo,"Google plans to invest up to $40 billion in Anthropic, Bloomberg News reports",https://finnhub.io/api/news?id=d88e5464b5d4ca84402e7120e30ff9b02b3396113989b8e4ddf7c75faf18a244,2026-04-24T16:01:44+00:00,,6,neutral,0,0,0,1,0,0,0,0,0,1,0,1,0
GOOGL,finnhub_news,Yahoo,Google Plans to Invest Up to $40 Billion in Anthropic,https://finnhub.io/api/news?id=0132d99bb4692de3540d47a4ad90fab7ef4c29b8ae8a70c6005fd5aa71ab79eb,2026-04-24T15:50:18+00:00,,6,neutral,0,0,0,2,0,0,0,0,0,0,0,0,0
GOOGL,finnhub_news,Yahoo,"Alphabet Shares Expected to Reach New Highs on AI Tailwinds, Oppenheimer Says",https://finnhub.io/api/news?id=60a91af2b7ac679e8a8e9d4a65ee075e2b68d065853231259e8bec2ed667fa60,2026-04-24T15:13:35+00:00,,3,positive,2,0,0,1,1,0,0,0,0,0,0,0,0
GOOGL,finnhub_news,Yahoo,Alphabet Cloud AI Push And Valuation Outlook After Gemini And TPU News,https://finnhub.io/api/news?id=83ebdca57d360067b202afd213b2903b4f521cf35202ff743d1bd75d99bf2261,2026-04-24T15:06:23+00:00,,3,neutral,0,0,1,3,0,2,0,0,0,0,2,1,0
GOOGL,finnhub_news,Yahoo,Alphabet Inc. (GOOG): Safe Stock to Invest In For Beginners?,https://finnhub.io/api/news?id=0dc110dcff27a33141db1a91398484f92dd6f47727a9feca2de4b8ee4d792cd4,2026-04-24T14:35:14+00:00,,6,neutral,0,0,1,0,0,0,0,0,0,0,0,0,0
GOOGL,finnhub_news,Finnhub,Google mulls massive investment in Anthropic,https://finnhub.io/api/news?id=eef7bb5b2424d8e40941653a0d2c2e33a04412c691ed5e314a4c276449fe40b4,2026-04-24T14:29:21+00:00,,6,neutral,0,0,0,0,0,0,0,0,0,0,0,1,0
GOOGL,finnhub_news,Yahoo,"Apple Stock, Back In Growth Mode, In Earnings Spotlight With Google, Meta, Amazon",https://finnhub.io/api/news?id=5eff453e21041d7678c032663b4ce25e730c1a5069c85a4059ace6f847037fb7,2026-04-24T14:21:11+00:00,,6,positive,2,0,2,0,0,0,0,0,0,0,0,0,0
GOOGL,finnhub_news,Yahoo,Google to build first Austria data centre in Kronstorf,https://finnhub.io/api/news?id=e13e11b9d6b5f7f144c8b5d3dbe09128533f10a0e869052a299f0f4f2f52ae1a,2026-04-24T14:16:15+00:00,,6,neutral,0,0,0,0,0,0,0,0,0,1,1,0,0
GOOGL,finnhub_news,Yahoo,Countdown to Alphabet (GOOGL) Q1 Earnings: A Look at Estimates Beyond Revenue and EPS,https://finnhub.io/api/news?id=2d6b5e3cb24b9b1caa34f89c541c3f66073f6e25607c4fe2426ebcce0c41e7ea,2026-04-24T13:15:03+00:00,,6,neutral,0,0,5,0,0,0,0,0,0,0,0,0,0
GOOGL,finnhub_news,CNBC,Google plans $40 billion Anthropic investment as AI compute race intensifies,https://finnhub.io/api/news?id=ece4a74b546a42bc26aa7dd751112ecd585e4470269a3201322afc05994beec9,2026-04-24T12:55:42+00:00,,6,neutral,0,0,0,2,0,1,0,0,0,0,1,0,0
GOOGL,finnhub_news,Finnhub,"Anthropic: Google investing $10 bln today at co's current valuation, with future investments of $30 bln contingent upon meeting certain performance milestones",https://finnhub.io/api/news?id=2576086c729eb7f77068f903d1845e986c6ad97c95b538a8ec0a6e913d53b180,2026-04-24T12:53:37+00:00,,6,neutral,0,0,0,0,0,0,0,0,0,0,0,1,0
