ticker,source_type,source,title,url,published_at,engagement,relevance_score,tone,positive_hits,negative_hits,earnings_profitability,nii_margin_rates,credit_risk_provisions,investment_banking_markets,consumer_cards_deposits,dimond_ceo_governance,regulation_capital,capital_return_buyback,ai_technology_fintech,valuation_defensive_bank,macro_geopolitical
JPM,finnhub_news,Yahoo,Earnings Growth & Price Strength Make JPMorgan Chase & Co. (JPM) a Stock to Watch,https://finnhub.io/api/news?id=9ea8f3bc8af96eaeb284a4f1e712ecb3e201b1a7f28cf1d7ac3caac6486bea39,2026-04-06 13:30:03+00:00,,10,positive,1,0,1,0,0,0,0,0,0,0,0,0,0
JPM,finnhub_news,CNBC,"Final Trades: Alphabet, Dick's Sporting Goods, Ebay and JPMorgan Chase",https://finnhub.io/api/news?id=334cce34b4dcdae3bed8b75441836c844a9ebaf78f168ce26144c6c92869a242,2026-04-06 13:05:28+00:00,,6,neutral,0,0,0,0,0,0,0,0,0,0,0,0,0
JPM,finnhub_news,Yahoo,Jamie Dimon Letter Warns ‘Skunk at the Party’ Could Hit the Stock Market in 2026,https://finnhub.io/api/news?id=af50b37bad4e8136ce0528d0eaea8c56c33b63b63feb7730cef648c113d8aac6,2026-04-06 12:54:00+00:00,,8,neutral,0,0,0,0,0,0,0,3,0,0,0,0,2
JPM,finnhub_news,Yahoo,Jamie Dimon Says Inflation Could Be 'Skunk at the Party',https://finnhub.io/api/news?id=dc0982ff25dbd2fdce43d77f629029199c22fe1cc02813e455e869ca289bdff6,2026-04-06 12:45:02+00:00,,15,neutral,1,1,0,2,0,0,0,4,0,0,0,0,3
JPM,finnhub_news,Yahoo,Jamie Dimon's JPMorgan shareholder letter warns of 2026 risks,https://finnhub.io/api/news?id=89b48f4f56af112248ff616686776d47730f1b1c18151559c924ec7feff55bfe,2026-04-06 12:40:26+00:00,,12,neutral,0,0,0,0,1,0,0,3,1,0,0,0,0
JPM,finnhub_news,Benzinga,"Jamie Dimon Says Calls For Major Trade Deal, But Sees Europe 'On A Bad Path'",https://finnhub.io/api/news?id=3d1d89ac90db139985d7fd9fee0091f3202d37b51353174def7a6be2f72d9528,2026-04-06 12:00:10+00:00,,9,neutral,0,0,0,0,0,1,0,2,0,0,0,0,1
JPM,finnhub_news,Yahoo,"JPMorgan’s Dimon bemoans parts of Basel, G-SIB proposals",https://finnhub.io/api/news?id=7d1b5148db076db7fa162463d7ef61b41af1430f1baf19b86bb950388327c651,2026-04-06 11:57:00+00:00,,13,neutral,0,0,0,0,0,0,0,4,1,0,0,0,0
JPM,finnhub_news,Yahoo,"JPMorgan to deploy $1 trillion to strengthen US economy, Dimon says",https://finnhub.io/api/news?id=6f8df58653028368af41b77f3b1e2bb48f09e2c4d17b4b5cfd286604561dbfb1,2026-04-06 10:48:23+00:00,,14,neutral,0,0,0,0,0,0,0,2,0,0,0,0,1
JPM,finnhub_news,Yahoo,"JPMorganChase Publishes 2025 Annual Report, Including Chairman & CEO Letter to Shareholders",https://finnhub.io/api/news?id=ace57e50de0daa93a1ccdd47df582bd10743bd57d25074cd9189e320cc4de791,2026-04-06 10:11:00+00:00,,10,neutral,0,0,0,0,0,0,0,1,0,0,0,0,0
JPM,finnhub_news,Yahoo,JPMorgan's Dimon warns Iran war may drive inflation and interest rates higher,https://finnhub.io/api/news?id=f6ff7b96c76e86f37baf3fdaba48ecd6106e0f2701f0b294c251bcd5dd10e9d0,2026-04-06 10:05:01+00:00,,15,positive,1,0,0,2,0,0,0,4,0,0,0,0,3
JPM,finnhub_news,MarketWatch,Jamie Dimon warns rising oil prices could trigger a recession and a bear market in 2026,https://finnhub.io/api/news?id=7069d570e29897cc87c40a7f58dc62c191f89c5a4cf648dc3662cb37f1901874,2026-04-06 10:03:00+00:00,,9,neutral,0,0,0,0,1,0,0,2,0,0,0,0,2
JPM,finnhub_news,Yahoo,"Jamie Dimon highlights Iran War, private credit, and AI-driven job losses as major US risks in his annual letter",https://finnhub.io/api/news?id=84e2976382550c645fecdc83200a8c40c303da307b394bcee187f4f1e5f4d8dd,2026-04-06 10:01:30+00:00,,13,neutral,0,0,0,0,1,0,0,4,0,0,1,0,3
JPM,finnhub_news,Yahoo,"Jamie Dimon Warns of Higher Inflation, Interest Rates From Iran War",https://finnhub.io/api/news?id=e0a3dcf04f6b262d25f944f79caabb842361519b018945052605f8bbd7812089,2026-04-06 10:00:00+00:00,,15,positive,1,0,0,2,0,0,0,3,0,0,0,0,2
JPM,finnhub_news,CNBC,"JPMorgan CEO Jamie Dimon in annual letter cites risks in geopolitics, AI and private markets",https://finnhub.io/api/news?id=6104dc9fa85911bc2147d082a1458ff8e29438272bb6481e91db334d3fbf2ef9,2026-04-06 06:44:03+00:00,,11,neutral,0,0,0,0,0,0,0,4,0,0,1,0,0
JPM,finnhub_news,Benzinga,"JPMorgan CEO Jamie Dimon, In Annual Shareholder Letter, Said Iran War-Related Risk Could Trigger Oil And Commodity Price Shocks, Reshape Global Supply Chain, Drive Stickier Inflation, Higher Interest Rates; Said Private Credit Likely Not Systemic Risk",https://finnhub.io/api/news?id=05f51a60df5e25c2deee40e53ac5b7fad5e0402f17d67b62b34eec5cb15284cd,2026-04-06 06:10:28+00:00,,13,neutral,1,1,0,2,1,0,0,4,0,0,0,0,3
JPM,finnhub_news,Yahoo,Is AI about to take your job? What Jamie Dimon says every American worker needs to know now,https://finnhub.io/api/news?id=e4f1808e0b4af23dc4f72757cc25a9aa78f534d0dea41a31f421d9cf4905d364,2026-04-05 18:40:00+00:00,,11,neutral,0,0,0,0,0,0,0,3,0,0,1,0,0
JPM,finnhub_news,Yahoo,Could JPMorgan Be Your Next Prediction Market Platform? Jamie Dimon Says 'It's Possible One Day...',https://finnhub.io/api/news?id=9270ef38c3d1f2b312b4cda9b22826ce351486517845afbf26b7ff349b0564df,2026-04-05 12:01:22+00:00,,13,neutral,0,0,0,0,0,0,0,3,0,0,0,0,0
JPM,reddit_post,wallstreetbets,i spent my weekend reading 98 s&amp;p 500 10-Ks for tariff and war risks. the results are.. weird. banks are way more exposed than oil companies,https://www.reddit.com/r/wallstreetbets/comments/1scmtjy/i_spent_my_weekend_reading_98_sp_500_10ks_for/,2026-04-04 22:33:52+00:00,2953.0,12,negative,0,1,1,2,2,0,0,0,0,0,1,1,5
JPM,finnhub_news,Yahoo,The Bull Case For PACCAR (PCAR) Could Change Following JP Morgan’s Upgrade Amid Diverging Analyst Views - Learn Why,https://finnhub.io/api/news?id=a0bef75688d7d03f40aac948fbb4db6439ed8c14b20ede510e05672576b2f97b,2026-04-02 22:17:54+00:00,,5,positive,3,0,0,0,0,0,0,0,1,0,1,0,0
JPM,finnhub_news,Yahoo,JPMorgan & Goldman Sachs eye prediction markets,https://finnhub.io/api/news?id=9441121756e25cad5a5d23a4fa1a40b32a64212a8a23361c301e096b97bd2c60,2026-04-02 19:17:22+00:00,,14,neutral,0,0,0,0,0,0,0,3,0,0,1,0,0
JPM,finnhub_news,Yahoo,Jamie Dimon Flags Iran Conflict As Key Risk For JPMorgan Investors,https://finnhub.io/api/news?id=5774cf9283fc8eb8b1beb455394ce89cb713170e9c8876a5bb035b210e2f77a4,2026-04-02 15:14:45+00:00,,21,negative,0,1,0,0,0,1,0,3,0,0,1,0,2
JPM,finnhub_news,Yahoo,"JPMorgan Asset Buys Treasuries, Gilts Dented by Inflation Risks",https://finnhub.io/api/news?id=dceed1ed7308e9f23871c0748e18c805087435b1260ae88d53ce5f2b59cac18e,2026-04-02 08:17:41+00:00,,5,neutral,1,1,0,2,0,0,0,0,0,0,0,0,2
JPM,finnhub_news,Yahoo,"Stocks making big moves yesterday: Chewy, Broadcom, Microsoft, RXO, and JPMorgan Chase",https://finnhub.io/api/news?id=740fafcbb76ea08dcf2dc8c8b3d67fe032d48f5035e008e58a7ab6e1a9ee0396,2026-04-01 22:31:26+00:00,,6,neutral,0,0,0,0,0,0,0,0,0,0,0,0,0
JPM,finnhub_news,Yahoo,"Jamie Dimon, office-work champion, vows his anti-remote culture ‘would crush you.’ The economy’s top talent begs to differ",https://finnhub.io/api/news?id=34acb7bf63667535386d19b67c21a147b9fbe1c75106b7e5bbc25f2d435b03dd,2026-04-01 18:41:40+00:00,,11,neutral,0,0,0,0,0,0,0,3,0,0,0,0,1
JPM,finnhub_news,Yahoo,JPMorgan Chase (JPM) Faces Challenging Backdrop Driving Large Withdrawals Across Industry,https://finnhub.io/api/news?id=ef02fc5f4763c3b23143e6b97a78d895a97df235d31750b32cf138e1fc7135ba,2026-04-01 16:44:27+00:00,,9,positive,2,0,0,0,0,0,0,0,0,0,0,0,0
JPM,finnhub_news,Yahoo,Will JPMorgan Chase & Co. (JPM) Beat Estimates Again in Its Next Earnings Report?,https://finnhub.io/api/news?id=4f9802d90d5ae17ee924b5716a3d552bf6fbdfa78fcf465bba0a776c2b517c7e,2026-04-01 16:10:02+00:00,,10,positive,1,0,2,0,0,0,0,0,0,0,0,0,0
JPM,finnhub_news,Yahoo,JPMorgan Chase & Co. (JPM): Billionaire Rob Citrone Likes This Banking Stock,https://finnhub.io/api/news?id=25121411a2020e6a78545ad540d59579d8c386aa7af1d344366b8a033a525166,2026-04-01 15:28:16+00:00,,10,positive,1,0,1,0,0,0,0,0,0,0,0,0,0
JPM,finnhub_news,Yahoo,Jamie Dimon eyes prediction markets entry for JPMorgan,https://finnhub.io/api/news?id=de5740dbca12fe5052533b06d64f23a4bdbd442175f943e114d5c370e6283f85,2026-04-01 14:46:30+00:00,,10,neutral,0,0,0,0,0,0,0,3,0,0,0,0,0
JPM,finnhub_news,Yahoo,A Look At JPMorgan Chase’s American Dream Initiative And What It Could Mean For JPMorgan (JPM) Valuation,https://finnhub.io/api/news?id=31baaa5f6364ba4d612ad15b487acd3216c494094e2e61d1fdd5376cf5f3ed37,2026-04-01 12:19:22+00:00,,10,neutral,1,1,0,0,0,0,0,0,0,0,0,1,0
JPM,finnhub_news,Benzinga,Jamie Dimon Calls Trump's Institutional Home-Buying Ban 'Basically Irrelevant' Because Of This Reason— 'I Don't Think...',https://finnhub.io/api/news?id=2ad963566c093657804755403a03418a5c65756c9c4f8f09c92c4b2ac61836dc,2026-04-01 08:52:45+00:00,,8,neutral,0,0,0,0,0,0,1,2,0,0,0,0,0
JPM,finnhub_news,Benzinga,Could JPMorgan Be Your Next Prediction Market Platform? Jamie Dimon Says 'It's Possible One Day...',https://finnhub.io/api/news?id=9c201284165a06fce97c2ef10c07800eee1c2c224d75d6e410022c3b82a3a36b,2026-04-01 08:32:35+00:00,,13,neutral,0,0,0,0,0,0,0,3,0,0,0,0,0
JPM,finnhub_news,MarketWatch,JPMorgan’s Jamie Dimon says the bank could one day enter prediction markets,https://finnhub.io/api/news?id=e0996770e73aada3fe72edb9926d73d3869e917206393679a85f86aaf195b70c,2026-04-01 06:38:00+00:00,,10,neutral,0,0,0,0,0,0,0,2,0,0,0,0,0
JPM,finnhub_news,Yahoo,"JPMorgan Chase (JPM) Stock Is Up, What You Need To Know",https://finnhub.io/api/news?id=b111854536f07fcce9d8372a6fe373efff12f81e0f03d48457b1f98351e0b657,2026-04-01 03:25:19+00:00,,9,neutral,0,0,0,0,0,0,0,0,0,0,0,0,0
JPM,finnhub_news,Benzinga,"Jamie Dimon Calls Capitalism Critiques 'Dead Wrong,' Blames Policy Failures As Economic Growth Staggers— 'Some People Are Selfish...'",https://finnhub.io/api/news?id=6ee9bdfcf6ef506a8532984a98bd0fc25528fbcaa505b00065eb1430333ec24c,2026-04-01 02:54:44+00:00,,10,positive,1,0,0,0,0,0,0,3,0,0,0,0,0
JPM,finnhub_news,Benzinga,Jamie Dimon Puzzled By 'Fair Share' In Bernie's Billionaire Tax Plan; Sanders Says 'Let Me Clear Things Up For You,https://finnhub.io/api/news?id=e3b48dee09cd2429dd64f13775381af36a64b0e5f6eff6d45e95aef6a0c90081,2026-04-01 01:14:41+00:00,,7,positive,1,0,0,0,0,0,0,2,0,0,0,0,0
JPM,finnhub_news,Yahoo,JPMorgan's $3.8B AI Data Center Bond Draws $14B in Orders,https://finnhub.io/api/news?id=d208ad98ee2383d14cc74b07262a6aa803bb791183f5dd438c84c38e80d5ae8a,2026-03-31 21:23:37+00:00,,5,positive,1,0,1,0,0,0,0,0,0,0,1,0,0
JPM,finnhub_news,MarketWatch,Jamie Dimon Says Success in Iran Is ‘Much More Important’ Than What the Market Does,https://finnhub.io/api/news?id=019fba2469177763250fc1f1eb25931eedf6888ba8688b01ea1e16ecb2d06653,2026-03-31 16:45:00+00:00,,7,neutral,0,0,0,0,0,0,0,2,0,0,0,0,0
JPM,finnhub_news,Yahoo,JPMorgan Scales Blockchain Platform via Mitsubishi Tie-Up,https://finnhub.io/api/news?id=c120ac1ee2ecfacee5337954028b77feb5b1cec1572df8352f9f0003ff1114d8,2026-03-31 16:06:00+00:00,,5,neutral,0,0,0,0,0,1,0,0,0,0,2,0,0
JPM,finnhub_news,Yahoo,JPMorgan Chase wants to save the 'American Dream',https://finnhub.io/api/news?id=b34e1f1214688277711f1619a03bcf82dd5e2089724d4569b884bb8e82ea680a,2026-03-31 13:52:32+00:00,,6,neutral,0,0,0,0,0,0,0,0,0,0,0,0,0
JPM,finnhub_news,Yahoo,JPMorgan Chase & Co. (JPM) is Attracting Investor Attention: Here is What You Should Know,https://finnhub.io/api/news?id=8bddfedfa28fa823dd968fcc6b7a7e51b94aac3f050618f43a5b1d5596337aac,2026-03-31 13:00:02+00:00,,9,neutral,0,0,0,0,0,0,0,0,0,0,0,0,0
JPM,gdelt_news,benzinga.com,What Going On With JP Morgan Stock Tuesday ? - JPMorgan Chase ( NYSE : JPM ) ,https://www.benzinga.com/markets/equities/26/03/51563515/jpmorgan-chase-aims-to-transform-local-economies-with-targeted-investments,2026-03-31 13:00:00+00:00,,12,neutral,0,0,0,0,0,0,0,0,0,0,0,0,0
JPM,finnhub_news,Yahoo,Jamie Dimon Has a Plan for JPMorgan to Rescue the American Dream,https://finnhub.io/api/news?id=48111b8f654dbfe980fce9a912988f081543f0a3a5fec737bfc103cafe2c31a5,2026-03-31 11:32:00+00:00,,10,positive,1,0,0,0,0,0,0,2,0,0,0,0,0
JPM,finnhub_news,Yahoo,JPMorgan Chase rolls out new effort to expand economic opportunity,https://finnhub.io/api/news?id=31e36aaf6d141870625daa340151b8346c8b7bbd38d6784a8346e54673667167,2026-03-31 11:15:43+00:00,,6,neutral,0,0,0,0,0,0,0,0,0,0,0,0,0
JPM,finnhub_news,Benzinga,Jamie Dimon Warns Markets Won't Calm Until Iran Conflict Ends,https://finnhub.io/api/news?id=b3f825249438a6168a3a9e8748167f9f853a1642b383624ad0eabd899cde6e65,2026-03-31 10:57:48+00:00,,7,neutral,0,0,0,0,0,0,0,2,0,0,0,0,0
JPM,finnhub_news,Yahoo,JPMorgan or Bank of America: Jefferies Names the Top Banking Stock to Buy for 2026,https://finnhub.io/api/news?id=5b06ebfc159966bb33471cf5639c56404579a5e7128aaf4f8508395600de0a0c,2026-03-31 10:26:02+00:00,,8,positive,2,0,3,3,0,1,0,0,0,0,0,0,0
JPM,finnhub_news,Yahoo,JPMorgan Chase launches American Dream Initiative to expand small business support across the US,https://finnhub.io/api/news?id=cdd38523370c483ef34e70d170c947464baef28e632cc3e419b1898a33fb38f2,2026-03-31 10:01:07+00:00,,6,neutral,0,0,0,0,0,0,0,0,0,0,0,0,0
JPM,finnhub_news,Yahoo,"JPMorgan's Jamie Dimon plans small business lending, hiring push to shore up American Dream",https://finnhub.io/api/news?id=43e3b8cddff8b0f3f31dc2ac2b2ab49b8f79fedd8585a5f9cbf1db47b4738ba8,2026-03-31 10:00:44+00:00,,13,neutral,0,0,0,0,0,0,0,2,0,0,0,0,0
JPM,finnhub_news,Yahoo,"JPMorgan plans to lend $80 billion to US small businesses, hire 1,000 bankers",https://finnhub.io/api/news?id=1e59821341f1189fff54cab05b084947474c1656e67f5cff1d9d9ff7fcc4e498,2026-03-31 10:00:44+00:00,,6,neutral,0,0,0,0,0,0,0,0,0,0,0,0,0
JPM,finnhub_news,Yahoo,Jamie Dimon says the American Dream is ‘slipping out of reach’ — and JPMorgan is spending billions to fix it,https://finnhub.io/api/news?id=318b5e5787eb0bb4f4341d899e19ce43074464dfa592e95749a3f9bc64b5af1f,2026-03-31 10:00:00+00:00,,10,neutral,0,0,0,0,0,0,0,2,0,0,0,0,0
JPM,finnhub_news,Yahoo,"JPMorgan to Hire 1,000 Bankers, Boost Lending in Small Business Push",https://finnhub.io/api/news?id=bc44b1a381a52eb76eedcb30df691c9a99ad82f22b86c211480c080b75bade8b,2026-03-31 10:00:00+00:00,,10,neutral,0,0,0,0,0,0,0,3,0,0,0,0,0
JPM,finnhub_news,Yahoo,JPMorgan expands digital assets push with Mitsubishi deal as it targets $10bn in daily transactions,https://finnhub.io/api/news?id=9c70b55763223b20eab202cfb21078485653f2ebaacc210822812520521386b8,2026-03-31 08:00:03+00:00,,5,neutral,0,0,0,0,0,1,0,0,0,0,4,0,0
JPM,finnhub_news,Benzinga,JPMorgan Chase Aims To Transform Local Economies With Targeted Investments,https://finnhub.io/api/news?id=25759017f78a9205a907ceeb0a2415a83ba7971b26546cd094bbc6d099902882,2026-03-31 07:57:06+00:00,,12,positive,1,0,0,0,0,0,0,0,0,0,0,0,0
JPM,finnhub_news,Yahoo,JPMorgan Chase Jersey City Layoffs Reflect Ongoing Workforce Rebalancing,https://finnhub.io/api/news?id=7447278cd17adbfe003824343fad8434d15e12313095578ca0e1408e4fc83b54,2026-03-31 07:05:21+00:00,,9,neutral,0,0,0,0,0,0,0,0,0,0,0,0,0
JPM,finnhub_news,Yahoo,Is It Time To Reassess JPMorgan Chase (JPM) After Recent Share Price Swings?,https://finnhub.io/api/news?id=4d118efa5ff698b374bc71718cb5cb534111e31fe7f2f34f338ba41d7008cd40,2026-03-31 06:04:36+00:00,,9,negative,0,1,0,0,0,0,0,0,0,0,0,0,0
JPM,finnhub_news,Yahoo,JPMorgan Sees Australia IPO Demand Resilient to Stock Turmoil,https://finnhub.io/api/news?id=54feef8d6469841d5ae4a51037a773fecb339d8bbc311ef9bc61fe81a99be802,2026-03-31 01:35:46+00:00,,9,neutral,0,0,0,0,0,3,0,0,0,0,0,1,1
JPM,finnhub_news,Yahoo,JPMorgan Chase & Co. (JPM) Price Target Cut by Truist as Macro Pressures Weigh on Outlook,https://finnhub.io/api/news?id=943b58ec7e6956c3263071e6230b607aff0cfc8ab9fbebecb11a2d9e01f8929e,2026-03-30 22:32:38+00:00,,11,positive,1,0,0,0,0,0,0,0,0,1,0,1,0
JPM,reddit_post,investing,"Where can I track BofA / JPM / GS index targets (S&amp;P 500, Gold) in one place?",https://www.reddit.com/r/investing/comments/1s7untz/where_can_i_track_bofa_jpm_gs_index_targets_sp/,2026-03-30 15:59:59+00:00,3.0,8,neutral,0,0,0,1,0,0,0,0,0,0,0,0,0
JPM,finnhub_news,Yahoo,JPMorgan Chase & Co. (JPM) Could Be a Great Choice,https://finnhub.io/api/news?id=2f6aea01a97807e9bf742a22c5124db7b8f3bbe2a2e02086279115a6773b538b,2026-03-30 15:45:03+00:00,,10,neutral,0,0,0,0,0,0,0,0,0,1,0,0,0
JPM,finnhub_news,Benzinga,"Piper Sandler Reiterates Overweight on JPMorgan Chase, Lowers Price Target to $325",https://finnhub.io/api/news?id=e3cfc99a76539fa5bce07de1a455c02af7c9aee5cfd0c7b95c1b1441117ad53e,2026-03-30 13:50:34+00:00,,10,neutral,0,0,0,0,0,0,0,0,0,0,0,1,0
JPM,finnhub_news,Yahoo,"JPMorgan starts Seagate at Overweight, sees more upside despite 350% rally",https://finnhub.io/api/news?id=cf3bed7020479f3c1c1c69984ed586243c786fd2192b975cef24999d8c2f8901,2026-03-30 13:16:32+00:00,,5,positive,1,0,0,0,0,0,0,0,0,0,1,1,0
JPM,finnhub_news,Yahoo,Tightening Credit Conditions and Evolving Regulatory Tailwinds Shaping Analyst Narrative Around JPMorgan Chase (JPM),https://finnhub.io/api/news?id=c22ec0898d0a233b91a3fe985a5d8c70e9f469689b79807bc533f532e58d3a17,2026-03-28 20:58:57+00:00,,12,positive,2,0,0,0,1,0,0,0,1,0,0,1,0
JPM,finnhub_news,Yahoo,"Inside ‘Project Eagle,’ JPMorgan’s High-Wire Act to Fund EA Deal",https://finnhub.io/api/news?id=080a2fd22af214f60cfb409ba370666e61002c65f288eb92cc14e3a703b9f67e,2026-03-28 19:00:00+00:00,,7,negative,0,1,0,0,0,1,0,0,0,0,0,0,0
JPM,finnhub_news,Yahoo,How Regulatory Shifts and Tech Ambitions At JPMorgan Chase (JPM) Have Changed Its Investment Story,https://finnhub.io/api/news?id=f378936d2675d98ac76ff5da73ba597f4a8ded4648438a23aefa976607510ea2,2026-03-27 23:06:09+00:00,,16,neutral,0,0,0,0,1,1,0,1,2,0,2,0,0
JPM,finnhub_news,Yahoo,How to Approach JPMorgan Stock as Fed Set to Ease Capital Rules,https://finnhub.io/api/news?id=1a4f493bdf9c9a30f2d66ee67c8f57c4c516d858987f8af6a2bca185068e3fff,2026-03-27 14:03:00+00:00,,10,positive,2,0,0,1,0,0,0,0,2,0,0,0,0
JPM,finnhub_news,SeekingAlpha,Option Activity Is Bullish For JPMorgan And Financial Sector (Technical Analysis),https://finnhub.io/api/news?id=9c4f10fa87509e6a3ac2b712818113673a46223ea5b14e2736c4d84e56dfea34,2026-03-27 13:11:14+00:00,,6,positive,3,0,0,0,0,0,0,0,0,0,0,0,0
JPM,finnhub_news,Yahoo,He Was Warren Buffett’s Protégé. Now He’s Running Money for Jamie Dimon.,https://finnhub.io/api/news?id=5cf86560e1c2c7a7f8428695afaff7c6ada093ca4fb448d25d406c9b8c5d7d5f,2026-03-27 05:30:00+00:00,,13,neutral,0,0,0,0,0,0,0,3,0,0,0,0,0
JPM,finnhub_news,Yahoo,Jamie Dimon Sees A Faster AI Shock Coming,https://finnhub.io/api/news?id=fc8c3192a401ca2ed5b1f88907af45d12b9fc277592c6230761a7625d3d94224,2026-03-26 19:22:32+00:00,,8,neutral,0,0,0,0,0,0,0,2,0,0,1,0,0
JPM,finnhub_news,Benzinga,Here's How Much You Would Have Made Owning JPMorgan Chase Stock In The Last 15 Years,https://finnhub.io/api/news?id=ffd2ae57c77148245e9d51af0d849ad80e394c11dfefcbc3e01a47a645294bf6,2026-03-26 18:15:40+00:00,,6,neutral,0,0,0,0,0,0,0,0,0,0,0,0,0
JPM,finnhub_news,Fintel,Jefferies Initiates Coverage of JPMorgan Chase (JPM) with Hold Recommendation,https://finnhub.io/api/news?id=0a1645528dafe6e9eeb7791af2e1c0e6b9c1943a60e0817910fa47dc251445c6,2026-03-26 15:02:25+00:00,,9,neutral,0,0,0,0,0,0,0,0,0,0,0,0,0
JPM,finnhub_news,Yahoo,"Investors move back to cash in 2022-style shift, JPM says",https://finnhub.io/api/news?id=ca9261c023ef5fe6720a618bb6d01549bd302630ec5c3498957d1c1d1d5b47a8,2026-03-26 12:43:06+00:00,,7,neutral,0,0,0,0,0,0,0,0,0,0,0,0,1
JPM,finnhub_news,Benzinga,"Jefferies Initiates Coverage On JPMorgan Chase with Hold Rating, Announces Price Target of $310",https://finnhub.io/api/news?id=586991e908eb0a4856f0c87d6f9f499224632b11c1480f63d91e9d8943e0607e,2026-03-26 08:55:08+00:00,,10,neutral,0,0,0,0,0,0,0,0,0,0,0,1,0
JPM,finnhub_news,Yahoo,Fiserv Reshapes Fintech Role With Western Alliance Deal And JP Morgan Hires,https://finnhub.io/api/news?id=3c1c7c6d47f725c1a0d0accdbeddd5dcb195937dbcb3a104480b793a319df029,2026-03-26 07:06:52+00:00,,5,positive,1,0,0,0,0,1,0,0,0,0,4,0,0
JPM,finnhub_news,Yahoo,JPMorgan Chase Earnings Preview: What to Expect,https://finnhub.io/api/news?id=2a19f5814f24b3a3a50caff3ad3942bc5a5fc263bfe96cbb39397288793cb4f3,2026-03-25 14:48:41+00:00,,7,neutral,0,0,3,0,0,0,0,0,0,0,0,0,0
JPM,finnhub_news,Benzinga,Jamie Dimon 'Deeply Frustrated' By US Defense Rigidities; 'Little Optimistic' On Middle East Peace,https://finnhub.io/api/news?id=01c5c93375ef59bc5034e3c91e25b1a6aa9afc8d75b9eb427eefa6e7145cc2eb,2026-03-25 08:26:54+00:00,,10,neutral,0,0,0,0,0,0,0,2,0,0,0,0,0
JPM,finnhub_news,Yahoo,JPMorgan Balances Banker Burnout Monitoring With Capital And Stablecoin Shifts,https://finnhub.io/api/news?id=dd1b0beed11b530f46c76dfbfd49c7c4a9c5cb40b953f6ee2940d577c3b0565f,2026-03-25 05:03:16+00:00,,11,negative,0,1,0,0,0,0,0,0,1,0,2,0,0
JPM,finnhub_news,Yahoo,JPMorgan launches $8 billion bond sale for EA buyout,https://finnhub.io/api/news?id=ed522244337557dcfcc472a12e69ffce952e05f8be2022cbc62d11d4bad3ff26,2026-03-25 03:07:00+00:00,,7,neutral,0,0,0,0,1,0,0,0,0,0,0,0,0
JPM,finnhub_news,Yahoo,Large Banks Score Major Regulatory Win That Could Free Up Tens of Billions in Capital. Should You Buy JPMorgan Chase Stock?,https://finnhub.io/api/news?id=193c22fb75974dc339183f38b526700e1759789c15c6a52a77a26c88ed39ae65,2026-03-24 18:25:00+00:00,,7,positive,1,0,0,0,0,0,0,0,1,0,0,0,0
JPM,finnhub_news,CNBC,"Dimon warns on AI job losses, calls for government-business incentives",https://finnhub.io/api/news?id=f2619a4109a0c445217df7a6b1ab432a9f693f2032b2ac14efbfdb67512304ae,2026-03-24 14:23:45+00:00,,5,neutral,0,0,0,0,0,0,0,1,0,0,1,0,0
JPM,finnhub_news,Yahoo,Why JPMorgan Chase & Co. (JPM) is a Top Stock for the Long-Term,https://finnhub.io/api/news?id=ae4c09a95ee4310a0370a6843613f4aed352bac42097af3058d601480f5e198f,2026-03-24 13:30:02+00:00,,9,positive,1,0,0,0,0,0,0,0,0,0,0,0,0
JPM,finnhub_news,Yahoo,"Zacks Investment Ideas feature highlights: EPR Properties, H&R Block, Intuit, HSBC and JPMorgan",https://finnhub.io/api/news?id=74dcd8e3de79be06931daa086c7b14a522799b5769bca953dd5e797e363973b6,2026-03-24 13:11:00+00:00,,5,neutral,0,0,0,0,0,0,0,0,0,1,0,0,2
JPM,finnhub_news,CNBC,JPMorgan Chase CEO Dimon: 'Deeply frustrated' with policies in America,https://finnhub.io/api/news?id=199c8f15bd0123ebaa6e6ac8edb3d02b075df0dc9c7e78d1dfaa87d4204ecd93,2026-03-24 12:37:54+00:00,,10,neutral,0,0,0,0,0,0,0,2,0,0,0,0,0
JPM,finnhub_news,CNBC,Jamie Dimon says Iran war makes Middle East peace prospects better in the long term,https://finnhub.io/api/news?id=826533165eabac9cfdb1e14be2908de774fb0975cca6549fe928f3e0e0d2bb3b,2026-03-24 12:27:24+00:00,,14,neutral,0,0,0,0,0,0,0,3,0,0,0,0,1
JPM,finnhub_news,Yahoo,JPMorgan Chase & Co. (JPM) Surpasses Market Returns: Some Facts Worth Knowing,https://finnhub.io/api/news?id=0b55359afc83b4ca5935df43ec438eddbdf912d9874769857c9d451eee733e77,2026-03-23 21:45:03+00:00,,9,neutral,0,0,0,0,0,0,0,0,0,0,0,0,0
JPM,finnhub_news,Yahoo,JPMorgan’s US$8b EA Buyout Deal And What It Means For Valuation,https://finnhub.io/api/news?id=28e11dc51252c80da2a05c1e4cd8bdb28ffcbee26dc13a5d70e2bb2cfebe906b,2026-03-23 20:05:04+00:00,,13,neutral,1,1,0,0,0,3,0,0,0,0,0,1,0
JPM,finnhub_news,Yahoo,JPMorgan offers clients a new way to hedge AI debt risk,https://finnhub.io/api/news?id=c5229598e4ccb74cc3981c07886907a82a3b9e5e80648dc142c8a5ef4c65dad2,2026-03-23 17:52:30+00:00,,8,negative,0,1,0,0,2,0,0,0,0,0,1,0,0
JPM,finnhub_news,MarketWatch,"JPMorgan Chase & Co. stock rises Monday, outperforms market",https://finnhub.io/api/news?id=8ad539c59fd95b010783fea79c7dec2162332631bf3ab0a8652a418d7a7dc1c7,2026-03-23 16:31:00+00:00,,6,neutral,0,0,0,0,0,0,0,0,0,0,0,0,0
JPM,finnhub_news,Yahoo,JPMorgan delivers a stark message for oil investors,https://finnhub.io/api/news?id=21b7751fdd0c5ed0cac7bc07c896b9e2fca5b2b08c36767b97d0d59836831c7d,2026-03-23 02:55:01+00:00,,5,neutral,0,0,0,0,0,0,0,0,0,0,1,0,2
JPM,finnhub_news,Yahoo,Should You Buy JPMorgan Chase Stock Before April 14?,https://finnhub.io/api/news?id=c6a9e3e166ad4872d8c6fb5a8516c22250ad7e2563515df8695ef07fd0940dc2,2026-03-22 20:05:00+00:00,,7,positive,1,0,1,0,0,0,0,0,0,0,0,0,0
JPM,finnhub_news,Yahoo,JP Morgan resets S&P 500 price target for rest of 2026,https://finnhub.io/api/news?id=c6b7dd06a36c4af0bd6e67898251be52480c053beeec88218e439810ae0e6391,2026-03-21 18:00:18+00:00,,7,neutral,0,0,0,0,0,0,0,0,0,0,0,1,0
JPM,finnhub_news,Yahoo,"JPMorgan CEO Jamie Dimon said this asset could soar to ‘$10,000,’ despite dismissing it before. How 2026 is shaping up",https://finnhub.io/api/news?id=1e89874d5d3dc06c87b3db8d71efeb123d99aa0518dd72b772195923f77df997,2026-03-21 11:59:00+00:00,,10,neutral,0,0,0,0,0,0,0,3,0,0,0,0,0
JPM,finnhub_news,Yahoo,JPMorgan identifies key liquidity backstops as private credit redemptions mount,https://finnhub.io/api/news?id=44cac7f3e582c19c571e0f532e4e2e6640814f051dd5998615feefd3c6c28f75,2026-03-21 01:30:02+00:00,,10,neutral,0,0,0,0,1,0,0,0,0,0,0,0,0
JPM,finnhub_news,Yahoo,Wall Street view: JPMorgan trims S&P 500 estimate on Middle East supply risks,https://finnhub.io/api/news?id=114a7dcac396bb5ba527434eb5826b4608ec06bd9904d09b1f4588725f520ada,2026-03-20 23:26:48+00:00,,9,negative,0,1,0,0,0,0,0,0,0,0,0,0,0
JPM,finnhub_news,Yahoo,"The Zacks Analyst Blog Highlights JPMorgan, Bank of America, Citigroup, Wells Fargo and KeyCorp",https://finnhub.io/api/news?id=21d0640556e4ceaf3196b9068a17d519f3689f5940962e3b37026c1cea2cb742,2026-03-20 13:59:00+00:00,,7,positive,1,0,1,1,0,0,0,0,1,0,0,0,1
JPM,finnhub_news,Yahoo,JPMorgan Chase & Co. (JPM) Is a Trending Stock: Facts to Know Before Betting on It,https://finnhub.io/api/news?id=f846da5b6542057e6e4c0ce77b2a38a140ed9b3f8296986b41b52d46566135da,2026-03-20 13:00:03+00:00,,9,neutral,0,0,0,0,0,0,0,0,0,0,0,0,0
JPM,finnhub_news,Yahoo,JPMorgan Chase CEO Jamie Dimon Sees an End on the Horizon. But Not Yet.,https://finnhub.io/api/news?id=a46d0cfbabf9804d2a8dcb3c62d44f4f8eb5da129455bf208bfea5b628bbe91d,2026-03-20 06:30:00+00:00,,13,neutral,0,0,0,0,0,0,0,3,0,0,0,0,0
JPM,finnhub_news,Yahoo,JPMorgan deploys tech to monitor junior bankers’ working hours,https://finnhub.io/api/news?id=7d01fb3c55d845f111fce7f678f16e41e506507bc6e3c3275b5d119ecd84fb55,2026-03-20 05:00:05+00:00,,6,neutral,0,0,0,0,0,0,0,0,0,0,0,0,0
