ticker,source_type,source,title,url,published_at,engagement,relevance_score,tone,positive_hits,negative_hits,earnings_guidance,loan_growth,funding_liquidity,credit_risk,ai_model,rates_macro,profitability,legal_class_action,valuation_short,competition_fintech
UPST,finnhub_news,Finnhub,"UPST CLASS ACTION NOTICE: Faruqi & Faruqi, LLP Reminds Upstart (UPST) Investors of Securities Class Action Deadline on June 8, 2026",https://finnhub.io/api/news?id=5e7d02e8c180e6d3d34f5771b3892ae249c341c22b5ca7cd5ca3d2a940d90cfb,2026-05-02T07:57:04+00:00,,6,negative,0,2,0,0,0,0,0,0,0,3,0,0
UPST,finnhub_news,SeekingAlpha,Upstart: Undervalued Ahead Of A Likely Earnings Beat,https://finnhub.io/api/news?id=3ff354bc06503a6fd91c3d4b8d29374b13386f8094cd6a8c1947a6fedf8da056,2026-05-02T03:19:27+00:00,,6,positive,3,1,2,0,0,0,0,0,0,0,1,0
UPST,finnhub_news,Finnhub,Upstart : Justice Federal Credit Union Selects Upstart to Expand Personal Lending,https://finnhub.io/api/news?id=8560cb03c07575ed65728d3382703f70fac082f67574f5110adabcc85f9d9f7b,2026-04-30T09:11:27+00:00,,6,positive,1,0,0,2,0,0,1,1,0,0,0,1
UPST,finnhub_news,Finnhub,Justice Federal Credit Union Selects Upstart to Expand Personal Lending,https://finnhub.io/api/news?id=de390014d1b76128680c1278ded9f48f8ae00bd08845d62b82f20c2efbcae005,2026-04-30T09:03:05+00:00,,6,positive,1,0,0,2,0,0,1,1,0,0,0,1
UPST,finnhub_news,SeekingAlpha,Upstart's Record-Breaking New Product Launch Strengthens My Bullish View,https://finnhub.io/api/news?id=a15769e2c4948618c2e64145606f8265f446a558b00c5cc98ae6016cbab4e030,2026-04-29T16:21:32+00:00,,6,positive,3,0,0,0,0,0,0,0,0,0,0,0
UPST,finnhub_news,Finnhub,Upstart announces $1.25 billion forward-flow agreement with Fortress Investment Group,https://finnhub.io/api/news?id=3d8cd18727fc47762b929b279c8d98dd4ae8ba194147f7eebaaf1902fa4bbdd4,2026-04-29T15:04:16+00:00,,6,positive,2,0,0,0,2,0,0,0,0,0,0,0
UPST,finnhub_news,Benzinga,What's Going On With Upstart Holdings Stock?,https://finnhub.io/api/news?id=d77923c3d0211d86c1254aacc17c930992b51c480cb4f9ca619245141f018f58,2026-04-29T11:37:32+00:00,,6,positive,1,0,0,0,0,0,0,0,0,0,0,0
UPST,finnhub_news,Benzinga,Upstart Announces Fortress Has Agreed To Purchase Up To $1.25B Of Consumer Loans Originated Through The Upstart Platform Over The Course Of 15 Months,https://finnhub.io/api/news?id=6fddcf7e8865235412d4b76e54010f59729ce2165fe772d1cdffb6af4e19663e,2026-04-29T08:46:58+00:00,,6,positive,1,0,0,3,2,0,1,0,0,0,0,0
UPST,finnhub_news,Finnhub,Upstart Announces $1.25B Forward-Flow Agreement with Fortress Investment Group,https://finnhub.io/api/news?id=19cd3e8eb486a4d03c99b5aded5df6cc21b4118d86a1b2d1d97d546da1048f98,2026-04-29T08:46:04+00:00,,6,positive,1,0,0,0,2,0,1,0,0,0,0,0
UPST,finnhub_news,Finnhub,"UPST DEADLINE ALERT: Faruqi & Faruqi, LLP Reminds Upstart (UPST) Investors of Securities Class Action Deadline on June 8, 2026",https://finnhub.io/api/news?id=385ba7b36913812ddc38c57cc589e3d52ed9d7e1ac78dd4f37cbffc237c4dc22,2026-04-28T17:31:06+00:00,,6,negative,0,2,0,0,0,0,0,0,0,3,0,0
UPST,finnhub_news,Finnhub,"UPSTART HOLDINGS, INC. SECURITIES FRAUD NOTICE: Berger Montague Informs Upstart Holdings, Inc. (UPST) Investors of a Securities Fraud Lawsuit",https://finnhub.io/api/news?id=4ee9a575314367b6e8f70492c10e369c76091658e36c6896ea1a8e77731fb30a,2026-04-28T09:07:04+00:00,,6,negative,1,3,0,0,0,0,0,0,0,4,0,0
UPST,finnhub_news,Finnhub,"UPST INVESTOR DEADLINE APPROACHING: Faruqi & Faruqi, LLP Reminds Upstart (UPST) Investors of Securities Class Action Deadline on June 8, 2026",https://finnhub.io/api/news?id=aba38b6d8022feef6eb8c97758ffa8ef47904a58da9fa0706722f575fd542006,2026-04-25T08:12:04+00:00,,6,negative,0,2,0,0,0,0,0,0,0,3,0,0
UPST,finnhub_news,Finnhub,"UPST Stockholders Have Rights - If You Lost Money Investing in Upstart Holdings, Inc. Contact Robbins LLP for Information About Recovering Your Losses",https://finnhub.io/api/news?id=624c5c4a03bb16eb3cc345a6a7ad5cfe5b70a24f26882f9e44271c43ed7c87fe,2026-04-23T20:07:09+00:00,,6,negative,1,2,1,0,0,0,0,0,0,1,0,0
UPST,finnhub_news,Finnhub,"UPST CLASS ACTION NOTICE: Faruqi & Faruqi, LLP Reminds Upstart (UPST) Investors of Securities Class Action Deadline on June 8, 2026",https://finnhub.io/api/news?id=048151bfdd69c05d2c9fe37d9f74ec3fc8f81edcc87d3e83dbc9f2f675c8a892,2026-04-23T10:45:05+00:00,,6,negative,0,2,0,0,0,0,0,0,0,3,0,0
UPST,finnhub_news,Benzinga,Upstart Holdings Announces Centerbridge Agrees To Acquire $1.2B Of Consumer Loans Originated Through Its Platform,https://finnhub.io/api/news?id=5e37be30f42b38f6f7027d9a15fbfc502d6fbf14b1c5c736d0fdd90163595265,2026-04-22T08:46:45+00:00,,6,neutral,0,0,0,3,1,0,1,0,0,0,0,0
UPST,finnhub_news,Finnhub,"Upstart Announces Multi-Year $1.2B Forward-Flow Agreement with Centerbridge Partners, L.P.",https://finnhub.io/api/news?id=b2f7756233b12111e3eb4e0458f5b4279a3ba0fb89a438ebc4bf854ce6b2e1a0,2026-04-22T08:45:06+00:00,,6,positive,1,0,0,0,1,0,1,0,0,0,0,0
UPST,finnhub_news,Finnhub,UPST Investor Alert: Upstart Holdings Securities Fraud Lawsuit - Investors With Losses May Seek to Lead the Class Action After Company Allegedly Broke Revenue Promises,https://finnhub.io/api/news?id=b8ce231219579e78f82667738aea6292887c59032579367cddbfd82661b61705,2026-04-21T16:01:05+00:00,,6,negative,0,4,2,0,0,0,0,0,0,5,0,0
UPST,finnhub_news,Finnhub,"UPSTART HOLDINGS, INC. (UPST) DEADLINE ALERT Bernstein Liebhard LLP Reminds Upstart Holdings, Inc. Investors of Upcoming Deadline",https://finnhub.io/api/news?id=df631d5d49af1f00c20b675034afbdaa206cfba87fafee74c7bdbe5038730be3,2026-04-21T11:22:05+00:00,,6,negative,0,4,0,0,0,0,0,0,0,5,0,0
UPST,finnhub_news,Finnhub,"Robbins LLP Urges Investors Who Lost Money Investing in Upstart Holdings, Inc. to Contact the Firm for Information About Leading the Class Action Against UPST",https://finnhub.io/api/news?id=be7ab5eb54cc080490c0099a2ee537d3fc47796991491dd92336b9b1a0036c27,2026-04-20T16:37:04+00:00,,6,neutral,1,1,0,0,0,0,0,0,0,2,0,0
UPST,finnhub_news,Finnhub,"UPST SHAREHOLDER REMINDER: Faruqi & Faruqi, LLP Reminds Upstart (UPST) Investors of Securities Class Action Deadline on June 8, 2026",https://finnhub.io/api/news?id=784a8d517f6d6e3f68275ec9224b68650a021834f454d21e1132cc0281cfa01b,2026-04-19T08:11:04+00:00,,6,negative,0,2,0,0,0,0,0,0,0,3,0,0
UPST,finnhub_news,Finnhub,"Faruqi & Faruqi, LLP Highlights Class Action Against Upstart Holdings (UPST) and Upcoming Lead Plaintiff Deadline of June 8, 2026",https://finnhub.io/api/news?id=a2ab812d0aa8362bd87da1065841ce54c578bca7e0b45d28212f77c482426699,2026-04-17T08:09:08+00:00,,6,negative,1,3,1,0,0,0,0,0,0,3,0,0
UPST,finnhub_news,Benzinga,What's Behind The Boost In Upstart Holdings Stock Today?,https://finnhub.io/api/news?id=9de7b478411321ed9a8a41b7f1dd59d3083ca3ce4d39577711d14379c4ed314c,2026-04-15T15:08:16+00:00,,6,neutral,0,0,0,0,0,0,0,0,0,0,2,0
UPST,finnhub_news,Finnhub,"CLASS ACTION NOTICE: Berger Montague Advises Upstart Holdings, Inc. (UPST) Investors to Inquire About a Securities Fraud Class Action",https://finnhub.io/api/news?id=e2ece676eeb12ebd5960e94365bc816ac4b7cd2d43d69fddf565fba625321f1b,2026-04-15T09:18:04+00:00,,6,negative,1,3,0,0,0,0,0,0,0,4,0,0
UPST,finnhub_news,Finnhub,"UPSTART HOLDINGS, INC. (UPST) DEADLINE ALERT Bernstein Liebhard LLP Reminds Upstart Holdings, Inc. Investors of Upcoming Deadline",https://finnhub.io/api/news?id=38121732ca657d0f18a4dbb7722dbc6850daf306857f8ab61bb6630d46b27927,2026-04-14T11:15:09+00:00,,6,negative,0,4,0,0,0,0,0,0,0,5,0,0
UPST,finnhub_news,Finnhub,"ATTENTION UPST INVESTORS: Contact Berger Montague About an Upstart Holdings, Inc. Class Action Lawsuit",https://finnhub.io/api/news?id=59578afb4e535a1678645501b7695b8589da50b23309d4fced65b73120e11c2d,2026-04-14T09:38:04+00:00,,6,negative,1,2,0,0,0,0,0,0,0,2,0,0
UPST,finnhub_news,Benzinga,"BTIG Reiterates Buy on Upstart Holdings, Maintains $43 Price Target",https://finnhub.io/api/news?id=29fa94057aba54a6b8f0e4c35893c67912aa4fb55b666e12a8018b80bd3646fe,2026-04-09T11:32:35+00:00,,6,neutral,0,0,0,0,0,0,0,1,0,0,2,0
UPST,finnhub_news,SeekingAlpha,Upstart: Buy The Meltdown - Compellingly Valued AI Lender With Profitable Growth,https://finnhub.io/api/news?id=b548f187dbff5f5c9feb51b0f65279dc77752beeb83b7186fddcf75956e11172,2026-04-01T09:00:57+00:00,,6,positive,3,0,1,0,0,0,1,0,1,0,0,0
UPST,finnhub_news,SeekingAlpha,Upstart: Bank Charter Is The Future,https://finnhub.io/api/news?id=f5b7724b6612ddc560d1704c2f0a06a3c82433d450733136a133414dfb68f890,2026-03-30T11:26:39+00:00,,6,neutral,1,1,0,0,1,0,0,0,0,0,0,1
UPST,finnhub_news,SeekingAlpha,I Was So Wrong About Upstart: Do Not Ignore The AI Threat,https://finnhub.io/api/news?id=7f67c38f74370405928a6dd00639ed21a969b6a026eaf9625b64d2bf341a01f9,2026-03-28T02:20:26+00:00,,6,negative,0,2,1,0,0,1,1,1,1,0,2,0
UPST,finnhub_news,Benzinga,"Mizuho Maintains Outperform on Upstart Holdings, Lowers Price Target to $51",https://finnhub.io/api/news?id=6fa8958ddc310046b707e111b8aaa5be677f8eec7b77cf6513f3b5d3a1dcdd58,2026-03-26T09:30:34+00:00,,6,positive,1,0,0,0,0,0,0,0,0,0,2,0
UPST,finnhub_news,Benzinga,"Upstart Stock Gains On BTIG Upgrade, $1B Forward-Flow Deal",https://finnhub.io/api/news?id=9204697e9be17c32976e6d3a08627592d07a265b138ea66f16f37540458dbe12,2026-03-17T09:42:58+00:00,,6,positive,2,0,0,0,1,0,0,0,0,0,2,0
UPST,finnhub_news,Benzinga,"Upstart Secures Up To $1B Loan Purchase Commitment From Eltura Capital Management, Aperture Investors, An Alternative Asset Manager And Part Of Generali Investments, And Co-Investors",https://finnhub.io/api/news?id=a8e81ea5786cfc92c01a9ac369b0643899f9735d1bdaec84a17063407a92b784,2026-03-17T08:46:45+00:00,,6,positive,1,0,0,1,2,0,1,0,0,0,0,0
UPST,finnhub_news,Benzinga,Upstart Stock Surges After BTIG Highlights Overlooked Upside,https://finnhub.io/api/news?id=8af85cf86e99b188acca435bf824dd7f94ff901d8cbabdb9f6536b569f5fdc05,2026-03-16T12:58:02+00:00,,6,positive,1,0,0,0,0,0,0,0,0,0,2,0
UPST,finnhub_news,Benzinga,Upstart shares are trading higher after BTIG upgraded the stock from Neutral to Buy.,https://finnhub.io/api/news?id=e4ff51d5beabcab411bb3a112903b703508acc673fa3c916219ddaba603f686f,2026-03-16T09:57:09+00:00,,6,positive,1,0,0,0,0,0,0,0,0,0,1,0
UPST,finnhub_news,Benzinga,This Upstart Analyst Turns Bullish; Here Are Top 5 Upgrades For Monday,https://finnhub.io/api/news?id=bbd3b69e6535032323635bd4d96b7abe3399edb52748238686b15ad13f0943e2,2026-03-16T07:26:00+00:00,,6,positive,2,0,0,0,0,0,0,0,0,0,4,0
UPST,finnhub_news,Benzinga,"BTIG Upgrades Upstart Holdings to Buy, Announces $43 Price Target",https://finnhub.io/api/news?id=9cc0d492ded47c0a88df2b5fd79399a396b99d7c4f2018c60f8e8aade9851cf8,2026-03-16T06:22:20+00:00,,6,positive,1,0,0,0,0,0,0,0,0,0,3,0
UPST,finnhub_news,SeekingAlpha,Upstart's SoFi Moment Is Here: Assessing The Impact Of A Bank Charter,https://finnhub.io/api/news?id=06bdb52228df9ba3da643164ccc4124978769c89147d9fc73ee36699b4c3ce2e,2026-03-11T15:00:01+00:00,,6,neutral,0,0,1,0,0,0,0,0,0,0,0,2
UPST,finnhub_news,Benzinga,Upstart Stock Rises On National Bank Charter Plan,https://finnhub.io/api/news?id=5b3c14d422e6e0296d74b60e303c4860f9c54b746d4eb047cbb6e1f7781d36d0,2026-03-11T10:07:34+00:00,,6,neutral,0,0,0,0,0,0,0,0,0,0,0,1
UPST,finnhub_news,Benzinga,"Needham Reiterates Buy on Upstart Holdings, Maintains $40 Price Target",https://finnhub.io/api/news?id=5489145ddb21687b5400f794fe78ab088d103a83c306befe9e4b34ae7a008f5c,2026-03-11T06:16:15+00:00,,6,neutral,0,0,0,0,0,0,0,1,0,0,2,0
UPST,finnhub_news,Benzinga,Upstart Stock Pops After The Close: Here's Why,https://finnhub.io/api/news?id=a9f1780181d94419dcb17b074ac639615b8f7d1327d1fe48f3deed7efdb355ec,2026-03-10T16:48:44+00:00,,6,neutral,0,0,0,0,0,0,0,0,0,0,0,1
UPST,finnhub_news,Benzinga,"Upstart Holdings Intends To Submit National Bank Charter Application To U.S. OCC, FDIC",https://finnhub.io/api/news?id=dac93d5283e638e02e3a646088cff736c77c5a29080a5cf73cc3f2e0cdf2e205,2026-03-10T16:11:16+00:00,,6,neutral,0,0,0,0,0,0,1,0,0,0,0,1
UPST,finnhub_news,Benzinga,"Needham Maintains Buy on Upstart Holdings, Lowers Price Target to $40",https://finnhub.io/api/news?id=9a05d2ffebfc6aca35661ff96427fba9bc27c527eb332c1c8cb489788b9e33a8,2026-03-04T06:07:23+00:00,,6,neutral,0,0,0,0,0,0,0,0,0,0,2,0
UPST,finnhub_news,SeekingAlpha,"Upstart Holdings, Inc. (UPST) Presents at Morgan Stanley Technology, Media & Telecom Conference 2026 Transcript",https://finnhub.io/api/news?id=d915913c8a3657f214876256a2ffa72cc5668759155bac057b3bfdd48dc31eac,2026-03-03T19:22:13+00:00,,6,neutral,0,0,0,0,0,0,0,0,0,0,0,0
UPST,finnhub_news,SeekingAlpha,Upstart: Well-Priced AI And Lending Play,https://finnhub.io/api/news?id=3e5091704f2394f57173b41b033a8cabca91b38b8bd2b9c5d8a3e63d3d180a2b,2026-02-25T11:31:46+00:00,,6,neutral,1,1,1,0,0,0,1,1,0,0,0,0
UPST,finnhub_news,Benzinga,Upstart Announces $333M Sale Of Upstart Auto Assets To Bayview Asset Management Affiliates,https://finnhub.io/api/news?id=c7125dddd01a5293f934be982a75e85c2ac791c020a186dcbff8459fff807cff,2026-02-20T09:10:51+00:00,,6,neutral,0,0,0,0,0,0,0,0,0,0,0,0
UPST,finnhub_news,Yahoo,"Compass Point Upgrades Upstart (UPST) to Neutral, Ups PT to $30 Citing Ambitious 2028 Outlook",https://finnhub.io/api/news?id=aab4f1d23e09d05d3624261c894892bb1fef1c9d4e84dda12d9427e8572246ed,2026-02-20T00:28:19+00:00,,6,positive,2,0,1,0,0,0,0,0,0,0,3,0
UPST,finnhub_news,Yahoo,Upstart Repurchases $100 Million of Shares,https://finnhub.io/api/news?id=f81a354512853ce9da625f59136d5bf5a997d3c8eac0f62362787193f8414338,2026-02-19T12:55:00+00:00,,6,positive,1,0,0,0,0,0,0,0,0,0,0,0
UPST,finnhub_news,Yahoo,"Upstart President to Participate in Fireside Chat at the Morgan Stanley Technology, Media & Telecom Conference",https://finnhub.io/api/news?id=dd7db6d25eea868ddf566f9746c64fcbd9369bff1697f92f474509f5226147cc,2026-02-18T21:05:00+00:00,,6,neutral,0,0,0,0,0,0,0,0,0,0,0,0
UPST,finnhub_news,Yahoo,"Here is What to Know Beyond Why Upstart Holdings, Inc. (UPST) is a Trending Stock",https://finnhub.io/api/news?id=bac35b07acdcabe6f7d9328d04b7af27aa1f75e7e98a0342bbfb41a6e1af248b,2026-02-18T14:00:04+00:00,,6,neutral,0,0,0,0,0,0,0,0,0,0,0,0
UPST,finnhub_news,Benzinga,"Citizens Reiterates Market Underperform on Upstart Holdings, Maintains $20 Price Target",https://finnhub.io/api/news?id=14b1ce1855508ea8cc93d0bbf8ce4f3fb152925879be0e166e3df7b1fab659f2,2026-02-18T10:34:42+00:00,,6,neutral,0,0,0,0,0,0,0,1,0,0,2,0
UPST,finnhub_news,SeekingAlpha,Upstart's Technology Has Taken The Next Step (Rating Upgrade),https://finnhub.io/api/news?id=3f4a5fb8b315fcd7e01811510c120420c3542624bc08ef64f50eee386648651a,2026-02-18T09:05:47+00:00,,6,positive,1,0,0,0,0,0,0,0,0,0,2,0
UPST,finnhub_news,Yahoo,Upstart Launches Cash Line As Paul Gu Takes Helm And Valuation Lags,https://finnhub.io/api/news?id=b49d5a4d07a86ea2db6ff01007eb788d5fd642be97cd5920db167388169f90dd,2026-02-18T07:08:27+00:00,,6,positive,1,0,0,0,0,0,0,0,0,0,1,0
UPST,finnhub_news,Yahoo,Prediction: Upstart Stock Is Going to Double by the End of 2026,https://finnhub.io/api/news?id=8eaea12edff2ece56024d08be821c3403bfaa194dd9afa18d31e013445bf6baa,2026-02-17T22:33:00+00:00,,6,neutral,0,0,0,0,0,0,0,0,0,0,0,0
UPST,finnhub_news,Yahoo,"Upstart (UPST) Stock Trades Up, Here Is Why",https://finnhub.io/api/news?id=38864b785464a3d0ae141e04569515fc932fcdf8ceeedec3593fded782d58c9a,2026-02-17T19:00:58+00:00,,6,positive,1,0,0,1,0,0,1,0,0,0,2,0
UPST,finnhub_news,Yahoo,"Upstart Announces Cash Line, Bringing Always-On Credit to Millions of Americans",https://finnhub.io/api/news?id=00e11ae0683b82e0f62435c3a6e035cc8f4a94ba45fc294edd82c200707928b5,2026-02-17T15:45:00+00:00,,6,neutral,0,0,0,0,0,0,1,0,0,0,0,0
UPST,finnhub_news,Benzinga,"Compass Point Upgrades Upstart Hldgs to Neutral, Raises Price Target to $30",https://finnhub.io/api/news?id=37b93c863305e499492aa8a0f1ba36ea6b3d2167df3d225c1e47e05cad7186d3,2026-02-17T10:30:20+00:00,,6,positive,1,0,0,0,0,0,0,0,0,0,3,0
UPST,finnhub_news,Yahoo,5 Must-Read Analyst Questions From Upstart’s Q4 Earnings Call,https://finnhub.io/api/news?id=7a7a23908d7705241f5a27fddeafd6616d965ba4cce49c50eece16828d361c03,2026-02-17T05:32:00+00:00,,6,positive,3,0,5,3,0,0,2,0,2,0,2,0
UPST,finnhub_news,Yahoo,68% Gap Opens Between Upstart (UPST) Price and Wall Street Targets After Earnings Selloff,https://finnhub.io/api/news?id=56d0d64c1cc707cb44d84ea16455ff9a6c3b34bc77c48b9b537d7c7f9bb7a210,2026-02-16T19:22:10+00:00,,6,positive,1,0,5,1,0,0,0,0,0,0,0,0
UPST,finnhub_news,SeekingAlpha,Upstart: A Directional Bet On Falling Rates,https://finnhub.io/api/news?id=3fa6e7dd7bab1fc6ff0d62e58b85d818b845d7c3d50213195fc94db4c5ef7f8b,2026-02-13T21:16:24+00:00,,6,positive,5,0,3,1,0,0,0,1,0,0,0,0
UPST,finnhub_news,Benzinga,"Goldman Sachs Upgrades Upstart Hldgs to Neutral, Lowers Price Target to $35",https://finnhub.io/api/news?id=06bc6628887d59c409cefb389ddcfe47a6355784b660532adbf43455f8277c43,2026-02-13T13:46:38+00:00,,6,positive,1,0,0,0,0,0,0,0,0,0,3,0
UPST,finnhub_news,Benzinga,"Citizens Downgrades Upstart Hldgs to Market Underperform, Announces $20 Price Target",https://finnhub.io/api/news?id=2d0cf2da279658ee7f8d78006783e12f185a556406565d03f73b0d96d0a301f5,2026-02-13T08:40:55+00:00,,6,negative,0,1,0,0,0,0,0,0,0,0,3,0
UPST,finnhub_news,Benzinga,"Upstart Holdings shares are trading lower after the company reported Q4 financial results. Also, Truist maintained a Buy rating on the stock and lowered its price target from $59 to $49.",https://finnhub.io/api/news?id=9c019633f41afc02e42dfdd95c253d55a9ccf810bd68a5de9d679e5ac9b258ee,2026-02-11T15:37:16+00:00,,6,neutral,0,0,0,0,0,0,0,0,0,0,2,0
UPST,finnhub_news,Benzinga,"Needham Reiterates Buy on Upstart Hldgs, Maintains $56 Price Target",https://finnhub.io/api/news?id=210fc4d590f694083bf7807e30652c1649e467430d1d3ef04ecc26344a0edb99,2026-02-11T08:40:31+00:00,,6,neutral,0,0,0,0,0,0,0,1,0,0,2,0
UPST,finnhub_news,Benzinga,"Truist Securities Maintains Buy on Upstart Hldgs, Lowers Price Target to $49",https://finnhub.io/api/news?id=3644434c8619255ba623d61c1c175ff1154a711a4f6695de342c1f4f476c47ab,2026-02-11T08:30:01+00:00,,6,neutral,0,0,0,0,0,0,0,0,0,1,2,0
UPST,finnhub_news,ChartMill,"Upstart Holdings Inc (NASDAQ:UPST) Reports Q4 Earnings Beat and Strong 2026 Outlook, Sparking Share Rally",https://finnhub.io/api/news?id=7536ad46da7c75e790296d133e9fe7b6f2c6bc594477d398e0e2320f9da90886,2026-02-10T23:25:59+00:00,,6,positive,3,0,5,0,0,0,0,0,1,0,0,0
UPST,finnhub_news,SeekingAlpha,"Upstart Holdings, Inc. 2025 Q4 - Results - Earnings Call Presentation",https://finnhub.io/api/news?id=93f4c66e7ba8b6a4ef7f74b26b43b45f2dbec74f3f22f60483aff609a2970de3,2026-02-10T22:01:02+00:00,,6,neutral,0,0,1,0,0,0,0,0,0,0,0,0
UPST,finnhub_news,SeekingAlpha,"Upstart Holdings, Inc. (UPST) Q4 2025 Earnings Call Transcript",https://finnhub.io/api/news?id=5c69401485407b60e717ee53ad4e6b65e6ece6ff1c740e902c5f3a3a3736a5e9,2026-02-10T18:54:22+00:00,,6,neutral,0,0,1,0,0,0,0,0,0,0,0,0
UPST,finnhub_news,Benzinga,"UPDATE: Upstart Hldgs Q4 Adj. EPS $0.46, Inline, Sales $296.090M Beat $288.673M Estimate. Adj. EPS excludes Stock Based Compensation of $0.29 per share.",https://finnhub.io/api/news?id=4c7519ccf78c4e511ca37004720a3c6080fe02a64e3ce15b083578a908e4cb43,2026-02-10T18:04:48+00:00,,6,neutral,1,1,6,0,0,0,0,0,0,0,1,0
UPST,finnhub_news,Benzinga,Upstart Hldgs Q4 Earnings Assessment,https://finnhub.io/api/news?id=b981ef507fa598b654fb8f6909bd6b9f0715758b56c2a5a89f2e465fb897d11c,2026-02-10T17:52:13+00:00,,6,neutral,0,0,1,0,0,0,0,0,0,0,0,0
UPST,finnhub_news,Benzinga,Upstart Stock Climbs After Q4 Earnings: Here's Why,https://finnhub.io/api/news?id=b310c03df09f738db9082f3a68ebf3186bb8c6ac5a9511e383f1bd011e8ffd72,2026-02-10T17:45:13+00:00,,6,neutral,0,0,1,0,0,0,0,0,0,0,0,0
UPST,finnhub_news,Benzinga,Upstart Holdings shares are trading higher after the company reported better-than-expected Q4 financial results and issued FY26 sales guidance above estimates.,https://finnhub.io/api/news?id=a9c5e620737cfac88b15f859de5d222d6659e6a2f51055b295846238a13f623a,2026-02-10T17:19:30+00:00,,6,neutral,0,0,2,0,0,0,0,0,0,0,0,0
UPST,finnhub_news,Benzinga,Upstart Hldgs Sees FY2026 Sales $1.400B vs $1.273B Est,https://finnhub.io/api/news?id=be14a19425a41ac32d579d0ed54d1add616a1a83cf64d7d91ceafe0ae46edeb8,2026-02-10T17:15:11+00:00,,6,neutral,0,0,1,0,0,0,0,0,0,0,1,0
UPST,finnhub_news,Benzinga,"Upstart Hldgs Q4 GAAP EPS $0.17 Beats $0.15 Estimate, Sales $296.090M Beat $288.673M Estimate",https://finnhub.io/api/news?id=f969644078dd95d35e39d6bf6cd1d2066bc205ba7011184fbff6157f5cb69a30,2026-02-10T17:14:14+00:00,,6,neutral,1,1,6,0,0,0,0,0,0,0,1,0
UPST,finnhub_news,Benzinga,Upstart Hldgs Earnings Review: Q4 Summary,https://finnhub.io/api/news?id=1c867578fee9aed569afba6edd0e9e3f58de4aa284cf6813939c0d1580d205ee,2026-02-10T17:14:07+00:00,,6,neutral,0,0,1,0,0,0,0,0,0,0,0,0
UPST,finnhub_news,Benzinga,Upstart Stock Is Trending Ahead Of Q4 Earnings: What To Know,https://finnhub.io/api/news?id=6e51688b9b168a107b5dba1d7653d0075375914c8cc5d7d18316bfc5e16aec54,2026-02-10T12:10:04+00:00,,6,neutral,0,0,2,0,0,0,0,0,0,0,0,0
UPST,finnhub_news,Benzinga,Upstart Hldgs Unusual Options Activity,https://finnhub.io/api/news?id=771fde60974157982e9a497c7705c1081cdc1ef370cee398286e8bceb8687408,2026-02-03T16:00:41+00:00,,6,neutral,0,0,0,0,0,0,0,0,0,0,0,0
UPST,gdelt_news,pr-inside.com,Pomerantz LLP Moves to File Class Action Litigation Against Upstart ... ,https://www.pr-inside.com/pomerantz-llp-moves-to-file-class-action-litigation-against-upstart-r5183701.htm,20260501T224500Z,,6,negative,0,1,0,0,0,0,0,0,0,1,0,0
UPST,gdelt_news,pr-inside.com,"Pomerantz LLP Moves to File Class Action Lawsuit Against Upstart Holdings , ... ",https://www.pr-inside.com/pomerantz-llp-moves-to-file-class-action-lawsuit-against-upstart-holdings-r5183248.htm,20260430T043000Z,,6,negative,0,2,0,0,0,0,0,0,0,2,0,0
UPST,gdelt_news,stockhouse.com,"2026 - 04 - 29 | UPST INVESTOR REMINDER : Upstart Holdings , Inc . Investors Have Until June 8 , 2026 To Seek Lead Plaintiff Role - Contact Kirby McInerney LLP | NDAQ : UPST",https://stockhouse.com/news/press-releases/2026/04/29/upst-investor-reminder-upstart-holdings-inc-investors-have-until-june-8-2026-to,20260429T223000Z,,6,neutral,0,0,0,0,0,0,0,0,0,0,0,0
UPST,gdelt_news,pr-inside.com,"UPST SHAREHOLDER ALERT : Bronstein , Gewirtz and Grossman , LLC Announces ... ",https://www.pr-inside.com/upst-shareholder-alert-bronstein-gewirtz-and-grossman-llc-announces-r5182665.htm,20260427T120000Z,,6,neutral,0,0,0,0,0,0,0,0,0,0,0,0
UPST,gdelt_news,pr-inside.com,"Pomerantz LLP Brings Class Action Lawsuit Against Upstart Holdings , ... ",https://www.pr-inside.com/pomerantz-llp-brings-class-action-lawsuit-against-upstart-holdings-r5182567.htm,20260427T011500Z,,6,negative,0,2,0,0,0,0,0,0,0,2,0,0
UPST,gdelt_news,pr-inside.com,"UPST INVESTOR ALERT : Bronstein , Gewirtz and Grossman , LLC Announces ... ",https://www.pr-inside.com/upst-investor-alert-bronstein-gewirtz-and-grossman-llc-announces-r5182479.htm,20260426T140000Z,,6,neutral,0,0,0,0,0,0,0,0,0,1,0,0
UPST,gdelt_news,stockhouse.com,"2026 - 04 - 25 | UPST INVESTOR DEADLINE APPROACHING : Faruqi & Faruqi , LLP Reminds Upstart ( UPST ) Investors of Securities Class Action Deadline on June 8 , 2026 | NDAQ : UPST",https://stockhouse.com/news/press-releases/2026/04/25/upst-investor-deadline-approaching-faruqi-faruqi-llp-reminds-upstart-upst,20260425T124500Z,,6,negative,0,2,0,0,0,0,0,0,0,3,0,0
UPST,gdelt_news,prnewswire.com,"UPST Stockholders Have Rights - If You Lost Money Investing in Upstart Holdings , Inc . Contact Robbins LLP for Information About Recovering Your Losses",http://www.prnewswire.com/news-releases/upst-stockholders-have-rights--if-you-lost-money-investing-in-upstart-holdings-inc-contact-robbins-llp-for-information-about-recovering-your-losses-302752373.html,20260424T013000Z,,6,negative,0,1,1,0,0,0,0,0,0,0,0,0
UPST,gdelt_news,pr-inside.com,Pomerantz Law Firm Announces The Filing of a Class Action Against Upstart ... ,https://www.pr-inside.com/pomerantz-law-firm-announces-the-filing-of-a-class-action-against-upstart-r5182120.htm,20260424T001500Z,,6,negative,0,1,0,0,0,0,0,0,0,1,0,0
UPST,gdelt_news,finance.yahoo.com,Can Upstart Holdings ( UPST ) Double in the Next 5 Years ? ,https://finance.yahoo.com/markets/stocks/articles/upstart-holdings-upst-double-next-113631489.html,20260422T121500Z,,6,neutral,0,0,0,0,0,0,0,0,0,0,0,0
UPST,gdelt_news,pr-inside.com,Pomerantz LLP Announces The Filing of a Class Action Against Upstart ... ,https://www.pr-inside.com/pomerantz-llp-announces-the-filing-of-a-class-action-against-upstart-r5181447.htm,20260420T224500Z,,6,negative,0,1,0,0,0,0,0,0,0,1,0,0
UPST,gdelt_news,pr-inside.com,Pomerantz LLP Announces Securities Class Action Lawsuit Against Upstart ... ,https://www.pr-inside.com/pomerantz-llp-announces-securities-class-action-lawsuit-against-upstart-r5181071.htm,20260419T000000Z,,6,negative,0,2,0,0,0,0,0,0,0,3,0,0
UPST,gdelt_news,pr-inside.com,"UPST INVESTOR ALERT : Bronstein , Gewirtz and Grossman , LLC Announces ... ",https://www.pr-inside.com/upst-investor-alert-bronstein-gewirtz-and-grossman-llc-announces-r5180641.htm,20260416T120000Z,,6,neutral,0,0,0,0,0,0,0,0,0,1,0,0
UPST,gdelt_news,insidermonkey.com,"Upstart Holdings ( UPST ) Nears Q1 Earnings , Jumps 13 % ",https://www.insidermonkey.com/blog/upstart-holdings-upst-nears-q1-earnings-jumps-13-1739139/,20260416T021500Z,,6,neutral,0,0,2,0,0,0,0,0,0,0,0,0
UPST,gdelt_news,markets.financialcontent.com,FinancialContent - The AI Execution Gap : Upstart and Duolingo Face Crucial May Earnings Test Amid Strategic Pivots,https://markets.financialcontent.com/stocks/article/marketminute-2026-4-9-the-ai-execution-gap-upstart-and-duolingo-face-crucial-may-earnings-test-amid-strategic-pivots,20260409T191500Z,,6,neutral,0,0,1,0,0,0,1,0,0,0,0,0
UPST,gdelt_news,insidermonkey.com,Upstart Holdings ( UPST ) Could Double From Here According To Mizuho Securities,https://www.insidermonkey.com/blog/upstart-holdings-upst-could-double-from-here-according-to-mizuho-securities-1733303/,20260407T154500Z,,6,neutral,0,0,0,0,0,0,0,0,0,1,0,0
