ticker,source_type,source,title,url,published_at,engagement,relevance_score,tone,positive_hits,negative_hits,earnings_profitability,nii_margin_rates,credit_risk_provisions,investment_banking_markets,consumer_cards_deposits,dimond_ceo_governance,regulation_capital,capital_return_buyback,ai_technology_fintech,valuation_defensive_bank,macro_geopolitical
JPM,finnhub_news,Yahoo,JPMorgan Chase & Co. Q1 2026 Earnings Call Summary,https://finnhub.io/api/news?id=781d714153760d670f0c93f2e3d8916574bd052026f11123c8f768b2162ecf26,2026-04-14 20:46:54+00:00,,7,neutral,0,0,2,0,0,0,0,0,0,0,0,0,0
JPM,finnhub_news,Yahoo,"JPMorgan's Dimon talks recession prep, cybersecurity, private credit",https://finnhub.io/api/news?id=8e45642ec8cce2817f5c2ea3addafba45a61be334ae78f48f17986e95f3bdc77,2026-04-14 18:17:58+00:00,,17,neutral,0,0,1,0,2,0,0,3,0,0,1,0,1
JPM,finnhub_news,Finnhub,JPMorgan Chase : 2026 Proxy Supplemental Presentation (14 pgs) (2026 proxy supplement),https://finnhub.io/api/news?id=c6e48a656d49763ec4c80be9e9b3cbefe4a6e4c48a5e5e47d3d8fe87a3f4c3d5,2026-04-14 17:02:12+00:00,,6,neutral,0,0,0,0,0,0,0,0,0,0,0,0,0
JPM,finnhub_news,Yahoo,JPMorgan Chase Raises Dividend 7.1% And Stock Has Room To Run,https://finnhub.io/api/news?id=df4ae2cf52686b758937e5f95887abda14973fb77ffa51d0dff276a03a8ed4bf,2026-04-14 16:56:57+00:00,,10,positive,1,0,0,0,0,0,0,0,0,2,0,0,0
JPM,finnhub_news,Yahoo,JP Morgan's Dimon Says a 'Complex Set of Risks' Threatens a Strong US Economy,https://finnhub.io/api/news?id=308d751978a9a17c39734564957ff94ebb6efb8d53421ef44418d0948bd83f6b,2026-04-14 16:18:47+00:00,,17,positive,1,0,0,0,0,0,0,3,0,0,0,0,1
JPM,finnhub_news,Yahoo,"Jim Cramer Notes “JPMorgan’s a Terrific Bank, But It Has a Gazillion Important Inputs to Its Quarter”",https://finnhub.io/api/news?id=2111fe57974fb77cabd6b529cb3287c365c598b46e948f48f2814bb4b961ca2a,2026-04-14 15:44:08+00:00,,10,neutral,0,0,2,0,0,0,0,0,0,0,0,0,0
JPM,gdelt_news,benzinga.com,JPMorgan Q1 2026 Earnings Call Transcript - JPMorgan Chase ( NYSE : JPM ) ,https://www.benzinga.com/markets/earnings/26/04/51807115/jpmorgan-q1-2026-earnings-call-transcript,2026-04-14 15:30:00+00:00,,10,neutral,0,0,2,0,0,0,0,0,0,0,0,0,0
JPM,finnhub_news,SeekingAlpha,JPMorgan Chase & Co. (JPM) Q1 2026 Earnings Call Transcript,https://finnhub.io/api/news?id=62846e9a5d44ee3cfda78f709ca838f77eadc5289f11e3f7ede38e63bade6d12,2026-04-14 15:01:45+00:00,,14,neutral,0,0,2,0,0,0,0,1,0,0,0,0,0
JPM,finnhub_news,Yahoo,JPMorgan Chase & Co. Q1 Earnings Call Highlights,https://finnhub.io/api/news?id=ca2881893d34f5941b04ac56281edb5f25afd85ce78eac5acee774408bf69751,2026-04-14 14:50:03+00:00,,11,neutral,0,0,4,0,0,0,0,0,1,0,0,0,0
JPM,finnhub_news,Yahoo,JPMorgan CEO Jamie Dimon downplays private credit concerns: 'Not particularly worried',https://finnhub.io/api/news?id=17b530cc6d4be014847456ccf5ec86d9d58afa7186999ecd1c8d15512ce0aeaf,2026-04-14 14:34:01+00:00,,11,negative,0,1,0,0,1,0,0,3,0,0,0,0,0
JPM,finnhub_news,Finnhub,JPMorgan throws its weight behind Trump administration's push to scrap quarterly reporting,https://finnhub.io/api/news?id=0fa01faeb362f9aad9e30971915b3dcfd5430b51b51b2efd9818ab4433b671de,2026-04-14 14:14:20+00:00,,7,neutral,0,0,0,0,0,0,0,0,1,0,0,0,0
JPM,finnhub_news,Yahoo,"JPMorgan's Q1 Earnings Beat on Strong Markets, Robust IB & Higher NII",https://finnhub.io/api/news?id=0a94428644b7a69b3ef07f35e356e4806eb713de13b5e2ac170f7af58d66fc38,2026-04-14 14:01:00+00:00,,10,positive,4,0,4,1,0,0,0,0,0,0,0,0,0
JPM,finnhub_news,Yahoo,"JPMorgan, Wells Fargo, BlackRock: Bank earnings takeaways",https://finnhub.io/api/news?id=5cc7ae558c75a57c8945398d7b295ff2ac81c94ad9be5ea1a6acc4f2fb691657,2026-04-14 13:55:46+00:00,,7,positive,1,0,2,0,0,0,0,0,0,0,0,0,0
JPM,finnhub_news,Yahoo,JPMorgan Chase & Co. (JPM) Q1 Earnings: How Key Metrics Compare to Wall Street Estimates,https://finnhub.io/api/news?id=f9f0e7093bee1fa68f0daaa929d69d028434a221a668da227140814631b4b002,2026-04-14 13:30:03+00:00,,10,neutral,0,0,3,0,0,0,0,0,0,0,0,0,0
JPM,finnhub_news,Yahoo,JPMorgan Beats First-Quarter Estimates; CEO Dimon Warns of 'Increasingly Complex' Risks to Economy,https://finnhub.io/api/news?id=de3ca7bf7bf571eff0117728745535399de5d52b91e7e6e7e01802a92e9fc2a2,2026-04-14 13:12:23+00:00,,15,positive,1,0,2,0,0,0,0,2,0,0,0,0,1
JPM,finnhub_news,Yahoo,"JPMorgan Says U.S. Consumer Remains Healthy, but Dimon Warns About Risks",https://finnhub.io/api/news?id=c15f0540f00fcaa23cb8b3d74430e2a9067f00d3a79071080f3d2644b23b3eec,2026-04-14 12:47:00+00:00,,9,positive,1,0,0,0,0,0,1,2,0,0,0,0,1
JPM,finnhub_news,CNBC,Jamie Dimon says Anthropic's Mythos reveals 'a lot more vulnerabilities' for cyberattacks,https://finnhub.io/api/news?id=805a2f2ae5f8d0e4531219a7669aea330c6841438dad2e9ae6bd9324f069bc78,2026-04-14 12:46:10+00:00,,8,neutral,0,0,0,0,0,0,0,2,0,0,1,0,0
JPM,finnhub_news,Yahoo,"JPMorgan Posted a Blowout Quarter, Jamie Dimon Is Already Worried",https://finnhub.io/api/news?id=750bf039fd59886c2f9514d3e206afa8a3996b2ab683cb5473b77910746315fc,2026-04-14 12:40:58+00:00,,11,neutral,0,0,1,0,0,0,0,3,0,0,0,0,0
JPM,finnhub_news,Yahoo,JPMorgan Beats but Shares Slip as Dimon Flags Risks,https://finnhub.io/api/news?id=cb6288efdaaa41bec6cbe7bc84ba58df5185521c2470d8667dc769a0fd56052c,2026-04-14 12:24:03+00:00,,8,positive,1,0,1,0,0,0,0,1,0,0,0,0,0
JPM,finnhub_news,Finnhub,"JPMorgan's private credit exposure was at $50 billion, CFO says",https://finnhub.io/api/news?id=150772dde9b8ed3d3865c54a8778756be9fb4b649e784fc7d9780dbe35c8f92b,2026-04-14 12:14:33+00:00,,7,neutral,0,0,0,0,1,0,0,0,0,0,0,0,0
JPM,finnhub_news,Yahoo,JPMorgan Chase Q1 2026 earnings beat expectations,https://finnhub.io/api/news?id=cba51f1d82bca6403c9c5d735778d3977249d69ed7b6376bbeb8b6747fe7f4c4,2026-04-14 12:04:23+00:00,,11,positive,1,0,3,1,0,1,0,0,0,0,0,0,0
JPM,finnhub_news,Yahoo,"JPMorgan Tops Estimates. CEO Jamie Dimon Sees Economic Tailwinds, Risks.",https://finnhub.io/api/news?id=d208cc9f539394f81a4bc460a60de19a8678ba97ed7319641fb4c144482d200c,2026-04-14 11:59:19+00:00,,14,neutral,0,0,1,0,0,0,0,3,0,0,0,0,0
JPM,finnhub_news,Yahoo,"Stock Market Movers: JPMorgan, Oracle, Bloom Energy, Credo Technology, American Airlines",https://finnhub.io/api/news?id=fe278380e1823aa8b7e4c6e556cfb37ffd0430db65ecbf299cb79dc3b5a15e82,2026-04-14 11:55:11+00:00,,7,neutral,0,0,0,0,0,0,0,0,0,0,1,0,0
JPM,finnhub_news,Yahoo,JPMorgan Chase & Co. (JPM) Q1 Earnings and Revenues Beat Estimates,https://finnhub.io/api/news?id=92c05a65063fbc3b9393065981a872c39e209700ba15da5afe7400f0ea24e9a9,2026-04-14 11:45:01+00:00,,10,positive,1,0,5,0,0,0,0,0,0,0,0,0,0
JPM,finnhub_news,Yahoo,JPMorgan Traders Notch Record Revenue During Volatile Quarter,https://finnhub.io/api/news?id=ef9dcef5d717ad6772f34160f7081f0c12119aa144eeebb04a4b0837b275b2ec,2026-04-14 11:38:20+00:00,,5,positive,1,0,2,0,0,1,0,0,0,0,0,0,0
JPM,finnhub_news,ChartMill,JPMorgan Chase & Co (NYSE:JPM) Reports Q1 2026 Earnings Beat with Strong Revenue and EPS,https://finnhub.io/api/news?id=7bfaaf68fda46e14962a55d2876d43ede7b10e097eac7de758263ba0b74615ee,2026-04-14 11:20:31+00:00,,10,positive,2,0,5,0,0,0,0,0,0,0,0,0,0
JPM,finnhub_news,Yahoo,Jamie Dimon Warns of 'Complex Set of Risks' Facing Economy,https://finnhub.io/api/news?id=f1544f93774d139dd5e04b90875c20288f46afe3c2fa49808d978a0a6af21b05,2026-04-14 11:13:21+00:00,,12,neutral,0,0,2,0,0,0,0,2,0,0,0,0,1
JPM,finnhub_news,Yahoo,JPMorgan Chase (NYSE:JPM) Posts Better-Than-Expected Sales In Q1 CY2026,https://finnhub.io/api/news?id=e51f8915562f890c1c9900fdd450b11b23ac82c2b57f0571206481a08e0c7604,2026-04-14 11:01:43+00:00,,10,positive,1,0,4,0,0,0,0,0,0,0,0,0,0
JPM,finnhub_news,Yahoo,JPMorgan Reports Higher Profit and Revenue as Economy Chugs Along,https://finnhub.io/api/news?id=2f432c3512cb7782c573dbec30b5f5c2c65417b8835843e31aac6ca24ddfd62f,2026-04-14 10:59:00+00:00,,15,positive,2,0,3,0,0,0,0,2,0,0,0,0,2
JPM,finnhub_news,Yahoo,JPMorgan CEO Dimon Warns of ‘Elevated Asset Prices' but Says U.S. Economy Is ‘Resilient’,https://finnhub.io/api/news?id=46b4d0f909cbca8e6e7ff765393aa2afd770cf49e543f17df2b7209829dea37c,2026-04-14 10:57:38+00:00,,15,neutral,0,0,1,0,0,0,0,3,0,0,0,0,2
JPM,finnhub_news,Yahoo,JPMorgan and other big banks see profits rise  as Dimon warns of 'increasingly complex set of risks',https://finnhub.io/api/news?id=462e9fd22ecff73488a721da2d6c5f6de8fed6f0221e8b8a77bbaf236d5e4ef2,2026-04-14 10:57:17+00:00,,11,neutral,0,0,1,0,0,0,0,1,0,0,0,0,0
JPM,finnhub_news,Yahoo,JPMorgan profits rise 13% as Dimon warns of 'increasingly complex set of risks',https://finnhub.io/api/news?id=6863ca4bc0286bf77c62e8bf97c78cddf41186451e97271417f5e06a5ce01d4f,2026-04-14 10:57:17+00:00,,11,neutral,0,0,1,0,0,0,0,1,0,0,0,0,0
JPM,finnhub_news,Benzinga,JPMorgan Q1 2026 Earnings Call Transcript,https://finnhub.io/api/news?id=ab039590789984cf5c872ed82d9b1d9e2d14dd16a483ac4b6143b2c642c39988,2026-04-14 10:44:51+00:00,,7,neutral,0,0,4,0,0,0,0,0,0,0,0,0,0
JPM,finnhub_news,Yahoo,"JPMorgan’s Profit Rises 13%, Tops Wall Street Expectations",https://finnhub.io/api/news?id=ba6e85b570b266b67d1ecf17c01a222f2f4d38e57c039c4eb0c0abdab8755592,2026-04-14 10:43:15+00:00,,7,positive,1,0,3,0,0,0,0,0,0,0,0,0,0
JPM,finnhub_news,Yahoo,JPMorganChase Reports First-Quarter 2026 Financial Results,https://finnhub.io/api/news?id=1b34103ef442c464fd10248a49a50dfcb63a41c4cff2ba206010cd85c507ddfd,2026-04-14 10:37:00+00:00,,7,neutral,0,0,3,0,0,0,0,0,0,0,0,0,0
JPM,finnhub_news,Finnhub,"Transcript : JPMorgan Chase & Co., Q1 2026 Earnings Call, Apr 14, 2026",https://finnhub.io/api/news?id=82908a78c8acee8ee84969cb2354ef1c12014d30dcd4e5fce22bddad7995db9f,2026-04-14 10:20:20+00:00,,7,neutral,0,0,3,0,0,0,0,0,0,0,0,0,0
JPM,finnhub_news,Benzinga,"US Economy Stays Resilient, But 'Significant Risks' Are Building Fast, Jamie Dimon Warns",https://finnhub.io/api/news?id=98062ae0750660238be09ea790e92525c3b8a5fcf91320f4e3f0bc9c5aa4d2d3,2026-04-14 10:14:05+00:00,,13,positive,2,0,2,0,0,0,1,2,0,0,0,0,2
JPM,finnhub_news,Finnhub,"JPMorgan Chase & Co. Reports Earnings Results for the First Quarter Ended March 31, 2026",https://finnhub.io/api/news?id=80a225d7f6d77b0d76f3e4064c37e7481391cdb4114557c1ebfc28b2ad6050c7,2026-04-14 09:37:27+00:00,,10,neutral,0,0,3,2,0,0,0,0,0,0,0,0,0
JPM,finnhub_news,SeekingAlpha,JPMorgan Chase & Co. 2026 Q1 - Results - Earnings Call Presentation,https://finnhub.io/api/news?id=40d361b68d6c15d219e14a495f4b531b74c4f9f23be7dcdba4915ac93fee5368,2026-04-14 09:01:38+00:00,,7,neutral,0,0,3,0,0,0,0,0,0,0,0,0,0
JPM,finnhub_news,Benzinga,"JP Morgan CFO Jeremy Barnum Says This Persistent U.S. GSIB Surcharge Is Obviously Bad For International Competitiveness; Says Consumer Spend Growth Is Continuing Above Last Year's Pace; Client Engagements And Investment Banking Pipelines Remain Healthy;  Developments In The Middle East Could Have An Impact On Deal Execution And Timing; Says I'd Be More Worried About When There's A Credit Cycle, How's That Going To Filter Through The Whole System",https://finnhub.io/api/news?id=f704ea37d40314a5565b22b941b78e8e6b9296c42e6971f1c808761c6dee50bb,2026-04-14 08:59:46+00:00,,8,positive,1,0,0,0,2,2,1,0,0,0,0,0,0
JPM,finnhub_news,Finnhub,JPMorgan Traders Post Highest-Ever Quarterly Revenue,https://finnhub.io/api/news?id=82e70a0d80cc0fc6b97230ab1603a455f03a43f133543c7d7c10f17ca50ae135,2026-04-14 07:41:29+00:00,,10,positive,1,0,3,0,0,1,0,0,0,0,0,0,0
JPM,finnhub_news,Finnhub,JPMorgan Chase : JPMC&Co. 2026 Proxy Statement,https://finnhub.io/api/news?id=d6a5aa89d23f686532531dec34361d63f1d545b52f484161b4b852eb4364c071,2026-04-14 07:30:14+00:00,,6,neutral,0,0,0,0,0,0,0,0,0,0,0,0,0
JPM,finnhub_news,Finnhub,JPMorgan posts Q1 NII $25.5 bln,https://finnhub.io/api/news?id=06884da1a044fa5478896e990bbee3991dddcb61b5e18ca01f894c38a3d4a4ed,2026-04-14 07:11:50+00:00,,15,neutral,0,0,2,1,3,0,0,0,0,0,0,0,0
JPM,finnhub_news,Finnhub,JPMorgan expects 2026 net interest income to be about $103 billion,https://finnhub.io/api/news?id=74d7291907d1af1839a7ca6ecb5e40ae5e4fcc96bb567597e1a1f504b4a87d69,2026-04-14 07:10:08+00:00,,11,neutral,0,0,0,3,0,0,0,0,0,0,0,0,0
JPM,finnhub_news,Finnhub,JPMorgan Chase : 1Q26 Earnings Press Release,https://finnhub.io/api/news?id=436f8b77e8eee7084d45685d7095fc5f783f1fde1ba54baee56775716ffd9346,2026-04-14 06:50:09+00:00,,10,neutral,0,0,2,0,0,0,0,0,0,0,0,0,0
JPM,finnhub_news,CNBC,"Stocks making the biggest moves premarket: Novo Nordisk, JPMorgan Chase, United Airlines & more",https://finnhub.io/api/news?id=fc4067e5b91f986c3bb6c088c532da21e82404b871c12c52977337a7a0be01c7,2026-04-14 06:49:56+00:00,,6,neutral,0,0,0,0,0,0,0,0,0,0,0,0,0
JPM,finnhub_news,CNBC,JPMorgan Chase tops earnings estimates,https://finnhub.io/api/news?id=750cc4a3faeed24b0b479f46f0fbce65f78527c98010ec13fc8a5b9195db699f,2026-04-14 06:48:29+00:00,,7,neutral,0,0,2,0,0,0,0,0,0,0,0,0,0
JPM,finnhub_news,Benzinga,"JPMorgan's Jamie Dimon Sees Increasingly Complex Set Of Risks, Such As Geopolitical Tensions And Wars, Energy Price Volatility, Trade Uncertainty, Large Global Fiscal Deficits, Elevated Asset Prices",https://finnhub.io/api/news?id=b76307dd127c0914e771a0e276a208c1cb2cf8851a1ccf5bf3a0ac4aa969eed1,2026-04-14 06:47:18+00:00,,11,neutral,0,0,0,0,0,0,0,2,0,0,0,0,1
JPM,reddit_post,ValueInvesting,I've never seen bank stocks at these valuations,https://www.reddit.com/r/ValueInvesting/comments/1sj0suv/ive_never_seen_bank_stocks_at_these_valuations/,2026-04-12 01:23:57+00:00,310.0,5,negative,0,1,1,0,0,0,0,0,0,0,0,0,0
JPM,finnhub_news,Yahoo,"JPMorgan Chase CEO Jamie Dimon Just Issued a Warning to Wall Street. The Famed Banker Sees 3 Big Risks, and They Couldn't Be Any Clearer",https://finnhub.io/api/news?id=937379867eeda978ae0c3c2afe340daaac8081afc0d8cc32bb4d557022433cee,2026-04-11 17:07:00+00:00,,13,neutral,0,0,0,0,0,0,0,4,0,0,0,0,0
JPM,finnhub_news,Yahoo,"JPMorgan Chase's Continued Success Will Hinge On How Quickly It Can Integrate Blockchain, AI, CEO Jamie Dimon Says",https://finnhub.io/api/news?id=8d6ec5962ab3b181eef06ea6a99adac130a3af82936aab22c104f92cc471448f,2026-04-11 12:01:13+00:00,,17,neutral,0,0,0,0,0,0,0,3,0,0,3,0,0
JPM,finnhub_news,Yahoo,JPMorgan CEO Jamie Dimon Just Echoed Warren Buffett's Warning From 26 Years Ago,https://finnhub.io/api/news?id=b4500634c1019ecfb12c47b765b230f6ebf6041cbe56ecca624c3095859e0881,2026-04-11 06:55:00+00:00,,10,neutral,0,0,0,0,0,0,0,3,0,0,0,0,0
JPM,finnhub_news,Yahoo,Is JPMorgan (JPM) Using Frontier AI To Quietly Redefine Its Technology-Led Resilience Story?,https://finnhub.io/api/news?id=2f22e247ebb5eb08a1d53b9efcca1fd784b8eea5b69290551fe1af3f8891c7c4,2026-04-11 05:07:49+00:00,,10,neutral,0,0,0,0,0,0,0,0,0,0,3,0,0
JPM,finnhub_news,Yahoo,JPMorgan Succession And Tech Push Reshape Valuation And Growth Outlook,https://finnhub.io/api/news?id=99b51876321dc946f3ac08bd3c1de24c0d483bda1c7eb4e18ee4a10e39fc9c8b,2026-04-11 02:09:57+00:00,,19,positive,1,0,0,0,0,0,1,5,0,0,4,1,0
JPM,finnhub_news,Yahoo,"Not JPMorgan, Not Bank of America — SoFi Tops Forbes Best Banks List In The US",https://finnhub.io/api/news?id=8831f8fcb8dfe2c021fc706ae3da4d4b67afa73d4082562419a3ae15e1ae176f,2026-04-10 18:31:07+00:00,,7,neutral,1,1,0,0,0,0,0,0,0,0,1,0,0
JPM,finnhub_news,Benzinga,Here's How Much You Would Have Made Owning JPMorgan Chase Stock In The Last 15 Years,https://finnhub.io/api/news?id=22c726975679ee16f573ee97edd4e2b62532e6c108ea7485126d796ad58b4de2,2026-04-10 16:30:22+00:00,,6,neutral,0,0,0,0,0,0,0,0,0,0,0,0,0
JPM,finnhub_news,Yahoo,"The Zacks Analyst Blog Highlights JPMorgan, Citigroup and Bank of America",https://finnhub.io/api/news?id=2f8b86e63b8fda2fff7202ce3a9efe1fe4ca63cb0df97b858d30f16ff59bfc2c,2026-04-10 11:18:00+00:00,,5,positive,1,0,3,0,0,0,0,0,0,0,0,1,0
JPM,finnhub_news,Yahoo,JPMorgan Chase & Co. (JPM) – Among the 13 Bank Stocks with Highest Dividends,https://finnhub.io/api/news?id=6a7ba7f38ebb983975591db3edb7915a26ce994f6a4966e3650ffef49d90fc6e,2026-04-09 21:05:10+00:00,,10,positive,2,0,2,0,0,0,0,0,0,0,0,0,0
JPM,finnhub_news,SeekingAlpha,JPMorgan Chase: Earnings Offer Catalyst Opportunity For Shares,https://finnhub.io/api/news?id=8381f1023bb0def864590c9aaecea05c31e9ebe3576cec7143d92b634308525a,2026-04-09 15:36:27+00:00,,10,positive,2,0,2,2,0,0,0,0,0,0,0,0,0
JPM,finnhub_news,Yahoo,JPMorgan Joins Project Glasswing To Tackle AI Cyber Risks And Resilience,https://finnhub.io/api/news?id=112735452fed962802fd5957132e8875f49aadcb9685096462cc71436ff82e59,2026-04-09 15:12:41+00:00,,10,neutral,0,0,0,0,0,0,0,0,0,0,2,0,0
JPM,finnhub_news,Yahoo,Gear Up for JPMorgan Chase & Co. (JPM) Q1 Earnings: Wall Street Estimates for Key Metrics,https://finnhub.io/api/news?id=204daebad7d72be6487c1b3f24189bf37729e0205c170c4f9976993be1f9a901,2026-04-09 13:15:02+00:00,,10,neutral,0,0,3,0,0,0,0,0,0,0,0,0,0
JPM,finnhub_news,Yahoo,"Zacks Earnings Trends Highlights: JPMorgan, Citigroup and Wells Fargo",https://finnhub.io/api/news?id=fe282cc9c10fe859a30a4345e727517652d7e89f03e2b6ba639ca11fbc8886a2,2026-04-09 12:36:00+00:00,,7,neutral,1,1,3,0,0,0,0,0,0,0,0,0,0
JPM,finnhub_news,Yahoo,Is JPM a Buy Before Q1 Earnings in a Volatile Geopolitical Backdrop?,https://finnhub.io/api/news?id=15bf69740f206c1ee5e2caaedfbf36eabf8dd91954e6fc9053115efea133be57,2026-04-09 12:15:00+00:00,,12,positive,1,0,2,1,0,0,0,0,0,0,0,1,1
JPM,finnhub_news,Benzinga,How To Earn $500 A Month From JPMorgan Stock Ahead Of Q1 Earnings,https://finnhub.io/api/news?id=420ef254168c5cd24e5e8f489ca84d79338f60844abbf309bf0fc3b93cd3c5a9,2026-04-09 08:40:20+00:00,,7,neutral,0,0,2,0,0,0,0,0,0,0,0,0,0
JPM,finnhub_news,Benzinga,Jamie Dimon Says Missed Obama-Era Plan Would Have Been A 'Home Run' For US Debt Crisis: 'Wish It Had...',https://finnhub.io/api/news?id=29669b38f0f253752318c224bd2f116ad3de7048820e25384b00c1a022e7b32e,2026-04-09 06:59:08+00:00,,9,positive,1,0,0,1,0,0,0,2,0,0,0,0,1
JPM,finnhub_news,Yahoo,JPMorgan identifies the lone buyer saving crypto flows,https://finnhub.io/api/news?id=9387b999cf665442380e1a67709ef31550240a38a97637f4e1c8376d10fa528a,2026-04-08 23:58:27+00:00,,8,neutral,0,0,1,0,0,0,0,0,0,0,2,0,0
JPM,finnhub_news,Yahoo,JPMorgan vs. Bank of America: Wall Street Has a Clear Favorite Stock Right Now,https://finnhub.io/api/news?id=3852be48c9db07f8374799cb5fe0e14f1ccfb8f25922852dc522fee6052b4771,2026-04-08 16:24:10+00:00,,15,positive,1,0,3,2,0,0,0,1,0,0,1,0,0
JPM,finnhub_news,Yahoo,Piper Sandler Remains Cautious on JPMorgan (JPM) Amid Weaker Earnings Forecasts,https://finnhub.io/api/news?id=98e0c95c1c2ead0411dea8efc15b87f86e6935f6345f1201090f78bc4f1556e9,2026-04-08 14:34:05+00:00,,11,positive,1,0,1,0,0,0,0,0,0,0,0,1,0
JPM,finnhub_news,Yahoo,Jamie Dimon Basically Says: Some People In Private Credit Have No Business Being In Private Credit,https://finnhub.io/api/news?id=6f724be59e86fb6579299cd2e63ca676c5a7c0fab3a4f11b89649f8644714dc6,2026-04-08 13:31:04+00:00,,11,neutral,0,0,0,0,1,0,0,3,0,0,0,0,0
JPM,finnhub_news,Benzinga,JPMorgan Earnings Are Imminent; These Most Accurate Analysts Revise Forecasts Ahead Of Earnings Call,https://finnhub.io/api/news?id=12a116f8f10aca151315416572408c6e13412c71d775e4e159f66070ff458e23,2026-04-08 06:42:08+00:00,,7,neutral,0,0,4,0,0,0,0,0,0,0,0,0,0
JPM,finnhub_news,Yahoo,Jamie Dimon has warning for America before its 250th anniversary,https://finnhub.io/api/news?id=152b18115db59eb35825e080481fcea96f9d1e9271924011a0f0efef333bf18d,2026-04-08 03:33:00+00:00,,10,neutral,0,0,0,0,0,0,0,3,0,0,0,0,0
JPM,finnhub_news,Yahoo,Jamie Dimon warns of growing crypto competition in annual letter: ‘We need to roll out our own blockchain technology’,https://finnhub.io/api/news?id=94b3436b4a34aecca86b20346ef2ee637f228fbe34666fce0ae240cc725105f9,2026-04-07 22:44:41+00:00,,11,neutral,1,1,0,0,0,0,0,4,0,0,3,0,0
JPM,finnhub_news,Yahoo,JPMorgan has urgent message on Iran war,https://finnhub.io/api/news?id=81cc0f5a087eea7f34bb4c472285138412c77b71915bd583d9bbc8b62b2686c3,2026-04-07 16:33:00+00:00,,11,neutral,0,0,0,0,0,0,0,3,0,0,0,0,2
JPM,finnhub_news,Yahoo,Jamie Dimon Maps JPMorgan’s Risk Playbook And AI Spending Priorities,https://finnhub.io/api/news?id=9305e378a109a0cb4b7f38fc432d5a1d2cff621fb397b884eaf8226eee6b3c6b,2026-04-07 16:10:27+00:00,,19,negative,0,2,0,0,0,0,0,3,1,0,2,0,1
JPM,finnhub_news,Yahoo,JPMorgan Chase Bank closes 16 branches,https://finnhub.io/api/news?id=8f12e0fe191f902bf9061c5e0a5b21db6c06d8865b125cab05d92b8e54170eae,2026-04-07 14:07:00+00:00,,6,neutral,0,0,0,0,0,0,0,0,0,0,0,0,0
JPM,finnhub_news,Yahoo,JPMorgan Chase & Co. (JPM) Earnings Expected to Grow: What to Know Ahead of Next Week's Release,https://finnhub.io/api/news?id=f64f5e677265458d4b7174ab16e05174e3fcebb20bd963a144a665ef1ee7b21f,2026-04-07 14:00:03+00:00,,10,positive,1,0,2,0,0,0,0,0,0,0,0,0,0
JPM,finnhub_news,Yahoo,"Zacks Investment Ideas feature highlights: Bank of America, JPMorgan Chase, Citigroup, Morgan Stanley and NVDIA",https://finnhub.io/api/news?id=c0e180e67d32b3bd73bd856cbf2dcb44cf9af06fc7be2d56133167dbb766e039,2026-04-07 12:30:00+00:00,,9,neutral,1,1,1,0,0,0,0,0,0,0,0,1,1
JPM,finnhub_news,Yahoo,Jamie Dimon says JPMorgan Chase could enter prediction markets — but is ruling out 2 sectors entirely,https://finnhub.io/api/news?id=ef8393d80949c5ee5bc1c9089f68b498244da79cd5bb17542a230a60a53de4bd,2026-04-07 09:30:00+00:00,,13,positive,1,0,0,0,0,0,0,2,0,0,0,0,0
JPM,finnhub_news,Yahoo,JPMorgan Chase & Co. (JPM) Price Target Trimmed by $31,https://finnhub.io/api/news?id=b469038ba8655d27260194f168be6f4d1ac77da2cae3ba0dfa50582eb35f8207,2026-04-07 07:00:12+00:00,,10,positive,1,0,0,0,0,0,0,0,0,0,0,1,0
JPM,finnhub_news,Yahoo,JPMorgan's Dimon Warns Europe Is on a Slow Decline -- and That Is Now a Direct Risk for U.S. Investors With International Exposure,https://finnhub.io/api/news?id=4845bad03296b2d101d6336faa86955516e92e8b5a311c0b99c2e80de1d1a3e2,2026-04-07 04:05:00+00:00,,7,negative,0,2,0,0,0,0,0,1,0,0,0,0,0
JPM,finnhub_news,Yahoo,JPMorgan's Dimon signals PE firms likely to struggle in a bear market,https://finnhub.io/api/news?id=20de80c3199dabfbc8c52cde21be61d22a92eb7700c351f1b4aa6409344d7a40,2026-04-06 22:36:08+00:00,,13,neutral,0,0,0,0,0,0,0,4,0,0,0,0,0
JPM,finnhub_news,Yahoo,Jamie Dimon Says AI Will Impact 'Virtually Every Function' at JPMorgan Chase,https://finnhub.io/api/news?id=e9215659625e4ae016e0741a19c2c19e8345b1bf38893c62a6eccba265bee9da,2026-04-06 21:56:47+00:00,,14,positive,1,0,0,0,0,0,0,3,0,0,1,0,0
JPM,finnhub_news,Yahoo,5 key points from Jamie Dimon's letter to investors,https://finnhub.io/api/news?id=b818c85fbbb59e3cce2ad781f17b66f6566ee7dc1e921780f6ae45aac5c16c99,2026-04-06 20:44:36+00:00,,8,neutral,0,0,0,0,0,0,0,3,0,0,0,0,1
JPM,finnhub_news,Yahoo,Jamie Dimon Has Moved on From Cockroaches. Why a ‘Skunk at the Party’ Is His New Concern.,https://finnhub.io/api/news?id=65a0c12e37eff4b77f4c538f21b7424f899668cde708b2908e7bc814764da35c,2026-04-06 18:59:00+00:00,,8,negative,0,1,0,0,0,0,0,3,0,0,0,0,2
JPM,finnhub_news,Yahoo,Jamie Dimon Is Watching for a ‘Tipping Point’ as Risks to the Economy and Markets Pile Up,https://finnhub.io/api/news?id=7a6544d3f8f877168abd081b5de4a65b11587400825e5ccc3ed8a65683910e85,2026-04-06 17:46:06+00:00,,14,negative,0,1,0,0,0,0,0,4,0,0,0,0,4
JPM,finnhub_news,Yahoo,Jamie Dimon Warns Markets Are Mispricing 2026's Biggest Risks,https://finnhub.io/api/news?id=11e2d3a13fd739c5c993243db4b4993de8ab86d0a487c41f9960644af2937b3b,2026-04-06 17:46:01+00:00,,12,neutral,0,0,0,0,1,0,0,3,0,0,0,0,1
JPM,finnhub_news,DowJones,Jamie Dimon Warns on Private Credit,https://finnhub.io/api/news?id=57543748391cab0e7c2b5e57fa70a206ef17fdd450d69310d6c8852ef7039996,2026-04-06 17:37:00+00:00,,8,neutral,0,0,0,0,1,0,0,2,0,0,0,0,0
JPM,reddit_post,stocks,Why JPMorgan is warning Tesla stock may crash 60%,https://www.reddit.com/r/stocks/comments/1se4e1t/why_jpmorgan_is_warning_tesla_stock_may_crash_60/,2026-04-06 16:51:26+00:00,909.0,7,neutral,0,0,0,0,0,0,0,0,0,0,0,0,0
JPM,finnhub_news,Yahoo,Dimon: Global Economy 'Far Less Reliant' On Energy Than In The Past,https://finnhub.io/api/news?id=d9d8023818e7597cf9cebdc75a022ad32538237e89294abf557d4c06735859d4,2026-04-06 16:24:42+00:00,,11,neutral,0,0,0,0,0,0,0,2,0,0,0,0,4
JPM,finnhub_news,Yahoo,Five Risks Jamie Dimon Is Worried About in 2026,https://finnhub.io/api/news?id=a4a476a5d7abf1f727d55c79312e9b924532017f7abf6dce7e98affc91cc7a97,2026-04-06 16:19:00+00:00,,10,neutral,0,0,0,0,0,0,0,3,0,0,0,0,0
JPM,finnhub_news,Yahoo,"Jamie Dimon warns Iran war could drive inflation, interest rates higher",https://finnhub.io/api/news?id=3c214c1ced585b5b078add2b1b2d071db574691c6d272d99c61ca9484c155112,2026-04-06 16:13:50+00:00,,12,positive,1,0,0,2,0,0,0,3,0,0,0,0,2
JPM,finnhub_news,Yahoo,Lilly vs JPMorgan: Which Hits a $1 Trillion Market Cap First?,https://finnhub.io/api/news?id=aefaffa4d324c8d3be8409b833253f4df090426ab6fcc04157b8658d03168472,2026-04-06 15:50:28+00:00,,9,neutral,0,0,0,0,0,0,0,0,0,0,0,0,0
JPM,finnhub_news,Yahoo,"JPMorgan, Morgan Stanley, Goldman Sachs Poised to Report In-Line to Better Q1 Results, BofA Says",https://finnhub.io/api/news?id=ed956b998a5affd6d02b8b85a9d3c5fd705d272cd17a7f4c43f2df15feb9c57b,2026-04-06 15:28:00+00:00,,10,neutral,0,0,2,0,0,0,0,0,0,0,0,0,0
JPM,finnhub_news,Yahoo,"JPMorgan has 300,000 employees, but Jamie Dimon says the bank wins by deploying small teams like Navy SEALs",https://finnhub.io/api/news?id=7265a52fc55f32e529125de15d9df62dd7f47ee9bbec23f2a2b963e3e4d8236c,2026-04-06 15:27:55+00:00,,10,neutral,0,0,0,0,0,0,0,2,0,0,0,0,0
JPM,finnhub_news,Yahoo,JPMorgan CEO Jamie Dimon predicts AI will cut the workweek down to 3.5 days—and tells Gen Z developing EQ is more important than ever,https://finnhub.io/api/news?id=4ec3230b366c67282154f3ffaf1f52c8665a7aa5e97b572eb820042df6d59134,2026-04-06 14:56:17+00:00,,11,neutral,0,0,0,0,0,0,0,3,0,0,1,0,0
JPM,finnhub_news,Yahoo,"JPMorgan CEO Dimon warns of geopolitical, regulatory and AI risks",https://finnhub.io/api/news?id=e491dd7f2767798e02e17749f171b9c379e5c60ba3dd9e743f9dda6f35ffaca3,2026-04-06 14:15:00+00:00,,19,neutral,0,0,0,0,0,0,0,4,1,0,2,0,2
