ticker,source_type,source,title,url,published_at,engagement,relevance_score,tone,positive_hits,negative_hits,earnings_profitability,nii_margin_rates,credit_risk_provisions,investment_banking_markets,consumer_cards_deposits,dimond_ceo_governance,regulation_capital,capital_return_buyback,ai_technology_fintech,valuation_defensive_bank,macro_geopolitical
JPM,finnhub_news,Yahoo,JPMorgan Balances Tricolor Fraud Lawsuit With AI And Branch Expansion,https://finnhub.io/api/news?id=a1ddc9ef6cda08a2c6f7529db38b1326b9a8a4a159a26532e48362ec75545cad,2026-03-02 16:06:09+00:00,,10,neutral,2,2,0,0,0,0,0,0,0,0,2,0,0
JPM,finnhub_news,CNBC,Jamie Dimon says Trump’s $5 billion debanking lawsuit ‘has no merit’ but he’s sympathetic to concerns,https://finnhub.io/api/news?id=548b576f1f3abcffc1026f3f3ab90f5ddd11fdef4d046df06dacf72da8e8aeec,2026-03-02 16:04:04+00:00,,10,negative,0,2,0,0,0,0,0,3,0,0,0,0,0
JPM,finnhub_news,CNBC,Highlights from CNBC's interview with JPMorgan CEO Jamie Dimon,https://finnhub.io/api/news?id=1aa4ebfd54918108b6991e6bd057c8fe18224b256d25adb84a913c3bfee61c14,2026-03-02 15:43:27+00:00,,11,negative,0,1,0,0,1,0,0,3,0,0,0,0,0
JPM,finnhub_news,Benzinga,"Live On CNBC, JP Morgan CEO Dimon Says It's Possible AI Will Attack Parts Of Software More Than People Think",https://finnhub.io/api/news?id=801e3c88d483f22f32f4d4bdf07be638c629072259c75aa4b8f7927b7cc12588,2026-03-02 15:01:47+00:00,,8,neutral,0,0,0,0,0,0,0,2,0,0,1,0,0
JPM,finnhub_news,Yahoo,SCCM Enhanced Equity Portfolio Sold JPMorgan Chase (JPM) Despite Being the Highest-Quality Money Center Bank,https://finnhub.io/api/news?id=8a33d04a6980046fca07a7104ad408a1252b2aefc5b1dffc60388e6fd5ec2514,2026-03-02 14:58:25+00:00,,12,positive,1,0,1,0,0,0,0,0,0,0,1,1,0
JPM,finnhub_news,Benzinga,"Live On CNBC, JP Morgan CEO Dimon Says Asset Prices Are Very High, Credit Spreads Are Very Low",https://finnhub.io/api/news?id=b309e102a33f837c8a2dfffb45198868b75f6019706b0f1d21d08602691296d4,2026-03-02 14:57:28+00:00,,8,neutral,0,0,0,0,1,0,0,2,0,0,0,0,0
JPM,finnhub_news,Benzinga,"Live On CNBC, JP Morgan CEO Dimon Says Credit Will Have Normal Cycle, Believe It Will Be Worse Than A Normal One When It Happens",https://finnhub.io/api/news?id=e40af7e2b79994f91ff7176f5f6da286fbb737e739e6819c4936266b63c0e92a,2026-03-02 14:56:27+00:00,,8,neutral,0,0,0,0,1,0,0,2,0,0,0,0,0
JPM,finnhub_news,Benzinga,"Live On CNBC, JP Morgan CEO Dimon Says Deregulation Of Banks, Other Companies, Could Help Drive Growth",https://finnhub.io/api/news?id=a1b190cd0af155d0cbcb481cbbf36ce073e38e944a35fb7003edbba770cdecc1,2026-03-02 14:53:16+00:00,,7,positive,1,0,0,0,0,0,0,2,0,0,0,0,0
JPM,finnhub_news,Benzinga,"Live On CNBC, JP Morgan CEO Dimon Says Governments Around The World Have Far More Debt Than The've Ever Had Before",https://finnhub.io/api/news?id=6c92f478c996cca9a3e67c01fdb73857e0c51f578f7553901fa71680c36440c7,2026-03-02 14:51:32+00:00,,7,neutral,0,0,0,0,0,0,0,2,0,0,0,0,0
JPM,finnhub_news,Benzinga,"Live On CNBC, JP Morgan CEO Dimon Says Government Debt Is Not In Good Shape",https://finnhub.io/api/news?id=4793053a6921c6624796442420415a8d871c47251e945ef8f083a7347ab53031,2026-03-02 14:50:13+00:00,,7,neutral,0,0,0,0,0,0,0,2,0,0,0,0,0
JPM,finnhub_news,Benzinga,"Live On CNBC, JP Morgan CEO Dimon On Developments In Iran Says This Right Now Will Increase Gas Prices A Little Bit; Says If Iran Conflict Is Not Prolonged, There Is Not Going To Be A Major Inflationary Hit",https://finnhub.io/api/news?id=750be92d2b6ae530a0c6f9726b3a904052ab49d6a0164d042ba1f5e5fb69e75c,2026-03-02 14:48:47+00:00,,7,neutral,0,0,0,0,0,0,0,2,0,0,0,0,0
JPM,finnhub_news,Yahoo,JPMorgan starts Netflix at Overweight after co’s exit from Warner Bros deal,https://finnhub.io/api/news?id=30ede8b5121f4fdf8998cf0344a9dc914b442a2ffec369d67018cdd5a0c4a59e,2026-03-02 14:11:59+00:00,,5,neutral,0,0,0,0,0,1,0,0,0,0,0,1,0
JPM,finnhub_news,Yahoo,JPM’s Matejka says Iran escalation is an opportunity to buy more stocks,https://finnhub.io/api/news?id=3b42900c2e0ca468e5dc8a17f5b25727f3c774e984d8c7fcc91086777f3026fd,2026-03-02 12:45:30+00:00,,7,positive,1,0,0,0,0,0,0,0,0,0,0,0,1
JPM,finnhub_news,Yahoo,ADMA Biologics Announces $125 Million Accelerated Share Repurchase with JPMorgan as Part of a Planned $200 Million 2026 Total Share Repurchase Initiative,https://finnhub.io/api/news?id=ab74f0780ffd59f5404caecb5d03350689ac79b98ea068404391ecd7ed29a12b,2026-03-02 12:00:00+00:00,,9,neutral,0,0,0,0,0,0,0,0,0,2,0,0,0
JPM,finnhub_news,Yahoo,"The Zacks Analyst Blog Highlights NVIDIA, Microsoft , JPMorgan Chase, Star Group and Coffee Holding",https://finnhub.io/api/news?id=355cb9227b838f9d2c341266adf27709dfc94932d74df38fbaf560b7eb48d224,2026-03-02 09:37:00+00:00,,7,positive,2,0,0,0,0,0,0,0,0,0,1,0,0
JPM,finnhub_news,Yahoo,The Real Reason JPMorgan Chase Shut Down Its Robo-Advisor Services,https://finnhub.io/api/news?id=6da35945b1a0687bff4e5d34dc7932aaf531c4baca832dca76f09b0437c26069,2026-02-28 17:30:00+00:00,,6,neutral,0,0,0,0,0,0,0,0,0,0,0,0,0
JPM,finnhub_news,Yahoo,JPMorgan Lawsuit And AI Overhaul Put Risk Culture Under The Microscope,https://finnhub.io/api/news?id=9b1eda34453f3d6b3a25c4664a32df9de650aa970ea0ae7bd695594ba1144bf1,2026-02-28 08:10:33+00:00,,10,negative,0,2,0,0,0,0,0,0,0,0,1,0,0
JPM,finnhub_news,Yahoo,Why JPMorgan Chase Stock Slumped by Almost 2% Today,https://finnhub.io/api/news?id=c3e26443524db10c5f1b1765367498173b368617e281ff0bbfc05972d5a32e73,2026-02-28 01:00:50+00:00,,6,neutral,0,0,0,0,0,0,0,0,0,0,0,0,0
JPM,finnhub_news,Yahoo,"Jamie Dimon Says 'Now's The Time' To Prepare For Automation's Worker Impact, Warns AI Could Displace Jobs",https://finnhub.io/api/news?id=e67c0321522639e14e5bec00125c06bcbd5c536b3900139f8ef2244edb5a45b4,2026-02-27 20:31:05+00:00,,17,negative,0,1,0,0,0,0,0,3,0,0,3,0,0
JPM,finnhub_news,Yahoo,"JPMorgan, Barclays, Fifth Third Sued by Tricolor Note Holders",https://finnhub.io/api/news?id=cda9fd8d4a6cb53f8864c0eda2150c6dcf7d1893e3e5c856f9d0c5fabb5e7c14,2026-02-27 19:11:28+00:00,,9,neutral,0,0,0,0,0,0,0,0,0,0,0,0,0
JPM,finnhub_news,Yahoo,"JPMorgan Gives Bold Nvidia Stock Price Target, But Market’s Not Buying It",https://finnhub.io/api/news?id=a833e152fa1b13cb4d180b02b5d95d867dab8a88b77d813de43b3cec8f0b8fb4,2026-02-26 20:54:09+00:00,,5,positive,1,0,1,0,0,0,0,0,0,0,0,1,0
JPM,finnhub_news,Yahoo,JPMorgan plans worker redeployment amid AI push – report,https://finnhub.io/api/news?id=fc632925f407e3572c33ac8b3e5e3f31e3b0fdf228013420eeace65c202f3bf3,2026-02-26 11:57:20+00:00,,5,neutral,0,0,0,0,0,0,0,1,0,0,2,0,0
JPM,finnhub_news,Yahoo,Truist Cuts JPMorgan (JPM) Target While Increasing Long-Term Earnings Estimates,https://finnhub.io/api/news?id=4583f3fed2ce31ddfb43dbe14a34b3eca6ff388e5b3daa985f6119243ba306b0,2026-02-26 02:31:51+00:00,,11,positive,1,0,2,0,0,0,0,0,0,1,0,0,0
JPM,finnhub_news,Yahoo,Jamie Dimon Says His 'Anxiety is High' Over What Could Cause the Next Financial Crisis,https://finnhub.io/api/news?id=baa3242bbd01fbec3164450f804731e6781e7da397d772dcb3f391285a51f22a,2026-02-25 23:58:38+00:00,,13,neutral,0,0,0,0,0,0,0,3,0,0,0,0,0
JPM,finnhub_news,Yahoo,"Jamie Dimon warns of pre-financial crisis parallels, says some people doing ‘dumb things’",https://finnhub.io/api/news?id=ab307b04d79c719e9879f171443fdc8f3ab4f3353c959d2174c2fd6478dfb39c,2026-02-25 21:58:30+00:00,,10,neutral,0,0,0,0,0,0,0,3,0,0,0,0,0
JPM,finnhub_news,Yahoo,Jamie Dimon says society should start preparing for AI job displacement: ‘Now’s the time to start thinking about’ it,https://finnhub.io/api/news?id=75ef3177f217f11d81b8b41fcc8f89c40e9f4e448d060960b099f9c863f30a03,2026-02-25 18:39:05+00:00,,11,neutral,0,0,0,0,0,0,0,2,0,0,1,0,0
JPM,finnhub_news,Yahoo,JPMorgan assigns MARA an overweight rating ahead of 2025 earnings,https://finnhub.io/api/news?id=d1d5d8d6d7f2b77a63f92e13f8ea42b23d0fb4b7fa6a137c3ce8105d234bbff8,2026-02-25 17:52:04+00:00,,5,positive,1,0,1,0,0,0,0,0,0,0,1,0,0
JPM,finnhub_news,Yahoo,JP Morgan CEO has stark message for investors on stocks,https://finnhub.io/api/news?id=7feef56c9a67e5e5c169c93ea8d72db80b920437abe2306b1ded6ac45be3cb91,2026-02-25 16:07:00+00:00,,19,positive,1,0,0,0,0,0,0,3,0,0,0,0,0
JPM,finnhub_news,Yahoo,JPMorgan (JPM) Sees Investment Banking Holding Up Amid Market Uncertainty,https://finnhub.io/api/news?id=fb48a0132a7b83cbe936474419900781f33c5ce4907f0ed097a6ad76b8fee67e,2026-02-25 15:53:14+00:00,,14,neutral,2,2,2,0,0,2,0,0,0,1,0,0,0
JPM,finnhub_news,Yahoo,How to Play JPM Stock as Tech Spend Ramps in 2026 Amid AI Uncertainty?,https://finnhub.io/api/news?id=346aeacda706966a49b468e6d0f1c7327d1387d32f15ba635e1f969057c8e52c,2026-02-25 14:11:00+00:00,,10,positive,1,0,0,1,0,0,0,0,0,0,1,0,0
JPM,finnhub_news,Yahoo,Here is What to Know Beyond Why JPMorgan Chase & Co. (JPM) is a Trending Stock,https://finnhub.io/api/news?id=a7ad7d99d8fd1c7eea013b74612de2975d99c6d62ad18ad4e350b1c4df6f8a96,2026-02-25 14:00:02+00:00,,9,neutral,0,0,0,0,0,0,0,0,0,0,0,0,0
JPM,finnhub_news,Benzinga,JPMorgan Chase Unusual Options Activity,https://finnhub.io/api/news?id=939d6cab929b2ef89a94b4c051d97002faba8df76b567739468815c6eb91516a,2026-02-25 12:01:07+00:00,,6,neutral,0,0,0,0,0,0,0,0,0,0,0,0,0
JPM,finnhub_news,SeekingAlpha,Jamie Dimon And AI,https://finnhub.io/api/news?id=58220742285f481756bbed62ad46e0cc115b4b62426affa231b939e3f04067d2,2026-02-25 11:12:42+00:00,,8,neutral,0,0,0,0,0,0,0,2,0,0,1,0,0
JPM,finnhub_news,Yahoo,U.S. Needs To Plan For AI Jobs Wipeout: JPMorgan CEO Dimon,https://finnhub.io/api/news?id=542016340705616cb0b7cf5fa6f1b377147d47e777a068557efababd420fe7f4,2026-02-25 00:36:03+00:00,,8,neutral,0,0,0,0,0,0,0,2,0,0,1,0,0
JPM,finnhub_news,Yahoo,Dimon Sees Pre-Crisis Parallels as Rivals Do 'Dumb Things',https://finnhub.io/api/news?id=ff81bca10a1d50c639ba81797d333efe299b6d8124dc19b436f43a6b25c5e7dd,2026-02-24 23:28:05+00:00,,19,negative,0,1,0,3,2,0,0,3,0,0,0,0,0
JPM,finnhub_news,Yahoo,'Trust Me': CEO Jamie Dimon Reportedly Set To Defend $2 Billion Weekly Spending Plan At JPMorgan,https://finnhub.io/api/news?id=33eca17178e2af6260596012aee14ab4c4f40b835c35de2c71908e7bd7bd2433,2026-02-24 22:30:18+00:00,,16,positive,1,0,0,0,0,0,0,3,0,0,0,0,0
JPM,finnhub_news,Yahoo,JPMorgan Chase Financial Company LLC Declares Quarterly Coupon on Alerian MLP Index ETN,https://finnhub.io/api/news?id=977b6d762319287a0083a299df229255491f753010b6fb635a47c0a09e54bb91,2026-02-24 21:15:00+00:00,,6,neutral,0,0,0,0,0,0,0,0,0,0,0,0,0
JPM,finnhub_news,Yahoo,JPMorgan's Dimon Says U.S. Needs To Plan For AI Jobs Wipeout,https://finnhub.io/api/news?id=96322132989ec1975c73b59e5fc71ba715174f70fb35486f49b885291b2f9448,2026-02-24 21:04:44+00:00,,14,neutral,0,0,0,0,0,0,0,3,0,0,1,0,0
JPM,finnhub_news,Yahoo,JPMorgan Acknowledges Shutting Down Trump Accounts After January 6,https://finnhub.io/api/news?id=7b9d5177d908c299937594e754b461b54c63cebc971be60ebca75d00f768a3a0,2026-02-24 19:31:03+00:00,,9,negative,0,1,0,0,0,0,0,0,0,0,0,0,0
JPM,finnhub_news,Yahoo,Jamie Dimon Warns of ‘Dumb Stuff’ Risks. Private Credit Could Be Where They Are.,https://finnhub.io/api/news?id=4e4f6dd424e5530a3a93d9efd2b99dff35c9670630c73ce4a20b0e672e00e7f4,2026-02-24 19:13:00+00:00,,14,neutral,0,0,0,0,2,0,0,3,0,0,0,0,0
JPM,finnhub_news,Yahoo,JPMorgan Chase & Co. (JPM) Could Be a Great Choice,https://finnhub.io/api/news?id=9aa9459a11135c324637aa23c06e773da46debb28864efd062ed00639592738c,2026-02-24 16:45:01+00:00,,10,neutral,0,0,0,0,0,0,0,0,0,1,0,0,0
JPM,finnhub_news,SeekingAlpha,JPMorgan Chase & Co. (JPM) Discusses Strategic Framework and Firm Overview with Executive Q&A Transcript,https://finnhub.io/api/news?id=ea92586a6397e93b538df411ff6af55d03e046a4505a9f8c9315954de3cf4d2e,2026-02-24 16:37:53+00:00,,9,neutral,0,0,0,0,0,0,0,0,0,0,0,0,0
JPM,finnhub_news,Yahoo,"JPM Signals IB Strength, NII Growth & Tech Spending Jump in 2026",https://finnhub.io/api/news?id=0ec74b25d3504045883e69d3ac14b885ac061bb2dd069bf6ac764351c8b90718,2026-02-24 16:13:00+00:00,,9,positive,2,0,0,1,0,0,0,0,0,0,0,0,0
JPM,finnhub_news,CNBC,Jamie Dimon says AI is already reshaping JPMorgan Chase's workforce as bank plans 'huge redeployment’,https://finnhub.io/api/news?id=c94af21edd5bbb7078507cc3e04924d27b840e17c0a55774a4cedabe121face1,2026-02-24 15:00:47+00:00,,14,neutral,0,0,0,0,0,0,0,2,0,0,1,0,0
JPM,finnhub_news,MarketWatch,Jamie Dimon Warns of ‘Dumb Stuff’ Risks. Here’s Where He’s Seeing It.,https://finnhub.io/api/news?id=bf0d6f3e104a007c882cf865b43576114542d58ee2365f9efbc3489479b73a86,2026-02-24 14:52:00+00:00,,7,neutral,0,0,0,0,0,0,0,2,0,0,0,0,0
JPM,finnhub_news,Yahoo,"Jamie Dimon says AI euphoria, record stocks and banks doing ‘dumb things’ could lead to another financial crisis",https://finnhub.io/api/news?id=fc8509df0c6247107e26031393edfb25a7bd92de1c89fa4fb297b578bdc8b156,2026-02-24 13:58:51+00:00,,14,positive,1,0,0,0,0,0,0,3,0,0,1,0,0
JPM,finnhub_news,Yahoo,Jamie Dimon warns markets resemble pre-financial crisis era: 'I see a couple of people doing some dumb things',https://finnhub.io/api/news?id=19cbf895bdbcca595640d2fa969f4ff18fbdaa8538d51cec2f1d9198630449d7,2026-02-24 13:37:19+00:00,,10,neutral,0,0,0,0,0,0,0,3,0,0,0,0,0
JPM,finnhub_news,Yahoo,JPM's Bob Michele Sees Bonds as 'Perfectly Priced Market',https://finnhub.io/api/news?id=a4850a795d69f474cf50dc64cf9afe67ec66f356a9cf299e582938c81ee6b131,2026-02-24 12:56:31+00:00,,6,neutral,0,0,0,0,0,0,0,0,0,0,0,0,0
JPM,finnhub_news,Yahoo,Is JPMorgan Chase Stock Outperforming the Dow?,https://finnhub.io/api/news?id=0a8bb22ced2c4878d80f52e849d5d8df0346ce7476081cbd6c1f512cee0ef8d9,2026-02-24 12:30:58+00:00,,7,positive,1,0,1,0,0,0,0,0,0,0,0,0,0
JPM,finnhub_news,Yahoo,JPMorgan’s Dimon: ‘My anxiety is high’ over future credit cycle,https://finnhub.io/api/news?id=42a92cc0c18d2c63ced683c21117d8788a03783bdd3183abb30513e2b51000f9,2026-02-24 12:05:53+00:00,,8,neutral,0,0,0,0,2,0,0,2,0,0,0,0,0
JPM,finnhub_news,Yahoo,Jamie Dimon’s got some advice to investors riding high on asset prices: ‘Take a deep breath and watch out’,https://finnhub.io/api/news?id=64644139ec827aac59dbce25673cf72475860d3926c273af8176afecb2f61161,2026-02-24 11:43:33+00:00,,7,neutral,0,0,0,0,0,0,0,2,0,0,0,0,0
JPM,finnhub_news,Yahoo,Dimon Says JPMorgan's Rivals Are Doing 'Dumb Things',https://finnhub.io/api/news?id=ea46c0e8b882296b1686745722f1e8d1dfbb2cffa05f9f58d105d02f860867f8,2026-02-24 08:51:54+00:00,,10,negative,0,1,0,0,0,0,0,3,0,0,0,0,0
JPM,finnhub_news,Benzinga,"Jamie Dimon Predicts JPMorgan Will Be 'A Winner' In AI Race, Boosts 2026 Tech Spend To Nearly $20 Billion",https://finnhub.io/api/news?id=51da46033d5bef5b9c05e9333e08e0502a94325fc6a65674806bdb502854ef80,2026-02-24 07:38:18+00:00,,17,neutral,0,0,0,0,0,0,0,3,0,0,2,0,0
JPM,finnhub_news,Yahoo,A Look Back at Diversified Banks Stocks’ Q4 Earnings: JPMorgan Chase (NYSE:JPM) Vs The Rest Of The Pack,https://finnhub.io/api/news?id=3708ce7be127e811559ed92220a836a12d316322f75ba805153df3817bc29c19,2026-02-24 03:32:32+00:00,,10,neutral,0,0,1,0,0,0,0,0,0,0,0,0,0
JPM,finnhub_news,Yahoo,"Dimon Sees Parallels to Pre-Crisis Era, Rivals Doing 'Dumb Things'",https://finnhub.io/api/news?id=e5315a78a5667aabb89d961775e54c17d2f90aa1fd00e5557741b8069c6b4bdc,2026-02-24 03:15:29+00:00,,11,negative,0,1,0,0,0,0,0,3,0,0,1,0,0
JPM,finnhub_news,Yahoo,Is It Time To Reconsider JPMorgan Chase (JPM) After Recent Share Price Weakness?,https://finnhub.io/api/news?id=df964dfe1c6eaf912a28465431163fc0e301e86ff0e01246be73974d988dba08,2026-02-24 01:09:54+00:00,,9,negative,0,1,0,0,0,0,0,0,0,0,0,0,0
JPM,finnhub_news,Yahoo,Jamie Dimon Dismisses Fears Over How AI Will Hit JPMorgan,https://finnhub.io/api/news?id=d54db6d1c82d381ce330d3983d0793d24ace22cf673add40059b0ea6fb284fe9,2026-02-24 00:00:00+00:00,,11,neutral,0,0,0,0,0,0,0,2,0,0,1,0,0
JPM,finnhub_news,CNBC,From Jamie Dimon’s ‘cockroaches’ to the Blue Owl freeze: How stress is spreading in private credit,https://finnhub.io/api/news?id=3fa699d931c9cd7a9ee9243c9d8521b0587fddf8eb8ef73bc3cae44b0d902846,2026-02-23 23:52:45+00:00,,8,neutral,0,0,0,0,1,0,0,2,0,0,0,0,0
JPM,finnhub_news,Yahoo,JPMorgan Chase & Co. (JPM) Dips More Than Broader Market: What You Should Know,https://finnhub.io/api/news?id=e5426930a6cc1224820c846f25c348c2982de42f574a7cfb7ee21c8582355e3f,2026-02-23 22:45:04+00:00,,9,neutral,0,0,0,0,0,0,0,0,0,0,0,0,0
JPM,finnhub_news,CNBC,Jamie Dimon says 'watch out’ as lofty asset prices add to economic risks: ‘My anxiety is high’,https://finnhub.io/api/news?id=ccb451565b7c2bb88c29da3cbe9ac534510a241e732a4f1b122147a7dfa612f5,2026-02-23 20:57:14+00:00,,13,negative,0,1,0,0,0,0,0,3,0,0,0,0,0
JPM,finnhub_news,Yahoo,Should You Buy JPMorgan Stock as It Plans to Support Trump’s ‘Board of Peace’?,https://finnhub.io/api/news?id=00714bf427210a52adc2d5907ade02b062dcd7da50dfb979135913ba8cac2580,2026-02-23 19:42:17+00:00,,6,positive,1,0,0,0,0,0,0,0,0,0,0,0,0
JPM,finnhub_news,Yahoo,Why JPMorgan Stock Just Dropped,https://finnhub.io/api/news?id=6bc0e1c8bec02af6689a60f601db72bb43299934f017ea9fae2391720314b255,2026-02-23 18:45:36+00:00,,5,neutral,0,0,0,0,0,0,0,0,0,0,1,0,1
JPM,finnhub_news,Benzinga,'JPMorgan Lifts Net Interest Income Outlook Ahead of Firm Update'- Bloomberg,https://finnhub.io/api/news?id=9073855b412728487e4e654e2cc3677d5002102dac5ef6c415c89ec00909ca4f,2026-02-23 17:52:55+00:00,,6,neutral,0,0,0,2,0,0,0,0,0,0,0,0,0
JPM,finnhub_news,Benzinga,JPMorgan Slides As Credit Fears Grow,https://finnhub.io/api/news?id=09fde678a13afd3b678f6bdacad9bcf89b6ceec0dda6f09f87f1c9ac547c5bac,2026-02-23 17:12:50+00:00,,8,negative,0,1,0,0,1,0,0,0,0,0,1,0,0
JPM,finnhub_news,Yahoo,JPM downgrades Vans parent VF Corp as margin recovery likely to take longer,https://finnhub.io/api/news?id=26f2b1cd9ca43550f7d0960aa5878291b99ad5f567cd4cf77fb360e35e022638,2026-02-23 16:10:09+00:00,,8,positive,1,0,1,0,0,0,0,0,0,0,0,1,0
JPM,finnhub_news,Yahoo,"JP Morgan Reduces Target Price on Booking Holdings (BKNG) to $5,600",https://finnhub.io/api/news?id=942796bb5908f8d1385521863aa198b95dc4f2a4636ef162dcee74f8e30a550d,2026-02-23 14:56:19+00:00,,9,positive,1,0,1,0,0,0,1,0,0,0,0,1,0
JPM,finnhub_news,Yahoo,Why JPMorgan Chase & Co. (JPM) is a Top Momentum Stock for the Long-Term,https://finnhub.io/api/news?id=f0868b9bda6f175a41e7af7da9cf662065da41328dd7b89bae45c9c7a49c83a8,2026-02-23 14:50:04+00:00,,10,positive,3,0,0,0,0,0,0,0,0,0,0,1,0
JPM,finnhub_news,Yahoo,Why JPMorgan Chase & Co. (JPM) is a Top Stock for the Long-Term,https://finnhub.io/api/news?id=3f832c4daaab5b365ea3b31f5f571d29b11bc852670bb16e74519bd6ce003f83,2026-02-23 14:30:03+00:00,,11,positive,1,0,1,0,0,0,0,0,0,0,0,1,0
JPM,finnhub_news,Benzinga,'Dimon Seeks To Sell JPMorgan Investors On $2bn-A-Week Costs Bill' - FT,https://finnhub.io/api/news?id=0ea842fdf5d75630decb86c0062666e8bc24678be244889cdccdb5e4d3b5284e,2026-02-23 04:03:55+00:00,,7,negative,0,1,0,0,0,0,0,1,0,0,0,0,0
JPM,finnhub_news,Yahoo,JPMorgan closed Trump accounts after Jan. 6 attack,https://finnhub.io/api/news?id=c84e39fbce5e16eba5ae7a29856d6b6c87403de6fdcc57b9673b0836e3379f45,2026-02-21 22:05:29+00:00,,16,negative,0,1,0,0,0,0,0,3,0,0,0,0,0
JPM,finnhub_news,Yahoo,JPMorgan concedes it closed Trump's accounts after Jan. 6 attack,https://finnhub.io/api/news?id=ce7ae2a13b7f65f81cfd544ddf82b4706b4c8ff56099427125b800e8612df065,2026-02-21 20:58:27+00:00,,13,negative,0,1,0,0,0,0,0,2,0,0,0,0,0
JPM,finnhub_news,Yahoo,JPMorgan's EU Arm Fined EURO 12.18M by ECB for Capital Errors,https://finnhub.io/api/news?id=21084233f76480fcde2650b1b84005bc5c5bf8686dc58db6101008cd8be36456,2026-02-20 16:56:00+00:00,,6,negative,0,1,0,0,0,0,0,0,0,0,0,0,0
JPM,finnhub_news,Yahoo,JPMorgan Bets on Branches: How Will This Translate to Revenue Growth?,https://finnhub.io/api/news?id=4c039849990b7536bcb01fff33fc494ac62f79df64c2eedf11bfebd5e57f1a37,2026-02-20 14:47:00+00:00,,13,positive,1,0,1,2,0,0,1,0,0,0,0,0,0
JPM,finnhub_news,Yahoo,Jamie Dimon Sells $21 Million of JPMorgan Stock,https://finnhub.io/api/news?id=282ae6fe4030cf3283549271ad496f7374a4f47e8dc8d48d0ead3fee4b66142c,2026-02-20 14:09:45+00:00,,10,negative,0,1,0,0,0,0,0,2,0,0,0,0,0
JPM,finnhub_news,Benzinga,Jamie Dimon Sells $21M In JPMorgan Stock,https://finnhub.io/api/news?id=f4e06bcaa8049d81679909864c51275ee174d8d5568ef464bee828c0ee37c04d,2026-02-20 10:14:58+00:00,,10,neutral,0,0,0,0,0,0,0,2,0,0,0,0,0
JPM,finnhub_news,Yahoo,"The Zacks Analyst Blog  Rocket, PennyMac , Wells Fargo , Bank of America  and JPMorgan",https://finnhub.io/api/news?id=026f8502cfbfc1a93c32389485369ed76e7d06bf4953485b158a8138fd11c993,2026-02-20 08:47:00+00:00,,8,neutral,0,0,0,0,0,0,1,0,2,0,0,0,0
JPM,finnhub_news,Benzinga,JPMorgan Says Jamie Dimon Sued 'Fraudulently' In Trump's $5 Billion 'Debanking' Lawsuit,https://finnhub.io/api/news?id=84b07b8956ed8c3ac3d70221abe2ca9483b3e565ef14980d4268d7f7b31d9b92,2026-02-20 06:52:49+00:00,,16,negative,0,1,0,0,0,0,0,3,0,0,0,0,0
JPM,finnhub_news,Yahoo,JPMorgan Says Trump’s $5 Billion Suit ‘Fraudulently’ Includes Dimon,https://finnhub.io/api/news?id=c7b5baa3b81dfbbd5dd7e57d1679fd2b2134c972daa79b06ef055695dc68d4e0,2026-02-19 19:48:55+00:00,,7,neutral,0,0,0,0,0,0,0,1,0,0,0,0,0
JPM,finnhub_news,Yahoo,"JPMorgan Chase pushes back on Trump’s $5 billion lawsuit, arguing it ‘fraudulently’ includes Jamie Dimon",https://finnhub.io/api/news?id=12e6d17819a048379c344e481b24cfb082b5746c6b3d7c620f5b672c9ccf76c1,2026-02-19 19:45:10+00:00,,13,negative,0,1,0,0,0,0,0,3,0,0,0,0,0
JPM,finnhub_news,Yahoo,"Mortgage rates drop, JPMorgan says Trump 'fraudulently' named CEO in lawsuit",https://finnhub.io/api/news?id=fc2b39064492ff08f7c284564b9b1e9d2d05111aa7b861ccb5c132b32965b60e,2026-02-19 18:11:24+00:00,,18,negative,0,2,0,1,0,0,1,3,0,0,0,0,0
JPM,finnhub_news,Yahoo,Why The Narrative Around Croda International LSE CRDA Is Shifting After JPMorgan Model Updates,https://finnhub.io/api/news?id=3fcce80abd6210b80293c8ee942426493482d2edf62d8356d2f5a868801c4c64,2026-02-19 16:08:53+00:00,,5,positive,2,0,1,0,0,0,0,0,0,0,0,2,0
JPM,finnhub_news,Benzinga,How Do Investors Really Feel About JPMorgan Chase & Co?,https://finnhub.io/api/news?id=6f973414b9adb5b2b4c9181eac0c0e44208769178b9d5c7341e528b3572f6be0,2026-02-19 12:00:22+00:00,,6,neutral,0,0,0,0,0,0,0,0,0,0,0,0,0
JPM,finnhub_news,Yahoo,JPMorgan Chase to add 160 new branches this year,https://finnhub.io/api/news?id=ab3fa8e5f55fa116a43fe9ae7ad095b7453b3bb52dd39723fb28e5df3c601c27,2026-02-19 11:17:39+00:00,,6,positive,1,0,0,0,0,0,0,0,0,0,0,0,0
JPM,finnhub_news,Yahoo,JPMorgan Branch Build Out Tests Costs Funding And Long Term Returns,https://finnhub.io/api/news?id=723b542968abedab84fc9ac43f62d377a258e012094db3872ee8906e94620ac9,2026-02-18 18:07:06+00:00,,9,positive,3,0,0,0,0,0,0,0,0,0,0,0,0
JPM,finnhub_news,Benzinga,Here's How Much $1000 Invested In JPMorgan Chase 20 Years Ago Would Be Worth Today,https://finnhub.io/api/news?id=49fb7e65074a6f03dab66041ece556f90af7e458f40df67944ac01020a7451aa,2026-02-18 18:00:24+00:00,,6,neutral,0,0,0,0,0,0,0,0,0,0,0,0,0
JPM,finnhub_news,SeekingAlpha,JPMorgan Chase: Common And Preferred Shares Diverge In 2026,https://finnhub.io/api/news?id=0cb54ffccd8b4c63e523d0b3a384ca4b0b248ff4ae090d8710a53b031ff01720,2026-02-18 17:32:44+00:00,,6,neutral,0,0,0,0,0,0,0,0,0,0,0,0,0
JPM,finnhub_news,Benzinga,Stock Of The Day: Has The JPMorgan Reversal Started?,https://finnhub.io/api/news?id=299544b8008ac0a2095cffc5347b3fbff3f724d0a46755994a873c76b3994d65,2026-02-18 17:14:12+00:00,,6,positive,1,0,0,0,0,0,0,0,0,0,0,0,0
JPM,finnhub_news,Yahoo,JPMorgan Chase targets 160 branch openings this year,https://finnhub.io/api/news?id=51d3f5ed4bc12d210feba510f91c73877dda08337ebf9d032fe87d2f68432f4a,2026-02-18 11:18:55+00:00,,6,positive,1,0,0,0,0,0,0,0,0,0,0,0,0
JPM,finnhub_news,Yahoo,Senator spars with JPM’s Dimon,https://finnhub.io/api/news?id=5577dd78bdae07366f3f9230f41fc16bccb8aab6fa8440e90879265023071651,2026-02-18 10:34:00+00:00,,16,neutral,0,0,0,0,0,0,0,3,0,0,0,0,0
JPM,finnhub_news,Yahoo,JPMorgan plans branch opening spree as peers bet on in-person banking,https://finnhub.io/api/news?id=b5250c80e5313f80b3cb387a653dbe22e88e8069f9627d7fbd41b173d34727e9,2026-02-18 05:00:11+00:00,,6,neutral,0,0,0,0,0,0,0,0,0,0,0,0,0
JPM,finnhub_news,Benzinga,'JPMorgan Chase Plans Branch Opening Spree As Peers Bet On In-Person Banking' - FT,https://finnhub.io/api/news?id=5b31a6f3e7abe38a73078dbe6776631834b7f4780004783bc560a70f97cb1dd2,2026-02-18 03:15:31+00:00,,6,neutral,0,0,0,0,0,0,0,0,0,0,0,0,0
JPM,finnhub_news,Yahoo,JPMorgan Opened a Bar for Employees. If Only They Could Get In.,https://finnhub.io/api/news?id=e36790a11cb00eab305146176b2f5c5017b28f574370966594d158ecc70dea03,2026-02-18 00:03:00+00:00,,10,neutral,0,0,0,0,0,0,0,2,0,0,0,0,0
JPM,finnhub_news,Yahoo,JPMorgan Chase & Co. (JPM) Outpaces Stock Market Gains: What You Should Know,https://finnhub.io/api/news?id=4e0c91e5b28ee748a06e7927ba33dab344022d8537f2f4653ff8e7bd21668e1a,2026-02-17 22:45:05+00:00,,9,neutral,0,0,0,0,0,0,0,0,0,0,0,0,0
JPM,finnhub_news,Yahoo,JPMorgan's Q4 Loan Trajectory: Where Did Expansion Show Up?,https://finnhub.io/api/news?id=94a93e90b20f05e9df2094c31ee419b7834b33040f702caf17dc14ca1202b3f4,2026-02-17 14:49:00+00:00,,7,positive,2,0,0,0,0,1,0,0,0,0,0,0,0
JPM,finnhub_news,Yahoo,XTI Aerospace Secures $20 Million JPMorgan Chase & Co. Asset-Based Lending Facility,https://finnhub.io/api/news?id=58f601a241ad6b146bed67148ceb46d1ac17c6b3348c53e15e38271e425084af,2026-02-17 13:30:00+00:00,,11,neutral,0,0,0,0,1,0,0,0,0,0,1,0,0
JPM,finnhub_news,Benzinga,"Wells Fargo Maintains Overweight on JPMorgan Chase, Lowers Price Target to $350",https://finnhub.io/api/news?id=3320493facf2e72dac85c8b082c3123f477b8445397887ef341f1dd8aa17471b,2026-02-17 10:16:48+00:00,,10,neutral,0,0,0,0,0,0,0,0,0,0,0,1,0
JPM,finnhub_news,Benzinga,XTI Aerospace Signs Asset-Based Lending Agreement With JPMorgan Chase For Credit Facility Of Up To $20M Of Revolving Borrowing Capacity,https://finnhub.io/api/news?id=01e9cff6ecd3444daeec74d62ab70f968e5455422283754203cd2c775c131cc9,2026-02-17 09:37:31+00:00,,8,neutral,0,0,0,0,1,0,0,0,0,0,1,0,0
