ticker,source_type,source,title,url,published_at,engagement,relevance_score,tone,positive_hits,negative_hits,earnings_growth,ai_gemini,search_ads,cloud,youtube,waymo_autonomy,android_platform,regulatory_legal,capex_infra,valuation,shareholder_return
GOOGL,finnhub_news,Yahoo,Alphabet vs. Meta Platforms: Which One Will Dominate the Next Decade?,https://finnhub.io/api/news?id=e1a6f9808b9083b11e9b5dcf8da9e0d3db80510d3ac6240a13374c685d84d905,2026-02-14T01:25:00+00:00,,3,neutral,0,0,0,0,0,0,0,0,0,0,0,0,0
GOOGL,finnhub_news,Yahoo,L'AGENCE PRESENTS ITS FALL 2026 COLLECTION & PARTNERS WITH GOOGLE ON EXPERIENTIAL AI VIRTUAL TRY-ON ACTIVATION,https://finnhub.io/api/news?id=96da852f2e317cb8c69a05051dd8e7c4dab7f3ee02c4a4bf124c3da191d088ed,2026-02-13T23:57:00+00:00,,6,negative,0,1,0,1,0,0,0,0,0,0,0,0,0
GOOGL,finnhub_news,Yahoo,"Dow Jones Futures: Apple, Google, Amazon, Nvidia Hit Indexes; Five Ways To Handle This Dangerous Market",https://finnhub.io/api/news?id=12c99635934cefb773d8e3554c48ba3249c5169afd8f0169ba60b525e14e1954,2026-02-13T21:57:23+00:00,,4,negative,0,1,0,0,0,0,0,0,0,0,0,0,0
GOOGL,finnhub_news,Yahoo,Alphabet bonds' lack of guardrails highlights investor confidence,https://finnhub.io/api/news?id=e39a43d0b6b710542a828490027a619b82dd25eed2b87755ec64fd94be5575f4,2026-02-13T19:34:02+00:00,,3,positive,2,1,1,1,0,0,0,0,0,0,0,0,0
GOOGL,finnhub_news,Benzinga,"Soros Fund Management Decreases Stake In Alphabet Inc By 3% To 639,067 Shares.",https://finnhub.io/api/news?id=35161d5ca47caa91f29b543025ea989e43e28ed2ceba20c9c4bd0783e1cc5d04,2026-02-13T17:37:07+00:00,,6,neutral,0,0,0,0,0,0,0,0,0,0,0,0,0
GOOGL,finnhub_news,Yahoo,"Down 6%, Should You Buy the Dip on Alphabet?",https://finnhub.io/api/news?id=a901cb0d275c851a56e53089ad907263d7b153444d5891744fc47076ff7ede00,2026-02-13T16:20:00+00:00,,3,neutral,0,0,0,1,0,0,0,0,0,0,0,0,0
GOOGL,finnhub_news,Yahoo,Why Is Google Parent Alphabet Taking on $32 Billion in New Debt?,https://finnhub.io/api/news?id=61eecc5c4d3a62f6582383c9de4a91a7258e92fbbacefc61cc390cc782c56bd9,2026-02-13T16:05:00+00:00,,6,neutral,0,0,0,1,0,0,0,0,0,0,1,0,0
GOOGL,finnhub_news,Yahoo,"Alphabet Juggles EU Scrutiny, Worker Unrest And Century Bond AI Bet",https://finnhub.io/api/news?id=4692983cc3d2f50ea47004d707226623b1a935a578b1fcceddf9298ec6f24d8b,2026-02-13T15:12:02+00:00,,3,negative,1,4,0,1,2,0,0,0,0,4,1,0,0
GOOGL,finnhub_news,Yahoo,Is Alphabet Inc. (GOOGL) The Most Profitable Mega Cap Stock to Buy?,https://finnhub.io/api/news?id=8d6dcb14175dc7930f457507f9b60db1b869280030e0e224112646c098aef8cb,2026-02-13T15:09:24+00:00,,6,positive,2,0,1,0,0,0,0,0,0,0,0,3,0
GOOGL,finnhub_news,Yahoo,Alphabet Century Bond Draws Questions,https://finnhub.io/api/news?id=094a01e8ebc42df382bfe94be15709f046ad253e98fc6aedf5bcba6ae8ea1455,2026-02-13T13:39:07+00:00,,3,negative,0,1,0,0,0,0,0,0,0,0,0,0,0
GOOGL,finnhub_news,Yahoo,"Amazon, Google And Others Are Pouring $700 Billion Into AI CapEx, Top Analyst Explains Why This Makes It 'Hard' To Bet Against Nvidia",https://finnhub.io/api/news?id=1b2e561fe4d957f24de82a9c9a88b076f0705b0b53f239fc6998062366c0dc68,2026-02-13T13:31:05+00:00,,6,neutral,0,0,0,2,0,0,0,0,0,0,3,1,0
GOOGL,finnhub_news,Yahoo,Alphabet (GOOG) Dominates the Search Market with 80% Share,https://finnhub.io/api/news?id=8b350f3574542cfa7c232d5598abb7bb7f3a73c52220e35195b217e782e5f55a,2026-02-13T13:23:49+00:00,,6,positive,2,0,1,0,1,0,0,0,0,0,0,1,0
GOOGL,finnhub_news,Yahoo,Rumble App Now Includes Rumble Shorts on Android Following Google Approval,https://finnhub.io/api/news?id=162a3463bd4fa2dac92e6b4e034bf300de4c451e3b11a8e6cb3bb61624bd051a,2026-02-13T13:00:00+00:00,,6,positive,1,0,0,0,0,0,1,0,2,0,0,0,0
GOOGL,finnhub_news,Yahoo,Prediction: Alphabet Will Be a $5 Trillion Stock by the End of 2027,https://finnhub.io/api/news?id=05a1a21c078f75cb97b67dba8dbddbed2eb44761fdf7883e538218b3fc00a23e,2026-02-13T12:39:00+00:00,,3,neutral,0,0,0,1,0,0,0,0,0,0,0,0,1
GOOGL,finnhub_news,Yahoo,"Microsoft, Alphabet, Amazon, and Meta Platforms Just Announced Fantastic News for Nvidia.",https://finnhub.io/api/news?id=2daa4ba7616784a2e4c7c59474b7138c82d2ef563c5c0756e34502f7ea967d6c,2026-02-13T11:35:00+00:00,,3,positive,1,0,0,1,0,0,0,0,0,0,0,0,0
GOOGL,finnhub_news,Yahoo,Alphabet's $100 Billlion Century Bond Raises Eyebrows,https://finnhub.io/api/news?id=bd2779e37c2701d7a0cb5911646abfbfbf5bba19a6fc2c244e6b9da5b2c46103,2026-02-13T11:21:58+00:00,,3,neutral,0,0,0,0,0,0,0,0,0,0,0,0,0
GOOGL,finnhub_news,Yahoo,"Waymo Unveils 6th-Gen Driver, Eyes Scale",https://finnhub.io/api/news?id=8fcc33e8cbb2ce92ffdea3d88f055e0171cd8a30980f5aa0012c989ac8a8d549,2026-02-13T11:21:13+00:00,,3,neutral,0,0,0,0,0,0,0,1,0,0,0,0,0
GOOGL,finnhub_news,Yahoo,Autodesk (ADSK) Sues Google Over Trademark Infringement,https://finnhub.io/api/news?id=e27264b574cd26e26aa56712a447d442e475c56e44facf603acf839507c12e36,2026-02-13T10:17:58+00:00,,6,neutral,0,0,1,1,1,0,0,0,0,2,0,0,0
GOOGL,finnhub_news,Benzinga,"How To Trade SPY, QQQ, AAPL, MSFT, NVDA, GOOGL, META, TSLA Using Technical Analysis",https://finnhub.io/api/news?id=63f5deb79b557f4765119b813b8ccd26023f8c787acd61493582efe3fc634bdc,2026-02-13T09:46:26+00:00,,2,neutral,0,0,0,0,0,0,0,0,0,0,0,0,0
GOOGL,finnhub_news,Yahoo,Capgemini CEO dismisses calls for full European tech autonomy,https://finnhub.io/api/news?id=b4e12236af988b213a354e805e2785dfb0ef74fc2ad0a2696bdadae9354438e0,2026-02-13T09:09:08+00:00,,3,negative,0,2,1,1,0,1,0,0,0,1,1,0,0
GOOGL,finnhub_news,Benzinga,Rumble's Rumble Shorts Approved By Google Play,https://finnhub.io/api/news?id=1a2f6c64bcc6951eb65ea6e308df9109cb4cf4e3d226c14a67ef8e0a67098527,2026-02-13T09:03:08+00:00,,6,neutral,0,0,0,0,0,0,1,0,1,0,0,0,0
GOOGL,finnhub_news,Yahoo,"The Zacks Analyst Alphabet, Caterpillar,T-Mobile US and Onfolio",https://finnhub.io/api/news?id=3008e468fa5aa87eaebe1934ce837baba3ffa75a8755c4becfb69a2ebc569add,2026-02-13T08:41:00+00:00,,3,positive,2,0,1,1,0,0,0,0,0,0,0,1,0
GOOGL,finnhub_news,Yahoo,Intel Doubles Down On AI Chips Memory And Security With Google,https://finnhub.io/api/news?id=0821177ce14b643fe9ce42bf0507d51a27a3635d68950d7fa045439dfd5b9ebf,2026-02-13T03:13:40+00:00,,6,neutral,0,0,0,2,0,0,0,0,0,0,1,0,0
GOOGL,finnhub_news,Yahoo,1 Reason to Buy Alphabet Stock Hand Over Fist,https://finnhub.io/api/news?id=fd8cd6b4eca2a8c771da497d5eba4db0f92ad6d2467bc555a2f608241ea4ba1e,2026-02-12T23:10:00+00:00,,3,neutral,0,0,0,0,0,0,0,0,0,0,0,0,0
GOOGL,finnhub_news,Yahoo,"Amazon, Microsoft, and Alphabet Stocks Plummet on AI Investments. These 3 Stocks Are Set to Win.",https://finnhub.io/api/news?id=96e65da3df449780a87ccf0f573960ae2f8caeffd90fdd5298f34b4a471a2104,2026-02-12T22:25:00+00:00,,3,positive,1,0,0,1,0,0,0,0,0,0,1,0,0
GOOGL,finnhub_news,Yahoo,"Top Research Reports for Alphabet, Caterpillar & T-Mobile",https://finnhub.io/api/news?id=dc297ccae8b0ef8c8c56552d65c2bbc0030b8841939d5a5e7ae688f238440bb7,2026-02-12T21:48:00+00:00,,3,neutral,0,0,0,0,1,0,0,0,0,0,0,0,0
GOOGL,finnhub_news,Yahoo,"Unity CEO talks Google's Project Genie, Q4 earnings beat, & more",https://finnhub.io/api/news?id=63ae7e4666bab97f21daab42d41679ea331358c8a0e59d4a0298ee26c8f351fa,2026-02-12T21:33:38+00:00,,6,positive,1,0,3,0,0,0,0,0,0,0,0,0,0
GOOGL,finnhub_news,CNBC,Waymo is paying DoorDash gig workers to close its robotaxi doors,https://finnhub.io/api/news?id=10c1abc4f74b27ca9ba9d6f66b60957f198be3e08c429a992ab048c052a26d59,2026-02-12T21:10:42+00:00,,3,positive,1,0,0,0,0,0,0,3,0,0,0,0,0
GOOGL,finnhub_news,Yahoo,Google Tests AI Search Ads as Big Tech AI Spend Targets $650 Billion,https://finnhub.io/api/news?id=8e238749ad3850c6fe152d7581865c1dbee299436a4e324b2e7e045ecccd5533,2026-02-12T19:24:37+00:00,,6,neutral,0,0,0,2,2,0,0,0,0,0,1,0,0
GOOGL,finnhub_news,Yahoo,Google targeted by EU over online ad price practices unfair to advertisers,https://finnhub.io/api/news?id=a9651e83327f4056cb3d105f3f10cdcd1484e0b0a2b488ce7d1e8a67e049642c,2026-02-12T19:01:49+00:00,,6,negative,0,3,0,0,1,0,0,0,0,3,0,0,0
GOOGL,finnhub_news,Yahoo,Tom Russo's Strategic Moves: Alphabet Inc. Sees a -1.88% Portfolio Impact,https://finnhub.io/api/news?id=36ae42a7c6c5bb07df2525e3921c87208ea1e4773eda30b6787c9f23208bed70,2026-02-12T19:01:06+00:00,,6,neutral,0,0,1,0,0,0,0,0,0,0,0,0,0
GOOGL,finnhub_news,Yahoo,"Paramount CEO & Trump, Google Gemini 3 upgrade, mortgage rates fall",https://finnhub.io/api/news?id=8ad69c505d4e211d606e6253548f6edb1f6c9773a797c44a657476f9bf9f9351,2026-02-12T18:39:12+00:00,,6,neutral,1,1,0,1,0,0,0,0,0,0,0,1,0
GOOGL,finnhub_news,Yahoo,Google’s Waymo Rolls Out Robotaxis with China's Geely,https://finnhub.io/api/news?id=78ff1fb1c6d422b2b0c5207f6a859fb1589b8379558cd3ea84e6d470e1114cae,2026-02-12T18:23:50+00:00,,6,neutral,0,0,0,0,0,0,0,2,0,0,0,0,0
GOOGL,finnhub_news,Yahoo,Google Hit by EU Antitrust Probe Over Search Ads Pricing,https://finnhub.io/api/news?id=97f98532e505143acd02718ef763c3d20b9a04829957559988f614427b1080a9,2026-02-12T18:14:34+00:00,,6,negative,1,3,0,0,3,0,0,0,0,3,0,0,0
GOOGL,finnhub_news,Yahoo,"Google hit by fresh EU antitrust probe over search ads pricing, Bloomberg News reports",https://finnhub.io/api/news?id=b2068340cda7a6a997cabacd3f5d9d2ac2777e098f504adbd1d8bf5c3959f876,2026-02-12T17:51:36+00:00,,6,negative,0,3,0,0,3,0,0,0,0,3,0,0,0
GOOGL,finnhub_news,Yahoo,"Alphabet stock rises, outperforming tech sector amid Gemini AI update",https://finnhub.io/api/news?id=bd71d7a090f67a5ad11fe52085d859846cfb9c8e3db52cfba88c4811caa76a62,2026-02-12T17:24:36+00:00,,3,positive,3,1,0,2,0,0,0,0,0,0,0,1,0
GOOGL,finnhub_news,Yahoo,"Alphabet Drops 7% Post Q4 Earnings: Buy, Sell or Hold the Stock?",https://finnhub.io/api/news?id=f00417c5a65bcc89e9bb22678759ddd9f4e8598cd849a360bd8580d9cd47c8a2,2026-02-12T15:47:00+00:00,,3,neutral,1,1,1,1,1,1,0,0,0,0,1,0,0
GOOGL,finnhub_news,Yahoo,IDrive Launches Google Classroom Backup to Protect Digital Learning Data,https://finnhub.io/api/news?id=e49d2b0dd5a37496085108837d25341c68a665d9e62811471f7648e105eb5975,2026-02-12T15:30:00+00:00,,6,neutral,0,0,0,0,0,1,0,0,0,0,0,0,0
GOOGL,finnhub_news,Yahoo,"Waymo eyes 1 million paid rides per week as expansion accelerates, co-CEO says",https://finnhub.io/api/news?id=8c80f8342d195d6dac16fbae3c6c72a324b71d4d875935f3eb71ab78a2499865,2026-02-12T15:25:15+00:00,,3,neutral,0,0,0,0,0,0,0,2,0,0,0,0,0
GOOGL,finnhub_news,CNBC,"Alphabet 100-year bond concerns revolve on continued disruption, says Fundstrat's Hardika Singh",https://finnhub.io/api/news?id=74f276f6e3c74b78d8a9834ed82e2bfbb900b222394b52fad234241119876519,2026-02-12T14:52:17+00:00,,3,negative,0,1,0,1,0,0,0,0,0,0,1,0,0
GOOGL,finnhub_news,Benzinga,"UBS Maintains Neutral on Alphabet, Raises Price Target to $348",https://finnhub.io/api/news?id=5b95a60587023f3d9117add03c3d0b3f2f9322a6cca2729a796c20eaf1fa6d26,2026-02-12T14:02:41+00:00,,3,neutral,0,0,0,0,0,0,0,0,0,1,0,2,0
GOOGL,finnhub_news,Benzinga,'Google Hit by Fresh EU Antitrust Probe Over Search Ads Pricing'- Bloomberg,https://finnhub.io/api/news?id=e2e93008500b752b8cbaa439d8ced2f5897a624374e87cd0e6c746b3c069ce3d,2026-02-12T13:40:54+00:00,,6,negative,0,2,0,0,2,0,0,0,0,3,0,0,0
GOOGL,finnhub_news,Yahoo,Alphabet’s Century Bond And Wiz Deal Redefine Long Term AI Bet,https://finnhub.io/api/news?id=d69c01e1be5d89db44fc0b361506357a459fc3ac3e9ea51afc24c1f14061117b,2026-02-12T13:10:55+00:00,,3,neutral,1,1,1,1,0,2,0,0,0,2,3,0,0
GOOGL,finnhub_news,Benzinga,Google Releases A Major Upgrade To Gemini 3 Deep Think; Updated Gemini 3 Deep Think In Close Partnership With Scientists & Researchers To Tackle Research Challenges; New Deep Think Is Now Available In Gemini App For Google AI Ultra Subscribers And Available Via Gemini API To Select Researchers,https://finnhub.io/api/news?id=c127fb6ef617ef1918258853c97fcb400abea965fa7afe962faa74a46de8caaf,2026-02-12T12:22:20+00:00,,6,positive,1,0,0,3,1,0,0,0,0,0,0,1,0
GOOGL,finnhub_news,Benzinga,Waymo To Begin Fully Autonomous Operations With Its 6th-Generation Driver,https://finnhub.io/api/news?id=6a9d9c6288907c008702bb5f906a59446d02b8831318be5e73bd2c98780660b0,2026-02-12T12:10:29+00:00,,3,neutral,0,0,0,0,0,0,0,2,0,0,0,0,0
GOOGL,finnhub_news,Yahoo,Alphabet Issues 100 Year Bond Amid AI Spending Surge,https://finnhub.io/api/news?id=6e03b1d4f1835194c02d00bc64a36c327e49574535cbec0565183343e80c8e42,2026-02-12T11:26:15+00:00,,3,positive,1,0,0,1,0,1,0,0,0,0,2,0,0
GOOGL,finnhub_news,Yahoo,Think the AI Boom Is Slowing Down? Alphabet's Earnings Say Otherwise.,https://finnhub.io/api/news?id=ee60d8d21b1be2b198d76900e8a00daede1b9125be63dd4c13d5cbcc0cd7bd05,2026-02-12T11:05:00+00:00,,3,negative,1,2,1,1,0,0,0,0,0,0,1,0,0
GOOGL,finnhub_news,CNBC,Waymo begins deploying next-gen Ojai robotaxis to extend its U.S. lead,https://finnhub.io/api/news?id=f3df6ab0960effb4a34aaa0bc0b3159681b00809ce282a84d22c3c9ae00fd630,2026-02-12T11:00:02+00:00,,3,neutral,0,0,0,0,0,0,0,2,0,0,0,0,0
GOOGL,finnhub_news,SeekingAlpha,"Alphabet: Search Is Dead, Long Live Search",https://finnhub.io/api/news?id=2c22eeb0c67bfc43a9c40c8846568b356506d95908d0531579ecf3c7a7213f68,2026-02-12T10:37:23+00:00,,3,negative,0,1,0,1,1,0,0,0,0,0,1,0,0
GOOGL,finnhub_news,Yahoo,Alphabet's (NASDAQ:GOOGL) Earnings Are Weaker Than They Seem,https://finnhub.io/api/news?id=f86c3ac09357bc4b044495b8a761d04c565edaf4b3dbdff501319e38e8902da8,2026-02-12T10:29:22+00:00,,6,neutral,1,1,2,0,0,0,0,0,0,0,0,0,0
GOOGL,finnhub_news,SeekingAlpha,Alphabet: The CAPEX Shock Is A True Gift,https://finnhub.io/api/news?id=7053a49946f4a8864a382a242c0904847400bccf086b42310021fdd3b69ecc96,2026-02-12T09:00:00+00:00,,3,neutral,1,1,0,0,0,0,0,0,0,0,1,1,0
GOOGL,finnhub_news,Yahoo,"Amazon, Microsoft, and Alphabet All Reported Robust Cloud Growth. 1 Was a Clear Winner",https://finnhub.io/api/news?id=803639fb79b5d81c85cb9936d28e20a13cf739442e1268a3ee675e92ff21805d,2026-02-12T08:22:00+00:00,,3,positive,2,0,0,1,0,1,0,0,0,0,0,0,0
GOOGL,finnhub_news,SeekingAlpha,Google Cloud Is The New AWS: Why The Hyperscale Pecking Order Just Flipped,https://finnhub.io/api/news?id=7436b5705521d62c407dc3070701bcd834f80afbd448cac79f2b07651e2e214d,2026-02-12T08:15:00+00:00,,6,positive,3,0,1,1,0,2,0,0,0,0,0,1,0
GOOGL,finnhub_news,SeekingAlpha,CapEx Guidance Hides Alphabet's Emerging Agentic Infrastructure Big Edge,https://finnhub.io/api/news?id=e7c56e6a926f0b75ddecfc404be2a87e569f9350dfa936e0bcdc3ab7b5d9d7cf,2026-02-12T08:00:10+00:00,,3,neutral,0,0,1,0,0,0,0,0,0,0,2,0,0
GOOGL,finnhub_news,CNBC,Why Alphabet’s 100-year sterling bond is raising new fears over debt-fuelled AI arms race,https://finnhub.io/api/news?id=aa0cb7fdbd08fc8f36f3787119cfe742a3ea1842e45b9820e25cbd37c239aebb,2026-02-12T05:09:46+00:00,,3,neutral,0,0,0,1,0,0,0,0,0,0,1,0,0
GOOGL,finnhub_news,SeekingAlpha,GGLL: Leveraged Strategy To Strategically Trade GOOGL's Growth Momentum,https://finnhub.io/api/news?id=13592c257edf8aa861de631155b7ada0f04f8e0dc6bb3f22055f5ebe8c02627f,2026-02-12T04:56:21+00:00,,4,positive,1,0,0,0,0,0,0,0,0,0,0,0,0
GOOGL,finnhub_news,Benzinga,"Google DeepMind CEO Demis Hassabis Says AI Will Usher In 'New Golden Era Of Discovery' Within 15 Years, Transforming Medicine, Energy, Space",https://finnhub.io/api/news?id=58e5660ef43c55174fcf228e38584890442743d2295ecd9fdaf38d28491e3b7f,2026-02-12T04:52:13+00:00,,6,neutral,0,0,0,2,0,0,0,0,0,0,0,0,0
GOOGL,finnhub_news,Yahoo,Alphabet Stock: Is It Time to Buy the Dip?,https://finnhub.io/api/news?id=811d3c4acad0697897f089f2c25caff641366641e85855709ca422c9754f33b3,2026-02-12T04:01:00+00:00,,3,neutral,0,0,0,0,0,0,0,0,0,0,0,0,0
GOOGL,finnhub_news,Yahoo,Elizabeth Warren 'Pushing For Answers' After Google Turns Gemini Into An AI Shopping Assistant: Senator Says It Could Lead To Consumer Manipulation,https://finnhub.io/api/news?id=f5b2ff931d95dd402ae313731a8011ad7cbd7bd826ec29973fdd4775929b7fe1,2026-02-12T03:31:08+00:00,,6,negative,0,1,0,3,0,0,0,0,0,1,1,0,0
GOOGL,finnhub_news,Yahoo,Google Backs TeraWulf Shift From Bitcoin Mining To AI Data Centers,https://finnhub.io/api/news?id=81b60960aa2b7eebfd334e6ab099605be6ce9de16e8d516530f85c9830628c55,2026-02-12T03:18:35+00:00,,6,neutral,0,0,0,1,1,1,0,0,0,0,2,0,0
GOOGL,finnhub_news,Benzinga,"Waymo Mulls $2.5 Billion Agreement To Procure 50,000 Hyundai Ioniq 5 Robotaxis By 2028: Report",https://finnhub.io/api/news?id=03a8b1d58f6d9971e01d5bf4825e0e9c9ace84261ae84606788965623999c973,2026-02-12T01:21:30+00:00,,3,neutral,0,0,0,0,0,0,0,3,0,0,0,0,0
GOOGL,finnhub_news,Yahoo,What is Google's Project Genie?,https://finnhub.io/api/news?id=e9aad65c917645b6c434a9044bfd6a5a30a94ac1204a53c8e09f881a520cc73d,2026-02-11T22:50:50+00:00,,6,neutral,0,0,0,0,0,0,0,0,0,0,0,0,0
GOOGL,finnhub_news,Yahoo,"Alphabet’s Gemini (GOOGL) “Came Out of Nowhere,” Says Jim Cramer",https://finnhub.io/api/news?id=ac85264676979c2ea01a82b3431286562b7ec72833f732047ce6f6f1ecad1f75,2026-02-07T16:07:45+00:00,,6,positive,1,0,3,1,0,0,0,0,0,0,0,1,0
GOOGL,finnhub_news,CNBC,"Nearly a thousand Google workers sign letter urging company to divest from ICE, CBP",https://finnhub.io/api/news?id=ee9882a8400d551394db5e679a9034338c71cda3f533a68c09b1d96404317584,2026-02-07T10:43:59+00:00,,6,neutral,0,0,0,0,0,0,0,0,0,0,0,0,0
GOOGL,finnhub_news,SeekingAlpha,"Alphabet Is Back, But Elevated AI CapEx Risks Are Also Worrying",https://finnhub.io/api/news?id=392443317dc97eb7df7b727d11581b779b45ebaf3720f701c55ae3b0d026357b,2026-02-07T07:53:48+00:00,,3,negative,0,1,2,1,0,0,0,0,0,0,1,0,0
GOOGL,finnhub_news,Yahoo,"Jim Cramer Says “Google Spent to Defeat Bing and All Other Comers, I Think It’s Doing It Again.”",https://finnhub.io/api/news?id=537ac0127b5c165a4abecd8d5b5290aba9a71e641ea759221b2b6950fb41baa5,2026-02-07T05:56:45+00:00,,6,neutral,0,0,1,1,0,0,0,0,0,0,0,0,0
GOOGL,finnhub_news,Yahoo,Broadcom’s AI Role Expands With Alphabet Capex And New Wi Fi 8,https://finnhub.io/api/news?id=b27b3bac3d4221e9195985b66d09ce513c95db75b5791ea7cc83e3bb6be64203,2026-02-07T03:09:16+00:00,,3,neutral,0,0,0,1,0,0,0,0,0,0,4,0,0
GOOGL,finnhub_news,Benzinga,"NFL May Sell Live Games To Streaming Platforms After $100 Million YouTube Deal, Raising Stakes For Disney, NBC And Traditional Partners",https://finnhub.io/api/news?id=368508687fc1d49653a3f6d3886b7e1a36159ed90d2243408b0b26e09d70ed91,2026-02-07T02:58:50+00:00,,3,positive,1,0,0,0,0,0,2,0,0,0,0,0,0
GOOGL,finnhub_news,Yahoo,"Alphabet CEO Sundar Pichai Says AI Capacity Is What 'Keeps Us Up At Night' As Power, Land And Supply Chain Limits Test Growth",https://finnhub.io/api/news?id=3959a07b1184a752cd7da5f097460b3d7f45177dd2476e1f9e8ae3b92fb2f4e6,2026-02-07T02:31:55+00:00,,3,neutral,1,1,3,1,0,0,0,0,0,0,0,1,0
GOOGL,finnhub_news,Yahoo,Alphabet’s Record AI And Waymo Investment Resets Long Term Expectations,https://finnhub.io/api/news?id=7584864c11425c8bda75dcafd2d66e147dfb66d5ea1edc982465747d67b60904,2026-02-07T00:17:35+00:00,,3,positive,1,0,1,1,0,0,0,2,0,0,2,0,0
GOOGL,finnhub_news,Yahoo,Alphabet Investors Just Got Fantastic News From Amazon CEO Andy Jassy,https://finnhub.io/api/news?id=d33b7a5cc9747b75e43f87bf04ee7855eee8965e9eac85f6ecd61721fc01194a,2026-02-06T21:04:59+00:00,,3,neutral,0,0,0,0,0,1,0,0,0,0,0,0,0
GOOGL,finnhub_news,Yahoo,Amazon and Alphabet: Top AI Stocks Powering the Next Wave,https://finnhub.io/api/news?id=ed389eba09bad57b009a7b533f739cadc163cbec62a8ba8d5827917b6465f8f8,2026-02-06T19:03:00+00:00,,3,neutral,0,0,0,1,0,0,0,0,0,0,0,0,0
GOOGL,finnhub_news,Yahoo,Bank of America resets Google stock forecast post-earnings,https://finnhub.io/api/news?id=d4dd3a3b15ff8a623a1eb7ecbbda34f26e34df4faa5b040fe9779ae2d4d3aeda,2026-02-06T18:17:00+00:00,,6,positive,1,0,1,0,0,0,0,0,0,0,0,2,0
GOOGL,finnhub_news,Yahoo,Waymo Taps Genie 3 to Accelerate Robotaxi Expansion,https://finnhub.io/api/news?id=000b908305cf172b1507d36e143a0ebc9629b5bef529c077268a3d17a47b7af7,2026-02-06T17:28:26+00:00,,3,neutral,0,0,0,1,0,0,0,3,0,0,0,0,0
GOOGL,finnhub_news,Yahoo,1 Stock That Could Join Nvidia and Alphabet in the $4 Trillion Club by 2032,https://finnhub.io/api/news?id=a64eb94e0472cd32f8bdca86376ce60c9620097c43f98600f24ebd5dccfc9468,2026-02-06T17:20:00+00:00,,3,neutral,0,0,0,0,0,0,0,0,0,0,0,0,0
GOOGL,finnhub_news,Benzinga,Google Vs. Amazon Vs. OpenAI Vs. Anthropic: Super Bowl Commercials Ramp Up AI Battle,https://finnhub.io/api/news?id=367e5da10c0a05b6b501e61f8717b97e06ed6b155b66cc0e656bf57844b85008,2026-02-06T16:55:38+00:00,,6,neutral,0,0,0,2,1,0,0,0,0,0,0,0,0
GOOGL,finnhub_news,Yahoo,"Stock Market Divided With S&P 500, Nasdaq Below Key Levels; Google, Amazon AI Spending Stuns: Weekly Review",https://finnhub.io/api/news?id=c4f01e9c3b1e9347fe44c5aebf77b2ab32da7d2a01ca88e972e382c4373c8518,2026-02-06T16:27:45+00:00,,4,neutral,0,0,0,1,0,0,0,0,0,0,1,0,0
GOOGL,finnhub_news,Yahoo,Alphabet and Microsoft: Billion Dollar AI Bettors,https://finnhub.io/api/news?id=72f273be15a51900aabc8049fcc91e57eaf465eb7f4f5a4cda270d98c592ab71,2026-02-06T16:15:00+00:00,,3,neutral,1,1,1,1,0,0,0,0,0,0,0,0,0
GOOGL,finnhub_news,Yahoo,Why Celestica is a Massive Winner from Google’s CapEx Bonanza,https://finnhub.io/api/news?id=f8eac6c3cd7f30ebb7a220730dabb33de502798e62bef2856d75f9bc2122a4de,2026-02-06T14:42:37+00:00,,6,positive,1,0,4,0,0,0,0,0,0,0,3,0,0
GOOGL,finnhub_news,Yahoo,Waymo’s Self-Driving Cars Zoom Into the Spotlight at Super Bowl,https://finnhub.io/api/news?id=8332805e66e04fef78e8b80f107d7ed7d9f3c3cf968b80835c3ea3bc7db249aa,2026-02-06T14:00:00+00:00,,3,positive,1,0,0,0,0,0,0,3,0,0,0,1,0
GOOGL,finnhub_news,Yahoo,TTM Technologies Could Be One of the Biggest Winners from Google’s $185 Billion Capex Plan,https://finnhub.io/api/news?id=fa7f8362199ccbbd68a3108b2a75422ba00fb56cb84fd16cbfd0770931c4c08b,2026-02-06T13:51:18+00:00,,6,positive,1,0,0,1,0,1,0,0,0,0,5,0,0
GOOGL,finnhub_news,Yahoo,Alphabet (GOOG): One of the Biggest Beneficiaries of the AI Transition,https://finnhub.io/api/news?id=6412bab2315713a80399a6c1a777b82bdb2b033bb8f956604c7e85d53d2b4b7a,2026-02-06T13:41:51+00:00,,6,neutral,0,0,1,1,0,0,0,0,0,0,0,0,0
GOOGL,finnhub_news,Benzinga,"Argus Research Maintains Buy on Alphabet, Raises Price Target to $385",https://finnhub.io/api/news?id=9832c635d0c57f21f41dcad6f651ed8107d6e3cfef76f9054ca24530ce748142,2026-02-06T13:05:26+00:00,,3,neutral,0,0,0,0,1,0,0,0,0,0,0,2,0
GOOGL,finnhub_news,Yahoo,Alphabet price target raised to $395 from $346 at Stifel,https://finnhub.io/api/news?id=4a31c115c7c6b3dbc8a75345030c6343b232e5cb866eade7d79957d09eae7f9e,2026-02-06T13:02:03+00:00,,3,positive,3,0,3,2,0,1,0,0,0,0,0,3,0
GOOGL,finnhub_news,Yahoo,Top Funds Like Google — But Go Bonkers For These Three Stocks,https://finnhub.io/api/news?id=e49b7547aade1dbba6cd7f0e4cccdd6b8e19c012a15389368bea08c3c1996a8d,2026-02-06T13:00:36+00:00,,6,neutral,0,0,0,0,0,0,0,0,0,0,0,0,0
GOOGL,finnhub_news,Benzinga,Waymo Uses DeepMind's Genie 3 AI For Its Waymo World Model,https://finnhub.io/api/news?id=696426f72f6910c2e33bc0caed6ec66a575940eafe399fbfd17651cd522ddba6,2026-02-06T12:17:46+00:00,,3,neutral,0,0,0,3,0,0,0,2,0,0,0,0,0
GOOGL,finnhub_news,Benzinga,"Jim Cramer Says 'I Will Defend Amazon' After $200 Billion Spending Plan Triggers Selloff, Calls Google 'The Prize'",https://finnhub.io/api/news?id=40d7be50b3d2aaee5f88ad4e1d7e9690bd61f9f9d7e19eff5df6693f08297fef,2026-02-06T12:16:21+00:00,,6,neutral,0,0,0,0,0,0,0,0,0,0,1,0,0
GOOGL,finnhub_news,Yahoo,"Zacks Investment Ideas feature highlights: Alphabet, Nvidia and Apple",https://finnhub.io/api/news?id=5d69f5eca22d12232e21287fff0280714edb6d619c7e5210a8cc5532ac620c77,2026-02-06T11:46:00+00:00,,3,positive,1,0,2,1,0,0,0,0,0,0,0,0,0
GOOGL,finnhub_news,Yahoo,"Zacks Investment Ideas feature highlights: Alphabet, Amazon, AMD, Nvidia, Simon Property and Teradyne",https://finnhub.io/api/news?id=cce38c80a6550dcfd2fe38544383e2cad3973b42c16a8e2ec06d5d5b8b5b8604,2026-02-06T11:42:00+00:00,,3,positive,3,0,2,0,0,0,0,0,0,0,0,0,0
GOOGL,finnhub_news,SeekingAlpha,Why Alphabet Will Likely Leapfrog Nvidia To Become World's Most Valuable Company,https://finnhub.io/api/news?id=adfbf69256ff00bc2f29fb25ed0c4d3bcfb20771d6c5dae63d6ab2aa77307a57,2026-02-06T11:36:26+00:00,,3,neutral,0,0,0,0,0,0,0,0,0,0,0,0,0
GOOGL,finnhub_news,Benzinga,"Big Tech Core: New Burney ETF Packs Apple, Nvidia, Google, Broadcom Punch",https://finnhub.io/api/news?id=8a88984530a0c920e3f22e50961642a8a28bc78363068b595254501a43678bd1,2026-02-06T11:33:55+00:00,,4,neutral,0,0,0,0,0,0,0,0,0,0,0,0,0
GOOGL,finnhub_news,Benzinga,"How To Trade SPY, QQQ, AAPL, MSFT, NVDA, GOOGL, META, TSLA Using Technical Analysis",https://finnhub.io/api/news?id=4f2697e46f0d355b36d58838bbe7260cffdeacb749cdfa9391fb06a553b2b005,2026-02-06T11:09:30+00:00,,2,neutral,0,0,0,0,0,0,0,0,0,0,0,0,0
GOOGL,finnhub_news,Yahoo,Clear Ads Integrates Google's Updated Trends Platform into Its Keyword Research Process for E-Commerce Clients,https://finnhub.io/api/news?id=3a737cfec48e17810a824fce0ac67cdaf77f2a39866110ea67c5020aa43e90ce,2026-02-06T11:07:00+00:00,,6,positive,1,0,0,2,3,0,0,0,0,0,0,0,0
GOOGL,finnhub_news,Benzinga,Alphabet's Outlook In Focus As AI Budget Doubles; Shares Slip,https://finnhub.io/api/news?id=d073acf42fad10e75443a5daf9db68a4d06b1a6283405465812cf1c5998a1f4d,2026-02-06T10:47:14+00:00,,3,neutral,0,0,0,1,0,0,0,0,0,0,0,0,0
GOOGL,finnhub_news,SeekingAlpha,"Amazon And Google Signal A $385 Billion 'Supercycle', While ECB Prepares For A Fed Shock",https://finnhub.io/api/news?id=0350ab58f7feb1a4e5a3c9e67fb80c0c6048adf8fb4212969300b1d40e0bbbcc,2026-02-06T10:30:00+00:00,,6,neutral,0,0,0,0,0,0,0,0,0,0,0,0,0
GOOGL,finnhub_news,Benzinga,"'Google and Microsoft offer lucrative deals to promote AI, but even $500,000 won't sway some creators' - CNBC",https://finnhub.io/api/news?id=cd77a3bfe142835f5d72b386710d59e88f8af5947f0c5bbeac9fb44b3d5e166a,2026-02-06T09:22:53+00:00,,6,neutral,0,0,0,0,0,0,1,0,0,0,0,0,0
GOOGL,finnhub_news,Yahoo,5 Reasons to Buy Google Parent Alphabet Stock on the Dip,https://finnhub.io/api/news?id=2b0fbeefa9c53a2947a9c25bf42b8448a495785020347a22d4ae67a6e46f39af,2026-02-06T09:05:00+00:00,,6,neutral,0,0,0,0,0,0,0,0,0,0,0,0,0
GOOGL,finnhub_news,Yahoo,"EnBW, Google sign PPA for 100MW clean power supply in Germany",https://finnhub.io/api/news?id=f4f0f9ab68716934f534831094005a9dc0c2ff3c5b76ed89805bea8365b068e6,2026-02-06T08:57:42+00:00,,6,neutral,0,0,0,0,0,0,0,0,0,0,0,0,0
